,Date,Tweet
282,2020-11-02 07:46:32+00:00,b'Pen bilang ke dal mi :\nmon maap emang iya!!!!!!!!! #StartUpEp6 https://t.co/32nqJ7llAm'
283,2020-11-02 07:44:51+00:00,b'gemesss banget woii \xf0\x9f\xa4\xa9 #StartUp #StartUpEp6 https://t.co/szmMUuguGw'
284,2020-11-02 07:33:37+00:00,b'461 pesan\xf0\x9f\x98\xad pulsa Dalmi ada brpa ya smpe bs ngirim sgtu banyak\xf0\x9f\x98\xad\xf0\x9f\x98\xad #StartUpEp6 https://t.co/xSZpiad2FB'
285,2020-11-02 07:30:51+00:00,b'ini kenapa samsan tech main juga di search dah \xf0\x9f\xa4\xa3\n#StartUpEp6 #SearchEp6 https://t.co/gOgzDQezrf'
286,2020-11-02 07:27:11+00:00,b'ni syp c? pnasaran bgt sumpah\xf0\x9f\x98\xad #StartUpEp6 https://t.co/JSJPKMT5eM'
287,2020-11-02 07:24:23+00:00,b'BENERAN ITU INJAE GAK SIH? KOK GW GA YAKIN YA #StartUpEp6 https://t.co/DFilP6Kzmt'
288,2020-11-02 07:23:36+00:00,b'Chul san sumpah overrr time mata dia kena susu lepastu pergi hospital tu sumpah overr \xf0\x9f\xa4\xa3\xf0\x9f\x98\xad\xf0\x9f\xa4\xa3\xf0\x9f\xa4\xa3\xf0\x9f\xa4\xa3\xf0\x9f\xa4\xa3 #StartUpEp6'
289,2020-11-02 07:23:26+00:00,b'Ish dosan ngapa bertahan sama kebohongan sihhh \xf0\x9f\x98\xb5 #StartUpEp6 #StartUp https://t.co/gff3M7JaeF'
290,2020-11-02 07:21:37+00:00,"b'di eps ini Dosan udah mulai menonjol karakter.a, kutebak dia bakal jd peran penting bagi nenek.a dalmi, soal.a pegang rahasia \n#StartUpEp6'"
291,2020-11-02 07:18:34+00:00,b'gabisa berhenti ketawa\xf0\x9f\x98\xad\xf0\x9f\x98\xad\xf0\x9f\x98\xad #StartUpEp6 https://t.co/N34Q1Cg0xx'
292,2020-11-02 07:15:38+00:00,"b'Dalmi : Dosan aa kamu adalah saham ku, kita harus bersama sampai akhir\nDosan : halmoni ada?\nDalmi : ada mungkin, kenapa?\nDosan : mau ngelamar aja udah\xf0\x9f\xa4\xaa\n\n#StartUpEp6 https://t.co/q84u44GgfQ'"
293,2020-11-02 07:08:23+00:00,"b'Setelah 6 eps, ak memutuskan naik kapal dosandalmi tp ttp jipyong gx boleh jd sad boi \n#StartUpEp6 https://t.co/rxgV4AWf67'"
294,2020-11-02 06:52:10+00:00,b'Part terngakak menurut Kyeo nih \xf0\x9f\xa4\xa3\xf0\x9f\xa4\xa3\xf0\x9f\xa4\xa3\n\n#StartUpEP6 #StartUp #drakor #dramakorea #ongoing https://t.co/fdztjvPZtn'
295,2020-11-02 06:52:02+00:00,"b'Makin kesini aku gasuka lihat nam joo hyuk aka nam do san yang asli \xf0\x9f\x98\x85 #StartUpEp5 #StartUpEp6 ! Dan makin kesini sampe didetik terakhir episod 6, aku makin cinta sama nenek dalmi. Ya Allah dia itu tuluuuus banget dan cobaan nya berat banget kalo dipikir \xe2\x98\xb9\xf0\x9f\x98\xad'"
296,2020-11-02 06:47:14+00:00,b'Tangna! Si Dal-mi dapat yon! #StartUpEp6'
297,2020-11-02 06:43:11+00:00,"b'/spoiler/\nKusudah yakin bocah yg main ayunan itu emang dalmi, tapi knapa injae nulis alasan mndaftar program di sandbox ""aku ingat bermain ayunan diatas pasir yg ditaruh ayahku agar aku tak terluka"" di eps.4 klo gasalah, ternyata biar di mentorin sama bu yoon anjerrr\n#StartUpEp6 https://t.co/Y3RsNhMKDr'"
298,2020-11-02 06:34:36+00:00,b'GEMESIN BGT MEREKA SKSKSKKSSK\n#StartUpEp6 https://t.co/AyslujQh6I'
299,2020-11-02 06:29:35+00:00,b'aku suka dosan aku suka han ji pyeong\n\nJipyeong be lyke : \n#StartUpEp6  #StartUp \n#NamJooHyuk #KimSeonHo https://t.co/ODTn9UoVun'
300,2020-11-02 06:28:43+00:00,b'Tak suka Won In Jae #StartUpEp6'
301,2020-11-02 06:28:04+00:00,"b'Dari ini sadar,\n\nKlo setelan jas (single or double breasted)\nInner nya kaos hitam\nSepatunya tipe loafers or slip on,\n\nEmg gk bsa resist.\n\n&amp; sesuai caption yg di retweet, mncoba jalur lurus, first lead with first lead,\nTapi kok, second lead lebih mengoda \xf0\x9f\xa4\xa3\xf0\x9f\xa4\xa3 #StartUpEp6 #StartUp https://t.co/LCddgnwraF'"
302,2020-11-02 06:25:25+00:00,b'Kirain w doang yg ga mood ngapa ngapain gegara #StartUpEp6 \xf0\x9f\x98\x8c https://t.co/EDH38JrVOm'
303,2020-11-02 06:20:12+00:00,b'Baru sempet nonton #StartUpEp6 \n\nMr Han ji pyeong waktu nerangin saham keren sekaleeee\xf0\x9f\x91\x8d\xf0\x9f\x91\x8d\n\nWaktu serius kerennya tumpah-tumpah \xf0\x9f\x92\x95\n#\xec\x8a\xa4\xed\x83\x80\xed\x8a\xb8\xec\x97\x85 #\xed\x95\x9c\xec\xa7\x80\xed\x8f\x89 #\xea\xb9\x80\xec\x84\xa0\xed\x98\xb8 #KimSeonHo'
304,2020-11-21 18:08:30+00:00,"b'A man and a butterfly have pleasant, interlocking dreams. Read our latest story at https://t.co/lerRpbz1Ld.'"
305,2020-11-02 06:18:29+00:00,"b'4 momen suzy mengekspresikan sosok dalmi dgn berbagai emosi. Putus asa, marah, sok tegar, frustasi. \xf0\x9f\x92\x94\xf0\x9f\x98\xaditulah yg gue rasain pas scene ini. #StartUpEp6  #StartUp #Suzy https://t.co/ssIP6QRYKt'"
306,2020-11-02 06:17:17+00:00,b'Bengekkk\xf0\x9f\x98\xad jipyeong aja gemes sama dosan wkwk\xf0\x9f\x98\x82\xf0\x9f\x98\x82 #StartUpEp6 https://t.co/7yW3cQz1yn'
307,2020-11-02 06:13:08+00:00,b'Benci banget anjir #StartUpEp6 bikin makin bingung aslinya si Injae apa Dalmi yang naik ayunan'
308,2020-11-02 06:12:48+00:00,b'kok dia banyak mau nya sih\xf0\x9f\x98\xbf #StartUpEp6 https://t.co/ozxH0N6F8b'
309,2020-11-02 06:11:18+00:00,"b'Di awal sebelum uji tuntas,  mereka cenderung agak naif,  tapi ya wajar karena mereka juga baru pertama kali terjun ke dunia bisnis. Bener sih,  ya investor mana yang mau berinvestasi di  perusahaan yang gak ada titik central kekuatannya. \n\n#StartUpEp6 #StartUp https://t.co/lxrkUl4z7e'"
310,2020-11-02 06:10:49+00:00,b'knetz se antusias kita ga si sama start up? \xf0\x9f\xa5\xba\xf0\x9f\xa5\xba#StartUpEp6'
311,2020-11-02 06:06:11+00:00,b'RT @InkubatorU JUAL #RajaMotor Karpet Motor Plat Yamaha NMax Almunium Motif - Merah - Aksesoris Motor\nhttps://t.co/kfPxvMswVZ\nhttps://t.co/kfPxvMswVZ\nhttps://t.co/kfPxvMswVZ\n\xf0\x9f\x98\x8d\xf0\x9f\x98\x8d\xf0\x9f\x98\x8d\n#RajaMotorOnline \nSPILL THE TEA\nAir 2x\nSECRET NUMBER GOT THAT BOOM\n#StartUpEp6\n#MUNARS https://t.co/OxQS9R5T5O'
312,2020-11-02 06:05:44+00:00,b'RT @InkubatorU JUAL #RajaMotor Karpet Motor Plat Yamaha NMax Almunium Motif - Merah - Aksesoris Motor\nhttps://t.co/pM1snvPnzP\nhttps://t.co/pM1snvPnzP\nhttps://t.co/pM1snvPnzP\n\xf0\x9f\x98\x8d\xf0\x9f\x98\x8d\xf0\x9f\x98\x8d\n#RajaMotorOnline \nSPILL THE TEA\nAir 2x\nSECRET NUMBER GOT THAT BOOM\n#StartUpEp6\n#MUNARS https://t.co/P9WSmYSoNY'
313,2020-11-02 06:03:28+00:00,b'Merasa ingin connecting the dots. \nAku perlu rewatch ep 1-6 btw \xf0\x9f\x98\xac\n#StartUpEp6'
314,2020-11-02 06:01:15+00:00,b'Bunda Mixed Feeling nih baca pendapat rangorang soal Kakaknya Dalmi. #StartUpEp6 #StartUp https://t.co/j3D7oGM6Rp'
315,2020-11-02 05:56:26+00:00,"b'Memang faktanya, kita harus memilih satu bukan memiliki keduanya. Kalimat ini kaya buat orang yang gak enakan sama orang lain, padahal kalau pengen maju dia harus berani.\n\n#StartUpEp6 #StartUp https://t.co/gEDCTQpCyb'"
316,2020-11-02 05:50:56+00:00,b'#StartUpEp6 kzl dah ama temen-temennya dosan gegara pembagian saham...'
317,2020-11-02 05:50:56+00:00,"b'Belajar dari reply88, kayanya orang-orang tuh lebih suka yg tsundere. Padahal to the point kaya nam dosan adalah koentji. #StartUpEp6'"
318,2020-11-02 05:50:29+00:00,b'Gils masih trending aja #StartUpEp6\nReply 1988 jg trending lagi!'
319,2020-11-02 05:50:11+00:00,b'SamSan Tech Adalah gabungan dari nama antara CEO&amp;anggota yaitu NamDo(San) sbgai CEO dan Kim young(San) sbgai anggota perusahaan.Terakhir Tech yg berarti technologi yg mn SamsanTech menjalani program IA yuk ikutan ga #NamDoSanxStartUp\n#SamSanTechAreTheFuture\n#StartUpEp6 https://t.co/Rh7KI6AmLs'
320,2020-11-02 05:47:44+00:00,b'Pengakuan mahasiswa yang demo tidak paham UU cipta kerja\nDukung RUU cipta kerja #orangkayagaktau\nReply 1988 Manchester United #StartUpEp6\n#BongkarMafiaRegulasi\n#BarisanProKerja https://t.co/LANZFvooim'
321,2020-11-02 05:47:06+00:00,b'Episode #StartUpEp6 penuh kejutan ih'
322,2020-11-02 05:46:23+00:00,"b'Sobat twitter yg baik hatinya, bantu search di Google dong, apakah ""pelajaran bisnis dari drama startup""\n\nCampusnesia sudah masuk halaman 1 Google?\n\n#StartUpEp6 #StartUpEp5'"
323,2020-11-02 05:45:27+00:00,b'HAN JI PYEONG BEST BOI #StartUpEp6'
324,2020-11-02 05:44:49+00:00,b'Ang GANDA TALAGA! \xf0\x9f\x98\x8d\xf0\x9f\x98\xad Kinikilabutan ako\n#StartUp\n#StartUpEp6'
325,2020-11-02 05:43:53+00:00,"b'Belajar dari #StartUpEp6\nDalam bisnis  ada hal yang tidak  bisa di bayar  dengan uang  seperti kepercayaan ,relasi ,dan balas budi dll\n.\nBener si ini https://t.co/uzODMzxkoE'"
326,2020-11-02 05:43:40+00:00,"b'ini kira kira siapa ya? feeling aku sih dari tim nya samsan juga dah, tapi idk juga wkwkwkwk, ada yang punya teorinya gak \xf0\x9f\x99\x82\n\n#StartUpEp6 https://t.co/bPWmJgxigh'"
327,2020-11-02 05:37:58+00:00,b'Daebak #StartUpEp6 jd penasaran ada apa dengan CEO Sandbox?'
328,2020-11-02 05:37:27+00:00,b'Pak hannnn #StartUpEp6 https://t.co/dSyXaEqbrf'
329,2020-11-02 05:37:26+00:00,"b'salah satu scene yang paling greget selama nonton #StartUpEp6, kita semua pasti punya teman kerja yang mirip sama Jung Sa-Ha, si mau maunya sendiri, perfectionist, tapi kerjanya minim. BTW cara Dalmi menghadapi dia, super keren \xf0\x9f\x98\xad\xf0\x9f\x98\xad https://t.co/zzcvMmyeuC'"
330,2020-11-02 05:35:38+00:00,b'Ang sakit \xf0\x9f\xa5\xba\xf0\x9f\x92\x94 #StartUpEp6 https://t.co/3uzHCN3pgI'
331,2020-11-02 05:34:14+00:00,b'dan the fact that #StartUpEp6 In-jae nyebelin abis di ep6 bikin nyesel bgt getting too attached to an on going series... should have waited until it\xe2\x80\x99s finished baru marathon nonton drpd kyk gini jd sebel sendiri HUH https://t.co/xDLFSdt8eO'
332,2020-11-02 05:32:41+00:00,b'Second lead syndrom? Terlambat... Sudah biasa dari jaman Han YiAn &amp; Go Hyemi \n\xf0\x9f\x98\x87\xf0\x9f\x98\x87\xf0\x9f\x98\x87\n#NamJooHyuk#Suzy\n\n#StartUpEp5\n#StartUpEp6 https://t.co/f3xHAKdNkO'
333,2020-11-02 05:32:13+00:00,b'Writernim terngukuk melihat komenan netijen \xf0\x9f\x98\x8c \n\n#StartUpEp6 https://t.co/QNW6UNDeLl'
334,2020-11-02 05:32:12+00:00,"b'baru kali ini nonton drama ga pengen main lead aktornya jadian sama main lead actress, alias nam do san ke laut aja #StartUpEp6'"
335,2020-11-02 05:32:05+00:00,b'Di mauubusan ng twist #StartUpEp6 https://t.co/RZIVfPlu7B'
336,2020-11-02 05:30:39+00:00,"b'Nonton Film 365 Days Sub Indo, Klik di Sini. Trending Black Mamba BIGBANG SECRET NUMBER GOT THAT BOOM #OleOut #StartUpEp6 Hobi Hari Senin #temanmain #temanmaindotcom https://t.co/JoEHquCQGT https://t.co/7XEYlwQ1Tl'"
337,2020-11-02 05:30:28+00:00,b'@szrbsz Mau ktmu CEO sebening Dalmi dan Developer secakep Dosan jg d disana.. motifnya uda ga bner *ditimpuk massal*\n#StartUpEp6 #StartUp'
338,2020-11-02 05:29:02+00:00,"b'Pantas Bisa Bikin Gempa di Ranjang, Olahraga Angela Lee Kayak Gini. Trending Black Mamba BIGBANG SECRET NUMBER GOT THAT BOOM #OleOut #StartUpEp6 Hobi Hari Senin #temanmain #temanmaindotcom https://t.co/Bw2q2nkLtO https://t.co/2SCTEQ7rg6'"
339,2020-11-02 05:28:21+00:00,b'Bikin Salfok! Berlliana Lovell Foto di Kolam Renang: Gunungnya Bagus Ya. Trending Black Mamba BIGBANG SECRET NUMBER GOT THAT BOOM #OleOut #StartUpEp6 Hobi Hari Senin #temanmain #temanmaindotcom https://t.co/zyVwRX3InC https://t.co/nbc5hlKvpL'
340,2020-11-02 05:27:33+00:00,"b'Tampan sekali pak Mentor satu ini,apalagi make baju item damage banget, jadi keingetan sama mas ganteng depan rumah wkwkwk #StartUpEp6 https://t.co/KIWonIpDyg'"
341,2020-11-02 05:27:13+00:00,"b'Anindita Hidayat Selebgram Cantik Angkat Beban, Netizen: Banting Aku Kak! Trending Black Mamba BIGBANG SECRET NUMBER GOT THAT BOOM #OleOut #StartUpEp6 Hobi Hari Senin #temanmain #temanmaindotcom https://t.co/vRii5LXGl2 https://t.co/gMRFl9wpLx'"
342,2020-11-02 05:25:39+00:00,b'@szrbsz Sandboxnya Indonesia bs diblg ya Rub?\n#StartUpEp6 #StartUp'
343,2020-11-02 05:24:09+00:00,b'Mau bahas #StartUpEp6 tapi ntar aja deh soree'
344,2020-11-02 05:23:43+00:00,"b'#StartUpEp6 suka sama karakter jipyeong dia tegas, kata katanya sengit judes walaupun bgtu bisa dijdiin motivasi buat jauh lebih baik lagi dari sebelumnya + biar kuat mental nya.gak tega kalau jipyeong jdi sadboy dsni https://t.co/IuI93gzVJU'"
345,2020-11-02 05:22:57+00:00,b'ANG GANDA NG START UP!! #StartUpEp6'
346,2020-11-02 05:21:33+00:00,"b'#StartUpEp6 sukak bgt ama han ji pyeong, tp greget aja knp ga jjur dr awal ttg surat itu. Pdhal aku dkung dia ama dalmi drpd ama jenius mtk\xf0\x9f\x98\xa9'"
347,2020-11-02 05:20:46+00:00,b'Ayoo nonton #StartUpEp6 di Netflix \xf0\x9f\x98\x89\n\nLangganan Akun Netflix Ultra HD Murmer Bergaransi Hundred points symbol\n\nNetflix UHD Private100K ( bisa dipake 5 orang 5 devices)\nNetflix UHD Sharing 30k (cuman bisa dipake 1 orang 1 device) \n\nMinat langsung dm.'
348,2020-11-02 05:18:48+00:00,b'#StartUpEp6 berteori kkajja https://t.co/r5gv8k4wRb'
349,2020-11-02 05:17:02+00:00,b'mau ngerekomendasiin drakor yg lg on going judulnya Start Up! kayaknya ini bakal jadi drakor favorit no 1(so far bagus bgt!!) soalnya banyak bgt pelajaran trs kayak pesan tersirat gt\xf0\x9f\x98\xad\n#StartUpEp6'
350,2020-11-02 05:16:12+00:00,"b'saling menunggu, saling merindukan dalam diam, tapi tidak akan pernah bisa bertemu. semuanya terasa jauh untuk digapai. \xf0\x9f\x98\x94\n\nJipyeong - Dalmi \xf0\x9f\x98\x94\n[ Day &amp; Night - #JungSeungHwan ]\n\n#StartUpEp6 #StartUp https://t.co/kW799y1AnP'"
351,2020-11-02 05:11:02+00:00,b'tim oleng merapat yu sinii\xf0\x9f\x98\xad\xf0\x9f\x98\xad\n#StartUpEp6 https://t.co/p8BTYA2RS4'
352,2020-11-02 05:09:22+00:00,b'Scene bengek untuk #StartUpEp6 \xf0\x9f\x98\xad\xf0\x9f\x98\xad\xf0\x9f\x98\xad\xf0\x9f\x98\xad\xf0\x9f\x98\xad\xf0\x9f\x91\x8d https://t.co/uUUoZPtmje'
353,2020-11-02 05:09:02+00:00,"b""Suzy kenapa gemes banget aku tanyakkk \xf0\x9f\x98\xad #StartUpEp6 \nni pdhl dia gregetan sama orang tapi yg ada malah gemes :') https://t.co/NEE0egkvo4"""
354,2020-11-02 05:08:49+00:00,"b'nonton drama on going tuh ga enak banget, gemessss nunggu episod selanjutnya :( #StartUpEp6 https://t.co/50hJtizF3D'"
355,2020-11-02 05:08:38+00:00,b'My mood \xf0\x9f\x98\x85\xf0\x9f\x91\x8d sprti thrwbck saat2 tengah kasmaran.\nSuka bgt Dalmi dibucinin Dosan.\n#StartUpEp6 https://t.co/4xJmswGJcP'
356,2020-11-02 05:08:16+00:00,b'Siapa lagi si ini? mau bales dendam ke siapa? #StartUpEp6 #StartUp https://t.co/1wq6wFrmtK'
357,2020-11-02 05:08:04+00:00,b'Start Up keknya bagus ya.. Pen nntn tapi belum ada waktu\n#StartUpEp6'
358,2020-11-02 05:06:55+00:00,b'#StartUpEp6 injae dia tuh ga terlalu peduli sama self proof nya dalmi karna dia fokus sama selfproof ke ayah tirinya\ntapi karakternya yg pengen di hhhhhhh-in wkwk'
359,2020-11-02 05:05:22+00:00,"b'@shanoveliaa_ Jangan di bayangin hyung,  nanti 2lead pasti bahagia #StartUpEp6'"
360,2020-11-02 05:04:31+00:00,b'Demonstrasi percepat penularan covid - 19 Reply 1988 Manchester united #orangkayagaktau\n#StartUpEp6\n#bongkarmafiaregulasi\n#BarisanProKerja https://t.co/Ypl3otxPbU'
361,2020-11-02 05:04:23+00:00,"b'Jasa Arsitek, Jasa Kontraktor, Jasa Interior. GRATIS Konsultasi, GRATIS Gambar 3D. INFO LENGKAP (WA 0815-7811-4399) https://t.co/Am9idhSWDj #jasapemborongjogja #jasabangunrumah #jasarenovasijogja #kostjogja #apartemenjogja #OrangKayaGakTau #StartUpEp6'"
362,2020-11-02 05:03:30+00:00,b'Yang mau balas dendam itu ada hubungannya sama ibu-ibu yang di sand box ga sih? Yang liat orang bunuh diri? #StartUpEp6'
363,2020-11-02 05:02:45+00:00,"b'halmoni sick and bisa aja ninggalin jipyeong dan dalmi *jgn sampe sih, klo bener ini sedih banget*. but, jipyeong dpt lil brother is dosan and his parents too. for dalmi im so sorry, masih nggatau kedepannya apa dosan juga bisa sampai akhir karena ""the letter is lie"" #StartUpEp6 https://t.co/8Ob5Mtwdob'"
364,2020-11-02 05:00:53+00:00,b'Nggak relaaa kalo Yongsan jadi antagonis...\n#StartUpEp6 #StartUp'
365,2020-11-02 04:59:04+00:00,b'aku baru tau susu dalam botol bisa meledak #StartUpEp6'
366,2020-11-02 04:56:45+00:00,b'Demo itu membahayakan diri dan keluarga\nApa lagi kalian anak yang punya tanggung jawab untuk keluarga\n#bongkarmafiaregulasi\n#BarisanProKerja \nBIGBANG Manchester United Reply 1988 #StartUpEp6 https://t.co/Qm3ugua3dz'
367,2020-11-02 04:54:33+00:00,"b'#StartUpEp6 ngebayangin jadi dalmi berat bgt jadi dia, lost her father, dibohongin soal surat, mau ngebuktiin ke kakaknya kalo dia ga nyesel sama pilihannya, trus skrg neneknya sakit\n\ndgn kehadiran dosan jadi kayak kekuatan dia gitu sih'"
368,2020-11-02 04:53:35+00:00,b'#StartUpEp6 jadi trending wkwk gue juga penasaran sama si mysterious guy\xf0\x9f\x91\x80'
369,2020-11-02 04:51:30+00:00,b'Do San nya ngeri weyyy \xf0\x9f\x91\xbb.\n#StartUpEp6 https://t.co/ivoeHRmJ2p'
370,2020-11-02 04:51:12+00:00,b'Ceritanya punya dendam kesumat ini \xf0\x9f\x91\xbb.\n#StartUpEp6 https://t.co/1lcdW5hrDm'
371,2020-11-02 04:51:07+00:00,b'recommended bgt ni \xf0\x9f\xa4\xa9#StartUpEp6'
372,2020-11-02 04:51:06+00:00,"b'buat kalian yang hobi travelling, yuk intip kode promo hotel RedDoorz,kode bisa di pakai berkali2 lho..booking via aplikasi RedDoorz,auto diskon gede2an up to 40% :)\n#OleOut #Reply1988 #orangkayagaktau #Harukappo #StartUpEp6 #SECRETNUMBER_GotThatBoom #BIGBANG #BUMNuntukIndonesia https://t.co/oaEc3qZ5m4'"
373,2020-11-02 04:50:56+00:00,"b'Ok uts hari ini dah kelar, sekarang waktunya lanjut nonton #StartUpEp6'"
374,2020-11-02 04:50:04+00:00,b'Jual Masker 3 Ply Earloop Isi 50 Pcs Masker Medis / Disposable Consumable - Jakarta Utara - CV. KREASI MODE ABADI | Tokopedia https://t.co/cWPfvrQhnK #Tokopedia lewat @Tokopedia \n\nReply 1988 / Pogba\n\n#KIMTAEHYUNG #AkuMenulisMakaAkuAda #OleOut #StartUpEp6 #COVID19 #MaskerWajah'
375,2020-11-02 04:48:55+00:00,b'Ni kenapa gemes banget pdhl dia cuma ngeliatin orang berantem \xf0\x9f\x98\xad #StartUpEp6 https://t.co/JqBX3iMUH7'
376,2020-11-02 04:47:40+00:00,"b""Selain sibuk menebak siapa dia (tebakan sementara dia adalah Yong San), ada satu 'sad story' di akhir nantinya. Yaitu nenek Seo Dal Mi matanya akan buta. #StartUpEp6 https://t.co/zkxKvTdavu"""
377,2020-11-02 04:47:23+00:00,b'Ekspresi hari pertama OJT ~ \n\n#StartUpEp6 https://t.co/BxB74LBhV6'
378,2020-11-02 04:47:15+00:00,b'membayangkan yg terjadi ketika dia tau semuanya..\n#StartUpEp6 https://t.co/ZofqAPODuN'
379,2020-11-02 04:46:48+00:00,"b'Halo!!\n\nWaktunya CDC-Cerita Dari Cibubur akan bahas mengenai hobi daun nih. Nah, kegiatan sehat ini bagus banget buat isi waktu luang kita.\n\nApa aja si serunya? Langsung kuy\n\nhttps://t.co/XTMxRxu7xK\n\n#StartUpEp6'"
380,2020-11-02 04:44:57+00:00,b'gimana nih jadi bucin doi \xf0\x9f\x98\xad\xf0\x9f\x98\xad\n#StartUpEp6 https://t.co/jj9PfsGOWZ'
381,2020-11-02 04:44:22+00:00,b'Aku kok curiga cerita yg menginspirasi sand box itu sebenernya dalmi ya wkwk \xf0\x9f\x98\x82  #StartUpEp6'
382,2020-11-02 04:43:42+00:00,"b'Alex bentar amat ya munculnya setelah ditolak jadi mentor Samsan Tech \n#StartUpEp6 skip dulu Pak Han, soalnya udah banyak yg idolain doi wqwq https://t.co/rM7zQqLJ8f'"
383,2020-11-02 04:42:33+00:00,b'Menurut ikatan dokter Indonesia\nKlaster demo akan picu lonjakan covid 19  \nReply 1988\nPogba\n#OleOut\n#StartUpEp6.  #orangkayagaktau\n#bongkarmafiaregulasi\n#BarisanProKerja https://t.co/t6rzxPPQKN'
384,2020-11-02 04:41:03+00:00,"b'#StartUpEp6 episode dimana gw tetepkeun sbg team dosan, disini karakternya jadi lebih kuat, apalagi yg bokapnya cerita tentang masa kecilnya takjub bgt,\nseorang anak kecil jenius math menang olimpiade tapi medali nya dikasih ke temen kompetisinya yg dimarahin nykpnya \xf0\x9f\x98\x8d'"
385,2020-11-02 04:40:21+00:00,"b'Synk siapa yg ngajarin km kek gitu, Gaboleh diulang ya atau ga kita putus\n#StartUpEp6 https://t.co/JHDzGVNsC7'"
386,2020-11-02 04:39:52+00:00,b'dahlah aku ship jipyeong sm yeongsil aj\xf0\x9f\x9a\xa3\xe2\x80\x8d\xe2\x99\x80\xef\xb8\x8f #StartUpEp6 https://t.co/ifj4kMYVjn'
387,2020-11-02 04:35:54+00:00,"b'Dari sini kita belajar, apa pun pilihan kita, baik atau buruk, tetap mendatangkan umpatan ketidaksukaan orang terhadap kita. Kita hanya perlu terus berusaha maju dgn jalan terbaik yang kita pilih tanpa menyesalkan keputusan yang telah dibuat.\n\n#StartUpEp6 https://t.co/HyBWF0RqqS'"
388,2020-11-02 04:35:27+00:00,b'Gak nyesel nonton ongoing #StartUpEp6 dragon yg gak menyerah menye.. Dan alur yg up and down sejak episode pertama. https://t.co/VLE9VHnN8i'
389,2020-11-02 04:32:43+00:00,"b'Kenapa sih drakor ini trending mulu, jadi makin penasaran aaah  #StartUpEp6'"
390,2020-11-02 04:32:30+00:00,b'What semena-mena ini tiba-tiba ada #StartUpEp6'
391,2020-11-02 04:31:11+00:00,"b'Omooo kemaren founder bukalapak, skrg ruang guru! Bukan kaleng2 \xf0\x9f\x98\x8c #StartUpEp6 #StartUp https://t.co/ZKrGyPNYIt'"
392,2020-11-02 04:30:50+00:00,"b'Apa informasi yang diberikan injae ke dalmi di preview eps Start up selanjutnya ? Apa kisah tentang ayunan itu, bisa jadi. Injae cuku sportif sebelumnya, dia juga ngasih tau dalmi soal dia ambil data yang sama di westafel. #StartUpEp6 https://t.co/8tgmQ2V0Wh'"
393,2020-11-02 04:30:48+00:00,b'Ayo bikin konspirasi \xf0\x9f\x94\xa5\n #StartUpEp6 https://t.co/YBq9GOpdms'
394,2020-11-02 04:28:03+00:00,b'BENTAR... INI #StartUpEp6 KENAPA JADI TRENDING TWITTER?'
395,2020-11-02 04:25:23+00:00,"b'Ngga adil, knp maenin laptop bisa segemes ini\n\n#StartUp #StartUpEp6 https://t.co/V8zG6LmtLI'"
396,2020-11-02 04:25:21+00:00,b'Alex udh seneng banget ceo samsan tech dateng sumeringah mukanya taunya... \n\n#StartUp #StartUpEp6 #Suzy #\xec\x88\x98\xec\xa7\x80 https://t.co/J0SBqfbppr'
397,2020-11-02 04:23:58+00:00,b'Taunya jipyeong nyaho kalo Swing girl yang asli dalmi karna dulu diceritain disurat. \n\n#StartUp #StartUpEp6 #Suzy #\xec\x88\x98\xec\xa7\x80 https://t.co/tznow84AEZ'
398,2020-11-02 04:23:54+00:00,"b'#StartUpEp6 \nKiri Yongsan, chulsan, dosan\nKanan misterius.\nPostur yang kanan mirip gak ? \xf0\x9f\x98\x85 https://t.co/NYvQldpEgz'"
399,2020-11-02 04:15:51+00:00,b'Sabtu masih lama \n#StartUp\n#StartUpEp6 https://t.co/xGjG6tbLhO'
400,2020-11-02 04:12:20+00:00,b'Gais mau nawarin webiste https://t.co/GSgbbUr5Fi | anda minat DM yah... #StartUpEp6'
401,2020-11-02 04:09:59+00:00,b'ternyata Alan Walker dia mau ngedj di sandbox\xf0\x9f\xa4\xa3\n#StartUpEp6 #StartUp https://t.co/7BZ8rgstBL'
402,2020-11-02 04:06:49+00:00,b'Mari bermain misteri #StartUpEp6 \nDah ada firasat kalo si hoodie guy diantara san brother. bajunya rada nggembel soalnya \xf0\x9f\xa4\xa4 https://t.co/li3MuKG8MM'
403,2020-11-02 04:03:26+00:00,b'Bakit naman ganon \xf0\x9f\x98\xad #StartUpEp6'
404,2020-11-02 04:02:35+00:00,"b'Dari jaman Dream High smpe WYWS juga sering terkena second lead sih, tapi Jipyeong terlalu berkorban di dong mskpn Dosan juga ga kalah \xf0\x9f\x98\x95\xf0\x9f\x98\x95#StartUpEp6 #StartUp'"
405,2020-01-05 00:43:01+00:00,"b""Don't miss hotel deals like these! Our price discovery engine works 24/7 to bring you the best hotel deals. Get FREE alerts now. https://t.co/3TyQ0ci8FT https://t.co/sNe7kutrxI"""
406,2020-11-02 04:00:20+00:00,"b'Ditambah dengan sakitnya halmeoni disini \xf0\x9f\x98\xa2\xf0\x9f\x98\xa2\n\nDrama ini banyak metafornya, dari awal dosan jelasin soal AI ke dalmi jg kan pake tarzan and jane. \n\n#StartUpEp6'"
407,2020-11-02 04:00:19+00:00,"b'#StartUpEp6  \nAku setujuu bgt ketika knetz disitu bilang susu itu metafora dari white liesnya halmeoni yg bakal meledak kapan aja. \nDisini bukan cuma dalmi aja yg jadi alasan neneknya bohong soal surat, alasan lainya jg krn jipyeong. Dia tau jipyeong jg kesepian dan butuh teman.'"
408,2020-11-02 03:57:35+00:00,"b'@monicaevdn @NoonaSpoiler Krn Suzy nya sendiri adlh sosok yg amat istimewa, jadi rata2 pendampingnya adlh org2 istimewa juga \xf0\x9f\xa4\xa3\n\n#StartUpEp6'"
409,2020-11-02 03:56:37+00:00,b'@NoonaSpoiler Dalmi adalah magnet yg sangat kuad \xf0\x9f\x98\x85\xf0\x9f\x91\x8d\n\n#StartUpEp6'
410,2020-11-02 03:55:06+00:00,"b'@infodrakor_id Emg udh gitu harusnya, Pak Han adalah cupid Dalmi - Dosan. Macam abang yg posesif juga. Kkkk. Kan family. Wkwk\n#StartUpEp6'"
411,2020-11-02 03:53:16+00:00,"b'@infodrakor_id Dosan pliz, kasi tau Jipyeong soal Hamoeni \xf0\x9f\x98\xb6biar bisa diobati sgera.\nEh, tp kayaknya gabisa y. Dosan gatau apa2 juga relation JP sama halmoeni.\nKasian ujung2nya Dosan megang secret semua org, dia mau bahagiaan Dalmi tp malah numpuk boomerang \xf0\x9f\xa4\xa7\n#StartUpEp6'"
412,2020-11-02 03:52:55+00:00,b'Sayang banget sama Han Ji Pyeong pengen peyukkk ... #StartUpEp6'
413,2020-11-02 03:52:02+00:00,b'favorite scene di StartUp emg ini nih 3 san wkwkwk #StartUp #StartUpEp6 tapi woi ending startup episode 6 mengandung bawang\xf0\x9f\x98\xa2 https://t.co/qd32XGTRE7'
414,2020-11-02 03:52:01+00:00,b'@ifmanandha Gemes bangeettt.. tapi #StartUpEp6 sedih euy scene terakhirnya'
415,2020-11-02 03:50:40+00:00,b'RT @RizaErie JUAL #SSS Paket Gir Honda CS1 - Asesoris Motor - Variasi Sepeda Motor - BISA COD\nhttps://t.co/KTySe2FCx6\nhttps://t.co/KTySe2FCx6\nhttps://t.co/KTySe2FCx6\n\xf0\x9f\x98\x8d\xf0\x9f\x98\x8d\xf0\x9f\x98\x8d\n#RajaMotorOnline \nSPILL THE TEA\nAir 2x\nSECRET NUMBER GOT THAT BOOM\n#StartUpEp6\n#MUNARS https://t.co/VFh0pp9rCR'
416,2020-11-02 03:50:06+00:00,b'RT @RizaErie JUAL #SSS Paket Gir Honda CS1 - Asesoris Motor - Variasi Sepeda Motor - BISA COD\nhttps://t.co/RlHoJsKTJ1\nhttps://t.co/RlHoJsKTJ1\nhttps://t.co/RlHoJsKTJ1\n\xf0\x9f\x98\x8d\xf0\x9f\x98\x8d\xf0\x9f\x98\x8d\n#RajaMotorOnline \nSPILL THE TEA\nAir 2x\nSECRET NUMBER GOT THAT BOOM\n#StartUpEp6\n#MUNARS https://t.co/fnoG3B60bM'
417,2020-11-02 03:48:46+00:00,b'akun bulutangkis pun ikut bahas #StartUp #StartUpEp6'
418,2020-11-02 03:47:52+00:00,b'Siapa dan sama siapa dia mau bales dendam? Hmmm misteri ini harus nunggu mingdep dulu:(\n\n#StartUpEp6'
419,2020-11-02 03:47:50+00:00,b'@y SEMANGAT BUAT HARI INI! \nSMAN 1\n\xf0\x9f\x9a\x80\xf0\x9f\x8c\x8c https://t.co/dxX0qYdhFn \n#AniesManisCebongNangis\nReply 1988\n#StartUpEp6\n#TolakDemoPasukanNasbung\n#OmnibusBeriManfaatBaik\n#WeLoveYouTen\n#OleOut\n#BersatuDukungBPIP\n#KIMTAEHYUNG\n#TREASURE_MMM_D4'
420,2020-11-02 03:47:49+00:00,b'Dikasih yang begini aja girang banget sumpah\n#StartUpEp6 https://t.co/SoVpGuEXCv'
421,2020-11-02 03:47:00+00:00,"b'Aaah, gilak, porsi konflik dan recehnya seimbang. bagus \xf0\x9f\x98\xad #StartUpEp6'"
