,Date,Tweet
145,2020-10-26 12:43:56+00:00,"b'@rimaziah Sumpah sih pas scene ini ngakaknya sampe guling2\xf0\x9f\x98\x82\xf0\x9f\x98\x82,drama yg dari eps awal udh menarik hati bgt #StartUpEp3'"
146,2020-10-26 12:28:35+00:00,b'Wwkwkwkwk\n#StartUpEp3  konsep nya bgtu ya.. \xf0\x9f\x98\x86 \xf0\x9f\x98\x86 \xf0\x9f\x98\x86'
147,2020-10-26 12:13:07+00:00,b'Boong deng aku tim sekenlid yang paling kerja keras jipyeong \xf0\x9f\x98\x82\xf0\x9f\x98\x82\xf0\x9f\x98\x82\xf0\x9f\x98\x82 #StartUpEp3 https://t.co/lUK2122Kk4'
148,2020-10-26 11:54:20+00:00,"b'Enak yaa jadi seo dal mi\nDia tidur nyenyak sambil ngorok\nDi luar sana ada 2 lelaki tamvan yang diam"" menyukainya \nCita""ku menjadi seo dal mi \xf0\x9f\x98\x82\xf0\x9f\x98\x82\n#StartUpEp3 https://t.co/z1GnfHg9OH'"
149,2020-10-26 11:51:21+00:00,"b""@tanyainrl Baru 4 eps tapi aku udah bucin ostnya startup heran :')))) #StartUp #StartUpEp1 #StartUpEp2 #StartUpEp3 #StartUpEp4 https://t.co/vScr5v9y5a"""
150,2020-10-26 11:45:16+00:00,b'mr. han ji-pyeong napaka bait mong nilalang \xf0\x9f\xa5\xba #StartUpEp3'
151,2020-10-26 11:40:45+00:00,"b""Baru 4 eps tapi aku udah bucin ostnya startup heran :')))) #StartUp #StartUpEp1 #StartUpEp2 #StartUpEp3 #StartUpEp4 https://t.co/vScr5v9y5a"""
152,2020-10-26 10:43:02+00:00,b'#StartUpEp3 endingnya bengek banget woy\xf0\x9f\x98\xad MONEYYYY\xf0\x9f\x98\xad\xf0\x9f\x98\xad\xf0\x9f\x98\xad'
153,2020-10-26 09:55:43+00:00,b'Pilihan sulit. \xf0\x9f\xa4\x94\n\n#StartUpEp3 #StartUpEp4 vs #CallMyAgent S3 https://t.co/nidQtmLewo'
154,2020-10-26 09:39:30+00:00,"b'7 Potret Karakter Bae Suzy di Drama Korea, Spesialis Pantang Menyerah\n.\n.\nKlik link ini \xf0\x9f\x91\x89https://t.co/APqRV5HIiG\n\n#BaeSuzy #Suzy #StarUpDrama #StartUpEp1 #StartUpEp2 #StartUpEp3 #StartUpEp4 https://t.co/Tj9MjQb4iK'"
155,2020-10-26 08:58:43+00:00,"b'Pas kali lagi nonton "" Start Up "" apa ga menangis dapat kabar kaya gini \xf0\x9f\xa5\xba\xf0\x9f\xa5\xba\xf0\x9f\xa5\xba\xf0\x9f\x98\xad\xf0\x9f\x98\xad\xf0\x9f\x98\xad #StartUpEp3  Alhamdulillah Alhamdulillah \xf0\x9f\xa5\xba\xf0\x9f\xa5\xba\xf0\x9f\xa5\xba'"
156,2020-10-26 08:46:34+00:00,"b'setelah beberes kamar, mari mulai #StartUpEp3'"
157,2020-10-26 08:36:21+00:00,"b'Paling ga suka sih sama drama yg salah paham gini sih sebenernya, kasian dalmi jg dibohongin. Semoga cepet kebongkar aja biar dalmi tau dosan yg dia kenal itu jipyeong. Tetep loveline ama dosan asli jg bodo amat asal jipyeong gak usah direpotin\xf0\x9f\x98\xad #TeamHanJipyeong\n#StartUpEp3'"
158,2020-10-26 07:57:06+00:00,b'Dah la bengek emg nntonnya \xf0\x9f\xa4\xa3 #StartUpEp3\n\nhttps://t.co/yayepj10pw'
159,2020-10-26 07:16:52+00:00,b'SOLO JOOHYUK PUEDE SER   JOONHYUNG Y DOSAN\nAL MISMO TIEMPO \xf0\x9f\xa5\xb0\xe2\x99\xa5\xef\xb8\x8f\n\n#namjoohyuk \xe2\x99\xa5\xef\xb8\x8f\n#joonhyung #NamDoSan\n#weightliftingfairykimbokjoo\n#hadadelevantamientodepesas \n#StartUp #StartUpEp3 https://t.co/FITT5Jkusz'
160,2020-10-26 06:46:39+00:00,b'Ending episode 3 yawlaaaaaa.... Tukang edit videonya gak ada akhlakkkk \xf0\x9f\xa4\xa3\xf0\x9f\xa4\xa3\xf0\x9f\xa4\xa3\xf0\x9f\xa4\xa3\xf0\x9f\xa4\xa3\n\n#StartUpEp3'
161,2020-10-26 06:18:20+00:00,b'ENDING #StartUpEp3 KENAPA SERECEH INI YA ALLAH \xf0\x9f\x98\xad\xf0\x9f\x98\xad\xf0\x9f\x98\xad\xf0\x9f\x98\xad makin cinta kalo dramanya receh begini HAHAHAHA'
162,2020-10-26 05:34:52+00:00,b'#StartUpEp3 kenapa lawak sih \xf0\x9f\x98\x82'
163,2020-10-26 04:59:20+00:00,b'Kalo kalian udah lama gak ketawa cepat nonton #StartUpEp3 dan #StartUpEps4 \xf0\x9f\x98\x97\xf0\x9f\x91\x8d\xf0\x9f\x8f\xbb https://t.co/Yoi9jgQjod'
164,2020-10-26 02:15:53+00:00,b'Kacau banget nih wkwk \xf0\x9f\x98\xad\xf0\x9f\x98\xad\xf0\x9f\x98\xad\xf0\x9f\x98\xad sebel banget #StartUpEp3'
165,2020-10-26 02:01:20+00:00,b'bengek banget \xf0\x9f\xa4\xa3\xf0\x9f\xa4\xa3\xf0\x9f\xa4\xa3 #StartUpEp3 https://t.co/7G7rQ6JcAz'
166,2020-10-26 01:49:41+00:00,b'Heolllllllll~ yak yg anti mainstream memang mengagumkan! wkwk\n\n#StartUp #StartUpEp3 https://t.co/mx9hFg0eJw'
167,2020-10-26 01:47:29+00:00,b'anjing diornya dijatohin gitu aja dong. kshsksjkshk jiwa miskinku meronta-ronta #StartUp #StartUpEp3 #Suzy #KangHanna https://t.co/YPY6YsvXop'
168,2020-10-26 00:34:54+00:00,b'Sebuah tips klo lg pacaran kehabisan topik bisa nyanyi lagu nasional \xf0\x9f\x98\xad\xe2\x9c\x8a\n#StartUpEp3 https://t.co/MbhaDk1f7s'
169,2020-10-25 23:33:19+00:00,"b'baru kelar nonton ep3&amp;4, kali ini episode 3 ngakak bgt\xf0\x9f\x98\x85, sepupu akhlak eopseo\xf0\x9f\x98\x86 #StartUpEp3 #StartUp https://t.co/8sNbvXCY7G'"
170,2020-10-25 23:11:05+00:00,b'Sosok meresahkan warga dunia drakor nih. Dal-mi mah blm bingung suka ama siapa tapi bucin drakor yg lagi pada bingung mau jadi tim siapa muehehehe.\n\n#StartUp #StartUpEp3 https://t.co/aqGBT3U67q'
171,2020-10-25 23:08:37+00:00,"b""Tuh! Kalo nulis 'mimpi indah' ya jangan pake HAHA.\n\nwkwk. smg director-nim memperbanyak scene bromance, jadi inget Goblin hehe.\n\n#StartUp #StartUpEp3 https://t.co/S8reubknnJ"""
172,2020-10-25 20:03:35+00:00,b'gakuat ngakak jam segini\xf0\x9f\x98\xad #StartUpEp3\n\nhttps://t.co/QS2PEtkO7Q'
173,2020-10-25 19:56:54+00:00,"b'#StartUp Ep 3 semakin seruu, scane akhirnya gokil njirr \xf0\x9f\x98\x82\xf0\x9f\x98\x86 #StartUpEp3'"
174,2020-10-25 19:20:16+00:00,b'dengerin ini mellow abis lagunya ost #StartUpEp3\nhttps://t.co/YfqFVAjb6U'
175,2020-10-25 18:38:57+00:00,b'Ngakak bgt scene ini tolonggg\xf0\x9f\x98\xad\xf0\x9f\x98\xadhttps://t.co/Qrj5Stmm05\n#StartUpEp3 #StartUp'
176,2020-10-25 18:27:18+00:00,b'Bengek banget \xf0\x9f\x98\xad\n#StartUpEp3 https://t.co/buO8BGozJw'
177,2020-10-25 18:02:42+00:00,b'POTA ANONG KLASENG EDIT YAN HA? KADAMI KONG TAWA HAHAHAHAHAHA #StartUpEp3'
178,2020-10-25 17:53:19+00:00,b'Help me! Pecah ketawa jam segini\xf0\x9f\x99\x8a\xf0\x9f\x99\x8a\xf0\x9f\x99\x88\xf0\x9f\x99\x88\xf0\x9f\xa4\xa3\xf0\x9f\xa4\xa3\xf0\x9f\xa4\xa3\xf0\x9f\xa4\xa3\xf0\x9f\xa4\xa3\xf0\x9f\xa4\xa3\xf0\x9f\xa4\xa3 #StartUpEp3 https://t.co/Bami8jY9Sx'
179,2020-10-25 17:49:48+00:00,b'SA SOBRANG LAKAS NG TAWA KO NAPALABAS AKO NG KWARTO NG DI ORAS \xf0\x9f\xa4\xa3 #StartUpEp3 https://t.co/dw1ptralLG'
180,2020-10-25 17:34:23+00:00,b'Sekali screenshoot kenapa mereka bisa selucu ini? \xf0\x9f\x98\xad\n\n*brb pingsan*\n\n#StartUp\n#StartUpEp3 https://t.co/GBSYa02bfj'
181,2020-10-25 17:12:19+00:00,b'#StartUpEp1 bkg bangka mata gara2 bkg mnangis tapi #StartUpEp3 bkg saki puru gra2 kuat ttwa. eps 3 kacau woi lucu skli\xf0\x9f\x98\xad'
182,2020-10-25 17:11:57+00:00,b'Tengah malem buka galery dan saya terkejut sepertinya jari jari udah auto download tiap nemu foto #hanjipyeong aka #KimSeonHo #StartUp #StartUpEp1 #StartUpEp2 #StartUpEp3 #StartUpEp4 https://t.co/65UmiI9kYu'
183,2020-10-25 17:05:06+00:00,b'#StartUpEp3 bikin gue bengek ngakak mulu setelah Ep1 perih nahan air mata..'
184,2020-10-25 16:38:18+00:00,b'Startup ep 3 endingnya anjrrr bgt \xf0\x9f\xa4\xa3\xf0\x9f\xa4\xa3\nEpisode paling seru\n#StartUpEp3'
185,2020-10-25 16:37:31+00:00,"b""\xf0\x9f\x91\x8c ewan ko nalang kung 'di kayo kinilig \n#StartUpEp3 https://t.co/qPeyXy1Zb8"""
186,2020-10-25 16:35:22+00:00,b'Laptrip yung edit amp HAHAHAHAHAHAHAH nam do san\xf0\x9f\xa4\xa3\n#StartUpEp3'
187,2020-10-25 16:34:17+00:00,b'hahahahahahahaha ctto #StartUpEp3 https://t.co/QdugiYyWdq'
188,2020-10-25 16:28:13+00:00,b'NGAKAK BANGET ANJIR EPIC SCENE MANA DIULANG ULANG TERUS LAGI \xf0\x9f\xa4\xa3\xf0\x9f\xa4\xa3\xf0\x9f\xa4\xa3\xf0\x9f\xa4\xa3 #StartUpEp3 https://t.co/tPYvtWyNr7'
189,2020-10-25 16:24:36+00:00,"b'\xe2\x8a\xb9\xe2\x82\x8a \xe2\x8b\x86 JUAL NETFLIX \xea\x9c\x9c\n\n\xe2\x80\xa2 SHARING 3O,OOO\n\xe2\x80\xa2 PRIVATE 115,OOO\n\n\xf0\x9f\x8c\xbbLegal 1OO% &amp; trusted\n\xf0\x9f\x8c\xbbUHD 4K\n\xf0\x9f\x8c\xbbFull garansi\n\xf0\x9f\x8c\xbbTF = DPT ACC\n\xf0\x9f\x8c\xbbAOH\n\n\xe2\x86\xb7 \xc2\xb7\xcb\x9a \xe0\xbc\x98 \xf0\x9f\x92\xb3 BCA / DANA / OVO / TSEL / GOPAY / SHOPEEPAY\n\xe2\x86\xb7 \xc2\xb7\xcb\x9a \xe0\xbc\x98 \xf0\x9f\x92\x8c https://t.co/ZFhLEBkeVI\n\xe2\x80\xbc\xef\xb8\x8fbe a smart buyer, ADA HARGA ADA KUALITAS\xe2\x80\xbc\xef\xb8\x8f #StartUpEp3'"
190,2020-10-25 16:16:02+00:00,b'OMG MAY EP3 NAAAAA\xf0\x9f\x98\xad\n\n#StartUpEp3 skospwijsiaoqjqnaka'
191,2020-10-25 16:05:23+00:00,b'BENGEK SAMPE NANGIS DI EPS INI \xf0\x9f\x98\xad\xf0\x9f\x98\xad\xf0\x9f\x98\xad #StartUpEp3 https://t.co/KzmbYYlHMN'
192,2020-10-25 16:04:41+00:00,b'siapa si yang mau balas dendam ini?\n#StartUpEp3 #StartUp https://t.co/xlmKSPW0ir'
193,2020-10-25 15:59:39+00:00,b'Membual tanpa rencana nyata cuma ngebuat menjadi seorang Penipu. \n#StartUpEp3'
194,2020-10-25 15:46:29+00:00,"b'#StartUpEp3 ketika sudah banyak kapal oleng ke Nam Do San, disini gue masih tetep bertahan di kapal Han Ji Pyeong, tapi sebel karna di eps 3 Ji Pyeong masih aja denial kalo dia suka sama Dal Mi. Bersiaplah nyesel kau ahjussi dimple.'"
195,2020-10-25 15:46:01+00:00,b'NGAKAKKK BGTT\xf0\x9f\xa4\xa3\xf0\x9f\xa4\xa3\xf0\x9f\xa4\xa3\xf0\x9f\xa4\xa3\n#StartUpEp3 https://t.co/yqYVn4p2Lp'
196,2020-10-25 15:45:12+00:00,"b'""Ya aku belom pernah pacaran,, ada yg menyukaiku tapi aku tak meladeninya,, semua itu karna kamu "" #StartUpEp3  #NamJooHyuk #BaeSuzy https://t.co/GfSzhgU3Im'"
197,2020-10-25 15:45:08+00:00,"b'Kok gue liatnya bukan ""Konsep Pria Tampan yg Pendiam"" tapi mlah Pria Tampan yg Lugu "" \xf0\x9f\xa4\xa3\xf0\x9f\xa4\xa3\xf0\x9f\xa4\xa3 #StartUpEp3 #NamJooHyuk #BaeSuzy https://t.co/wVzCoSomYd'"
198,2020-10-25 15:42:12+00:00,b'weiiii eiii that video Jakdu edited tu yaAllah kelakar la doo baru main brp saat dah gelak cam apa HAHAHHA ei \xf0\x9f\x98\x82\xf0\x9f\x98\x82\xf0\x9f\x98\x82\xf0\x9f\xa4\xa3#StartUpEp3'
199,2020-10-25 15:38:31+00:00,"b'Dari lagu kebangsaan aja bisa di ekspresi kan kek gtu bgt,, ngakak aku tu \xf0\x9f\x98\xad\xf0\x9f\x98\xad #StartUpEp3 #NamJooHyuk #BaeSuzy https://t.co/qjX5PMx2VH'"
200,2020-10-25 15:36:35+00:00,b'Bikin oleng ngga tau mo mihak yg mna #StartUpEp3 #StartUp #NamJooHyuk #BaeSuzy https://t.co/UV8ngZk0H9'
201,2020-10-25 15:34:51+00:00,b'Untung mba nya cantik #StartUpEp3 #startup #BaeSuzy #NamJooHyuk https://t.co/ic3U19yR4B'
202,2020-10-25 15:31:05+00:00,b'Berjalan tanpa tujuan #StartUpEp3 #namjohyuk #baesuzy https://t.co/5MMw5wI3w1'
203,2020-12-12 00:32:46+00:00,b'https://t.co/8o3AdKxABp'
204,2020-10-25 15:29:37+00:00,"b""Mau mendebat tapi kok ya emang udah mutlak... duh mbak suzy mau keseringan jadi orang susah juga dari DNA udah nation's beauty ya gimana \xf0\x9f\x98\x82\xf0\x9f\x98\x82\xe2\x9d\xa4\n\n#StartUpEp3 https://t.co/Ev9ZHbgx7h"""
205,2020-10-25 15:26:23+00:00,b'Sumpah ini scene terngakak dri CEO SAMSAN tech \xf0\x9f\xa4\xa3\xf0\x9f\xa4\xa3\xf0\x9f\x98\xad\xf0\x9f\x98\xad #StartUpEp3 #startup #namjohyuk #baesuzy https://t.co/ztC5khQ5HK'
206,2020-10-25 15:22:47+00:00,b'Layan #StartUpEp3 dulu lah...'
207,2020-10-25 15:22:46+00:00,b'Wkwkwkk endingnya #StartUpEp3 lawak bener video speech kemenangan malah kaya meme thug life\nAkhirnya aku bisa memutuskan jadi team Han Ji Pyeong'
208,2020-10-25 15:21:07+00:00,"b'Aku lagi2 kena 2nd lead syndrome di #StartUpEp3\nDear Jipyeong, kalau emang naksir Dalmi ngaku dong.. Jangan kalah cepet sama Dosan..\n\nJangan ada Jungpal-Jungpal lainnya lagi \xf0\x9f\x98\xad'"
209,2020-10-25 15:05:17+00:00,b'ngga di #StartUpEp3 ngga di #RecordOfYouth  aku penganut sekenled syndrome https://t.co/NpHch35CHF'
210,2020-10-25 15:03:35+00:00,b'Dekah siak #StartUpEp3 hari ni\xf0\x9f\x98\x82\xf0\x9f\x98\x82'
211,2020-10-25 14:52:47+00:00,"b'Salfok sama #StartUpEp3. Se kere""nya peran Suzy, ke party tetep pake tas Dior'"
212,2020-10-25 14:41:42+00:00,b'Lanjut nntn #StartUpEp3'
213,2020-10-25 14:41:22+00:00,b'Kaya pala SamSan HAHAHAHA #StartUpEp3'
214,2020-10-25 14:39:20+00:00,b'oke sekian #StartUpEp3 https://t.co/dp1k1U4jQN'
215,2020-10-25 14:36:46+00:00,b'#StartUpEp3 ok aku mau up kegilaanku pdanya https://t.co/I1yqaGwuEk'
216,2020-10-25 14:35:46+00:00,b'bgst scene ini gue kaget + ngakak \xf0\x9f\x98\xad\xf0\x9f\x98\xad\xf0\x9f\x98\xad\xf0\x9f\x98\xad\xf0\x9f\x98\xad #StartUpEp3 https://t.co/feHkixtCI1'
217,2020-10-25 14:34:13+00:00,b'maaf ak team kiri bye :)) #StartUpEp3 https://t.co/EUS8rH6eEl'
218,2020-10-25 14:29:40+00:00,b'tapi sumpa si dia cantip parah #StartUpEp3 https://t.co/edbcCa9ivY'
219,2020-10-25 14:29:15+00:00,b'Apakababaw ng luha ni Suzy!! Bet na bet ko talaga pag umiiyak sya eh damang dama ko. #StartUpEp3'
220,2020-10-25 14:27:09+00:00,"b'Mereka ""mesra"" dan kocak... Nantinya mgkn Jipyung dan Dosan cs bakal jd team up\xf0\x9f\xa4\xad\xf0\x9f\xa4\xad tiap mereka ngumpul gw ngakak Mulu\xf0\x9f\xa4\xa3\xf0\x9f\xa4\xa3\xf0\x9f\xa4\xa3 #StartUpEp3 https://t.co/GYljfAinop'"
221,2020-10-25 14:26:56+00:00,"b'Scene ibu ngomong begini emg bikin anak makin down ih, bahkan ak nangis duluan dibanding Dal Mi\xf0\x9f\x98\xad\n#StartUpEp #StartUpEp3 https://t.co/QFA7FFOcug'"
222,2020-10-25 14:25:51+00:00,b'kadang aku pengen mrk berlayar tp pas liat mas jipyeong oke bye oleng #StartUpEp3 https://t.co/AqBh3NaBkz'
223,2020-10-25 14:23:31+00:00,"b'Pilihan yg sulitttt, mau ngeship kesiapa\xf0\x9f\x98\x8c\nYg satu tegas, ceplas ceplos, kaya. \nYg satu polos bangetttttt, pinter dan pantang menyerah banget\xf0\x9f\x98\x8c\nKalian tim siapa nih? \nHan ju pyong apa nam do san? \n#StartUpEp3 #StartUpEps3 #startupnetflix https://t.co/fBZJZoTpmV'"
224,2020-10-25 14:23:11+00:00,b'tolonk mrk kocak parah #StartUpEp3 https://t.co/XQYQH8mWsS'
225,2020-10-25 14:17:21+00:00,b'second lead syndrom menyerangku di drama ini \xf0\x9f\x98\xad\xf0\x9f\x98\xad #StartUpEp3 https://t.co/H6aiCH2W4e'
226,2020-10-25 14:16:07+00:00,"b'Suzy semongko, dan epilog bikin bengek hyung \xf0\x9f\x98\x82\n\n#StartUpEp3 https://t.co/kuNx1XPFpO'"
227,2020-10-25 14:10:23+00:00,"b'ini kocak banget, brp kali scene ini diulang karna ngakak bgt\xf0\x9f\x98\x82 nyanyiin lagu kebangsaan biar diliat orng2 tu akrab \xf0\x9f\x98\xad\xf0\x9f\x98\xad #StartUpEp3 https://t.co/PwI5aiRQFN'"
228,2020-10-25 13:56:59+00:00,b'Litrato bago magsimula ang sakuna:\n\nHAHAHAHAHAHAHAHAHAHHAHAHAHA BUSET YAN TAWANG TAWA PA RIN AKO \xf0\x9f\x98\x82\n#StartUpEp3 https://t.co/6QfFqSkFOT'
229,2020-10-25 13:56:02+00:00,"b'Ini star up eps. 1 - 3 kok ada sedihnya, banyak lucunya . Nyanduin banget dah suzy sama nam joo hyuk #StartUpEp1 #StartUpEp2 #StartUpEp3'"
230,2020-10-25 13:54:46+00:00,"b'AMBABAW KO NANAMAN TAWANG TAWA KO DUN SA LAST PART NG EP3 \'\'MONEY MONEY MONEY"" HAHAHAHAHHAHAHAHAHHA #StartUpEp3'"
231,2020-10-25 13:45:18+00:00,b'Ang Ganda ng start up \xf0\x9f\xa5\xb0\xf0\x9f\xa5\xb0\xf0\x9f\xa5\xb0 #StartUpEp3'
232,2020-10-25 13:39:13+00:00,b'@DionMulya didiGum berubah menjadi didiSan \xf0\x9f\xa5\xba Nam-Do San #StartUpEp3 https://t.co/wXq52dxdC8'
233,2020-10-25 13:39:04+00:00,b'sobrang na eenjoy ko talaga start up walang tapon ang gagaling nilang lahat \xf0\x9f\x98\x8c #StartUpEp3 https://t.co/WnPYIZ0UWl'
234,2020-10-25 13:38:54+00:00,b'Ya Allah bengek banget \xf0\x9f\xa4\xa3\xf0\x9f\xa4\xa3\xf0\x9f\xa4\xa3 kenapasih harus kaya gitu jadinya wkwkwk gue ga siap dikasih ginian ngakak banget anjim \xf0\x9f\x98\x82 \n\n#StartUp \n#StartUpEp3\n\n https://t.co/pu6AzXDIg6'
235,2020-10-25 13:37:09+00:00,b'Kegemeusan apalagi tolongggg sukaa bangettt \xf0\x9f\x98\xad\xf0\x9f\x98\xad\xf0\x9f\x98\xad #StartUpEp3 https://t.co/uHPCgHgJKm'
236,2020-10-25 13:35:48+00:00,b'Nam Do San or Han Ji Pyeong? #StartUpEp3 #StartUpEp4'
237,2020-10-25 13:35:02+00:00,b'Dosan kamu bikin aku diomelin malem males ketawa ngikik #StartUpEp3 https://t.co/xvFjrhrnbJ'
238,2020-10-25 13:33:50+00:00,b'LUCU BGT #StartUpEp3 https://t.co/uXtMN2T6GR'
239,2020-10-25 13:30:46+00:00,b'seo dalmi\xe2\x99\xa1\xe2\x99\xa1\xe2\x99\xa1\n\n#StartUpEp3 https://t.co/QX1wf4Zb5U'
240,2020-10-25 13:28:54+00:00,"b'GAKUAT GUE NONTON INI, BANGSAT SEPUPUNYA DOSAN\xf0\x9f\x98\xad\xf0\x9f\x98\xad\xf0\x9f\x98\xad\n#StartUpEp3 https://t.co/vJrT2TohuQ'"
241,2020-10-25 13:28:24+00:00,b'Haduh bakalan kena second lead syndrome lagi nih.. \xf0\x9f\x98\x8a\xf0\x9f\x98\x8a #StartUpEp3'
242,2020-10-25 13:27:41+00:00,b'#StartUpEp3 na nga \xf0\x9f\xa5\xb0\xf0\x9f\xa4\x9f\xf0\x9f\x8f\xbd\xf0\x9f\x98\x8d'
243,2020-10-25 13:27:31+00:00,b'#StartUpEp3 Bengek \xf0\x9f\x98\xad\xf0\x9f\x98\xad\xf0\x9f\x98\xad'
244,2020-10-25 13:25:59+00:00,"b'Oneul bam juingong-eun Dosanie~ Dosanie~ Oneul bam juingong-eun Dosanie~ Dosanie~\n\nSeo Dalmi, 2020.\n\n#StartUpEp3 #StartUp #\xec\x8a\xa4\xed\x83\x80\xed\x8a\xb8\xec\x97\x85'"
245,2020-10-25 13:18:03+00:00,b'DOSAN KNPSIH\xf0\x9f\x98\xad\xf0\x9f\x98\xad #StartUpEp3 https://t.co/DVr5tTFSNx'
246,2020-10-25 13:16:10+00:00,"b'Baru selesei nonton Start-Up~ \nCuma gue males nih drama model gini, bikin gue bingung kudu berpihak mana?? antara main sama second lead male nya \xf0\x9f\x98\x85 #StartUpEp3 https://t.co/7l9joKSbe8'"
247,2020-10-25 13:14:12+00:00,b'BONGOKNYA PART LAST EP 3 AKU GELAK SAMPAI NANGIS\xf0\x9f\x98\x82\xf0\x9f\x98\x82\xf0\x9f\x98\x82\xf0\x9f\x98\x82\xf0\x9f\x98\x82\xf0\x9f\x98\xad\xf0\x9f\x98\xad\xf0\x9f\x98\xad\xf0\x9f\x98\xad #StartUpEp3'
248,2020-10-25 13:07:33+00:00,b'Episode 1 --- terharu nggak tega \nEpisode 2 --- lawak \nEpisode 3 --- super lawak \n\n#StartUpEp3 #bestpart\xf0\x9f\x98\x82\xf0\x9f\xa4\xa3\xf0\x9f\x98\x82 https://t.co/RkCyQIdnwg'
249,2020-10-25 13:03:47+00:00,b'Gak ada topik pembicaraan : \nGhibah \xe2\x9d\x8e\nNyanyi Lagu Kebangsaan \xe2\x9c\x85\n\n#StartUpEp3\n#StartUp https://t.co/FjQGH8Nb7O'
250,2020-10-25 13:02:50+00:00,b'Part ini ngakak bet yallah\xf0\x9f\x98\xad\xf0\x9f\xa4\xa3\nBengkek malam2\xf0\x9f\x98\xad\xf0\x9f\x98\xad\xf0\x9f\x94\xab\n#StartUpEp3 https://t.co/uVcRGGPRhj'
251,2020-10-25 13:01:50+00:00,"b'@Anpangirl_ya Tbh aku ga nonton search, tp so far review org2 ttg #StartUpEp bagus bgt, km bisa cek review di hashtag #StartUpEp1 #StartUpEp2 #StartUpEp3 dan kalo boleh aku saranin sih km wajib nonton start up karena ini drama paket lengkap ga ada celah nya sejauh ini, ga akan nyesel \xf0\x9f\x98\x81\xf0\x9f\x98\x86'"
252,2020-10-25 12:51:12+00:00,"b'Setelah 3 eps maraton dramanya, masih seru si, sedihnya dapet, ngakaknya dapet. Di 3 eps ini masih ngebahas gimana start up ngerintis. Tp sayangnya didramanya langsung ke tahap cari investor, ga mulai dari pembuatan produknya, terus value produk, pencarian pasar dll. \n#StartUpEp3'"
253,2020-10-25 12:46:37+00:00,b'SEN\xc4\xb0N ALLAH CEZANI VERS\xc4\xb0N DOSAN AHAHAHAHHAHAHAHAHAHAHHAHAHAHAHAHAHHAHAHAHAHAHAHAHAAHHAHAHAHAHAHAHAHHA\n\n#StartUp #StartUpEp3 #NamJooHyuk\nhttps://t.co/6mgltLorWO'
254,2020-10-25 12:34:03+00:00,b'@Bronchocela 2 kali grgr nonton #StartUpEp3'
255,2020-10-25 12:33:28+00:00,b'Oh ternyata mantan sakit keras.#StartUpEp3 #NamJooHyuk #dolsan https://t.co/BWVJqbCY0d'
256,2020-10-25 12:29:23+00:00,b'Best mampus #StartUp nie. #StartUpEp3 crack habis. Lama tak tengok drama korea bodoh camni \xf0\x9f\x98\x82'
257,2020-10-25 12:21:28+00:00,b'Second lead rasa first lead \n gila visualnyaa\xf0\x9f\x98\x82 #StartUpEp #StartUpEp3 https://t.co/p8LB1nESQD'
258,2020-10-25 12:12:58+00:00,b'aku gamau ya han ji pyeong berakhir kayak han woo tak \xf0\x9f\x98\xad\xf0\x9f\x98\xad\xf0\x9f\x98\xad #StartUp #StartUpEp3 #StartUpEp4 https://t.co/DZJDeFKX6d'
259,2020-10-25 12:02:41+00:00,"b'#StartUpEp3 boleh ga han ji pyeongnya buat suzy, nam do sannya buat aku? Gemessssshhhh bgttttt'"
260,2020-10-25 12:01:25+00:00,"b'Setelah nonton episode 3, aku gatau ngeship yang mana \xf0\x9f\x99\x84 tapi ji pyeong lucu bgt \xf0\x9f\xa4\xa6\xf0\x9f\x8f\xbb\xe2\x80\x8d\xe2\x99\x80\xef\xb8\x8f\n#StartUpEp3 https://t.co/i6NdmNbAr9'"
261,2020-10-25 11:55:25+00:00,"b'Yang bikin ngakak banget di episode ini diputar video Do san untuk pengumuman juara CODA, apa ga direview dulu sebelum dikirim? XD\n\n#StartUpEp3'"
262,2020-10-25 11:41:58+00:00,b'@ArmSalim Uda sampe #StartUpEp3 ? Ada adegan super gokil :)))'
263,2020-10-25 11:29:09+00:00,b'polos bgt si astaga capek ketawa wkwk #StartUp #StartUpEp3 https://t.co/IxGeGRJFvp'
264,2020-10-25 11:10:22+00:00,b'Gwapo naman at ang ganda nyan! \n#StartUp \n#StartUpEp3 https://t.co/d1iWI27xVq'
265,2020-10-25 11:02:04+00:00,b'bangke bengek aku \xf0\x9f\xa4\xa3\xf0\x9f\xa4\xa3 #StartUp #StartUpEp3 https://t.co/qVXT36Z76k'
266,2020-10-25 11:00:41+00:00,b'#StartUpEp3 sumakit tyan ko kakatawa \xf0\x9f\x98\x82 https://t.co/jgjccTRYMU'
267,2020-10-25 10:58:19+00:00,"b'Hamdallah, #StartUpEp3 ini ada chara development In-jae. Lelah abang liat ke-UwU-an Dal-mi &amp; Do-san. Kpn y \xf0\x9f\xa5\xba\n\nMari kita tunggu kapal mana yg bakal berlayar. \xe2\x9b\xb5'"
268,2020-10-25 10:55:23+00:00,b'baru pertama ketemu uda dibuat bingung wkwk #StartUp #StartUpEp3 https://t.co/qyWpWjSsdu'
269,2020-10-25 10:31:51+00:00,b'@filledwithk #StartUpEp3 yuk bisa yuk dibuka\xe2\x98\xba\xef\xb8\x8f\xf0\x9f\x99\x8f'
270,2020-10-25 10:28:07+00:00,b'pegel rahang gua abis nonton eps 3 yaampun aku suka yg bobrok2 begini\xf0\x9f\x98\xad\xf0\x9f\x91\x8f\xf0\x9f\x8f\xbb definisi keadilan sosial bagi good looking #StartUpEp3'
271,2020-10-25 10:24:06+00:00,b'Tarik sis semongko by suzy \xf0\x9f\x98\x82\n\nTeh @szrbsz \xf0\x9f\x98\x85\n#StartUp #StartUpEp3 https://t.co/KqAUeyDVh5'
272,2020-10-25 10:20:41+00:00,b'Alasan bekerja tiap bulan. #StartUpEp3 https://t.co/dqNipPwMAZ'
273,2020-10-25 10:20:17+00:00,b'bengek liat kelakuan sukangawur\xf0\x9f\x98\xad\n#StartUpEp3 https://t.co/kpqyfAVLwY'
274,2020-10-25 10:19:50+00:00,b'do-san jipyeong klo udh satu scene gemes bgtt\xf0\x9f\x98\xad\xf0\x9f\x98\xad\n#StartUpEp3 https://t.co/GNklu0vCzR'
275,2020-10-25 10:14:51+00:00,b'PT. Samsan Tech\xf0\x9f\x98\x82\xf0\x9f\xa4\xa3\n#StartUp #StartUpEp4 #StartUpEp3 https://t.co/6UeASbOZBk'
276,2020-10-25 09:58:26+00:00,b'yang aku butuhkan saat ini : \n\n#StartUpEp3 https://t.co/Y4H01YGtim'
277,2020-10-25 09:56:13+00:00,b'MAY MAS ILALAKAS PA PALA TAWA KO AHAHHAHAHA \n#StartUpEp3 https://t.co/dlA1Flzkpz'
278,2020-10-25 09:54:56+00:00,b'Ngakak banget nonton #StartUpEp3  \xf0\x9f\x98\xad'
279,2020-10-25 09:49:02+00:00,b'Suka bgt sama ekspresi dalmi \n#StartUpEp3 https://t.co/5UR93pH4l9'
280,2020-10-25 09:46:34+00:00,b'Bayangin lagi satu ruangan terus ngelihat cowo lg ribet kaya gni wkwkwk #StartUpEp3 https://t.co/68Y9Qm598e'
281,2020-10-25 09:46:04+00:00,b'Degdeg sndiri liatnya wkwwk #StartUpEp3 https://t.co/1kgPfTv64I'
282,2020-10-25 09:44:15+00:00,b'cousin dia tu la paling tak guna hdhshsbsb adoi la #startupep3'
283,2020-10-25 09:37:59+00:00,b'Second lead syndrome\xf0\x9f\x98\xad\nBoleh ga sih dal mi sama ji pyeong aja\xf0\x9f\x98\x82\xf0\x9f\x98\x82\n\n#StartUpEp3 https://t.co/oHb7EZiiCp'
284,2020-10-25 09:37:56+00:00,b'Padahal ep 1 dibikin nangis2 kampret emangg ini drama \xf0\x9f\x98\xad\xf0\x9f\xa4\xa3 #StartUpEp3'
285,2020-10-25 09:36:18+00:00,"b""Ngakak Minggu sore disponsori oleh #StartUpEp3 \xf0\x9f\x98\x85\xf0\x9f\x98\x82 hadeh malah tergoda nonton drakor ongoing lagi padahal bnyk list drakor bagos diantrian :')"""
286,2020-10-25 09:31:41+00:00,b'best scene di luar scene2 lain yang bikin ngakak #StartUpEp3 #StartUp https://t.co/oaFXnTfbog'
287,2020-10-25 09:21:12+00:00,b'NGAKAK!!!!! \xf0\x9f\xa4\xa3\xf0\x9f\xa4\xa3\xf0\x9f\xa4\xa3 \n#StartUpEp3\n https://t.co/atT75hqLZG'
288,2020-10-25 09:20:38+00:00,b'berdekah jela #StartUpEp3 AHHAHAHAH'
289,2020-10-25 09:15:02+00:00,"b'Rewatch lagi, tetep masih ngakak sama lalotnya dosan dan ekspresinya jipyeong \xf0\x9f\x98\x82\xf0\x9f\xa4\xa3\n#StartUpEp3 https://t.co/2JopkrTIUy'"
290,2020-10-25 09:06:17+00:00,b'Bagiku Nam Do San itu pria pintar yang membosankan. Tapi dia berani dan mau berjuang demi cintanya. \n\n#StartUpEp3'
291,2020-10-25 09:05:45+00:00,b'WKWKKWKWKWKWK #StartUpEp3 https://t.co/zNPUkaNIvL'
292,2020-10-25 09:04:37+00:00,b'Kamu ketika mendengar bias comeback : \xf0\x9f\x92\x83\xf0\x9f\x92\x83\xf0\x9f\x92\x83 \n#StartUpEp3 \n#startupdrama \n#BaeSuzy \n#NamJooHyuk \n#kdramas https://t.co/0nwNBk4ANe'
293,2020-10-25 09:02:39+00:00,b'Harus milih kapal yang mana TT\n\n#Netflix #StartUpEp3'
294,2020-10-25 09:01:57+00:00,"b""Cantik bg Suzy duhhhhh gila :')\nNam do san ngeselin juga ya, walaupun emang bukan salah dia awalnya tapi yaaaa .... Wkwk \n#StartUpEp3 https://t.co/HkZ0Iak5GM"""
295,2020-10-25 09:01:42+00:00,b'TARIK SIS! #StartUpEp3 https://t.co/ZuZiTw0DXG'
296,2020-10-25 08:58:48+00:00,b'Ini kira\xc2\xb2 siapa ya yang nulis ini\n#StartUpEp3 https://t.co/pGmu1S8b9v'
297,2020-10-25 08:55:40+00:00,"b'baru #StartUpEp3 ~ ku masih #teamjipyeong nih, gak tau nanti wkwk'"
298,2020-10-25 08:51:59+00:00,"b'Niat awal nonton tuh pengen liat Nam Joo Hyuk sama Suzy, tapi kenapa setelah ditonton jadi kena second lead syndrome gini sih \xf0\x9f\x98\x91, kenapa Kim Seon Ho bisa koplak gitu kan aku jadi suka\xf0\x9f\x98\x81. Please jangan jadi sad boy Ji Pyeong \xe3\x84\xb1\xe3\x84\xb1\xe3\x84\xb1\xf0\x9f\x98\x85\n\n#StartUpEp3 #StartUp https://t.co/pnoRnAZJ05'"
299,2020-10-25 08:50:45+00:00,b'HATIKU MASIH TERPANTAU DI MAS 2ND LEAD. PLS WRITERNIM JANGAN RUBAH JADI ANTAGONIS \xf0\x9f\x98\x87 #StartUpEp3 https://t.co/4eS2DSRa3R'
300,2020-10-25 08:50:24+00:00,"b'Sodaranya bikin promosi malu""in banget \xf0\x9f\xa4\xa3\xf0\x9f\xa4\xa3\xf0\x9f\xa4\xa3\n#StartUp #StartUpEp3\nhttps://t.co/btYsJfHVew'"
301,2020-10-25 08:49:19+00:00,b'Saha atuh ? Dia teh Saha \xf0\x9f\x98\x9c\n\n#StartUp #StartUpEp3 https://t.co/xDlmdGAWPo'
302,2020-10-25 08:49:07+00:00,b'swagnya sampe ke startup\xf0\x9f\x98\x8e\xf0\x9f\xa4\x99\xf0\x9f\x8f\xbb\n\n#StartUp \n#StartUpEp3 https://t.co/k29QYrk9FJ'
303,2020-10-25 08:49:04+00:00,b'BENGEK\xf0\x9f\x98\xad\xf0\x9f\x98\xad\xf0\x9f\x98\xad\xf0\x9f\x98\xad GA NGOBROL JG KEREN\xf0\x9f\x98\xad\n\n#StartUp \n#StartUpEp3 https://t.co/93y2IJCUMG'
304,2020-12-13 17:00:01+00:00,b'Next year could be decisive for the world \xf0\x9f\x8c\x8f. 2020 has taught us that we need to work together for a stronger response and show that we can build back better.\n\nJoin in. Be the change.'
