,Date,Tweet
463,2020-10-25 03:57:15+00:00,b'Han Ji Pyeong - Nam Do San\nbau-bau akan memperebutkan Dal Mi di kemudian hari \xf0\x9f\xa4\xaa #StartUpEp3 https://t.co/8tQLo1H9Up'
464,2020-10-25 03:55:36+00:00,b'ASTAGA NAM DOSAN\xf0\x9f\x98\xad\xf0\x9f\xa4\xa3\xf0\x9f\xa4\xa3 itu si ji pyeong udh pusing bgt merhatiin dia wkwkkwk #StartUpEp3 https://t.co/D9VMQACozy'
465,2020-10-25 03:54:51+00:00,b'DALMI BUCINNYA MASYAALLAH \xf0\x9f\x98\xad\n#StartUp #StartUpEp3 https://t.co/O4ab1Mqlk7'
466,2020-10-25 03:52:36+00:00,b'#StartUpEp3 kerennnnnnn'
467,2020-10-25 03:51:57+00:00,b'#StartUpEp3 bikin bengek yaampuun. \xf0\x9f\xa4\xa3\xf0\x9f\xa4\xa3\xf0\x9f\xa4\xa3'
468,2020-10-25 03:51:27+00:00,b'Yoon dong jin ternyata stanArmy gez:v \xe3\x85\x8b\xe3\x85\x8b\xe3\x85\x8b\xe3\x85\x8b\n#BTSARMY #Search #Searchep3 #StartUpEp3 https://t.co/AhbJDh1LRj'
469,2020-10-25 03:51:11+00:00,b'Tatapan nam do san ke dal mi baper bgt iyahhhh wkwk\xf0\x9f\x98\x82 #StartUpEp3 https://t.co/xMCv2HMIdR'
470,2020-10-25 03:46:06+00:00,b'ok jgn lupakan sadboi yg satu ini \xe0\xbc\x8e\xe0\xba\xb6\xe2\x80\xbf\xe0\xbc\x8e\xe0\xba\xb6 \n\n#StartUpEp3 https://t.co/g6IjfAaKYd'
471,2020-10-25 03:45:36+00:00,b'Eps. 3\n\nKita harus ngobrol biar keliatan keren. Yang dibahas lagu kebangsaan \xf0\x9f\x98\xad\n\nDo San terpesona bener sama Dal Mi. Naksir beneran. Aku tetep team Ji Pyeong \xf0\x9f\x98\x8d\n\nJi Pyeong pas Dal Mi nangis kayak khawatir gitu. \xf0\x9f\x98\x86\n\nAku nangis pas Dal Mi nangis \xf0\x9f\x98\xad\n\n#StartUp\n#StartUpEp3 https://t.co/sNtsLJzYPQ'
472,2020-10-25 03:44:15+00:00,"b'Coba kalo Han Ji Pyeong ngaku dan gak minta tolong ke Nam Do San asli pasti udah dapet Seo Dal Mi karena cinta pertama nya tuh dia!!!!, gregetan asli. Second Lead Syndrome kesel banget \xf0\x9f\x98\xad\n\n#StartUpEp3 #TeamHanJiPyeong https://t.co/kvobJnhJrr'"
473,2020-10-25 03:43:17+00:00,b'bengek bgt astaghfirullah ngakak sampe guling guling \xf0\x9f\x98\xad\xf0\x9f\x91\x8a\xf0\x9f\x8f\xbb #StartUpEp3 https://t.co/3mawB4ntrK'
474,2020-10-25 03:42:56+00:00,b'Gw ulang2 terus sangking bengeknya \xf0\x9f\x98\xad #StartUpEp3 https://t.co/oS01CTV2Sw'
475,2020-10-25 03:42:50+00:00,b'Mas masa kami yang nonton lebih dulu sadar ?!!\n#StartUp #StartUpEp3 #BaeSuzy #Suzy #KimSeonHo https://t.co/TZKGp7hCBw'
476,2020-10-25 03:42:32+00:00,"b'Iya udh mulai goyah, dosan polos bgt gemessss.. tapi ji pyeong juga masih kuat nih karakternya \xf0\x9f\xa4\x8d #StartUpEp3 https://t.co/88qcCpvNHA'"
477,2020-10-25 03:39:20+00:00,b'MAMPUS NGAKAK BANGET WOY DOSAAAN \xf0\x9f\x98\xad\xf0\x9f\x98\xad\xf0\x9f\x98\xad\xf0\x9f\x98\xad\xf0\x9f\x98\xad\xf0\x9f\xa4\xa6\n\n#StartUpEp3 https://t.co/oCXkNz2KIC'
478,2020-10-25 03:37:29+00:00,"b'Aku suka karakter Han Ji Pyeong, tapi kalo aku jadi Seo Dal Mi pasti bakal milih Nam Do San yang terus terang \xf0\x9f\x98\x8c\n\n#StartUpEp3 #TeamNamDoSan https://t.co/70686vof2k'"
479,2020-10-25 03:32:34+00:00,"b'Masih bimbang bgt, jipyeong baik bgt huhu. Sekenlit syndrom membuatku sadar. Wkwk\n#StartUpEp3 https://t.co/KqV5yrtbTZ'"
480,2020-10-25 03:31:18+00:00,b'Kan kan oleng kann...\xf0\x9f\x98\x82 #StartUpEp3 https://t.co/KHEbILo23Q'
481,2020-10-25 03:31:15+00:00,b'BODOAMAT NGAKAK SUMPAH DOSAN POLOS BGT YA TUHAAAN \xf0\x9f\xa4\xa6\xf0\x9f\xa4\xa6\xf0\x9f\xa4\xa6\xf0\x9f\x98\xad\xf0\x9f\x98\xad\xf0\x9f\x98\xad\xf0\x9f\x98\x82\xf0\x9f\x98\x82\n\n#StartUpEp3 #Namjoohyuk #Suzy https://t.co/05BQ1PNkgp'
482,2020-10-25 03:28:26+00:00,b'Hayo sejauh ini sudah berada di tim mana?\n#StartUp\n#StartUpEP3 https://t.co/L2oczYVrpp'
483,2020-10-25 03:26:26+00:00,"b'Aku ngakak banget sampe perutku sakit nonton epilog nya, Nam Do San adalah korban kegilaan sepupu nya \xf0\x9f\xa4\xa3\n\n#StartUpEp3'"
484,2020-10-25 03:25:14+00:00,b'Pesona Air Terjun Sigura-gura yang Tertinggi di Indonesia \n\n#TokopediaWIB #BMKG #Gempa tsunami #Alhamdulillah #StartUpEp3\nhttps://t.co/QYZzdBdJo3'
485,2020-10-25 03:24:02+00:00,b'#StartUpEp3 gakuat yang edit nam do san jahat banget \xf0\x9f\x98\xad\xf0\x9f\x98\xad'
486,2020-10-25 03:23:01+00:00,b'Udah di spoilerin sebelumnya ... Eh taunya parah lawak bgt masnya \xf0\x9f\x98\x82\xf0\x9f\x98\x85\nSampe masih terngiang-ngiang .. MONEY ... MONEY.. MONEY \xf0\x9f\x98\x82\xf0\x9f\x98\x85\n\n#StartUpEp3\n#StartUp  #NamJooHyuk https://t.co/68uJkhUeHY'
487,2020-10-25 03:22:25+00:00,b'capek ngakak \xf0\x9f\xa4\xa3\xf0\x9f\xa4\xa3\xf0\x9f\xa4\xa3\n\n#StartUp #StartUpEp3 #\xec\x8a\xa4\xed\x83\x80\xed\x8a\xb8\xec\x97\x85 https://t.co/4TZcqPBIJm'
488,2020-10-25 03:22:24+00:00,b'Kapal oleng ke kanan apa ke kiri. Senyum ji pyeong bikin meleleh si. Siap sakit hati juga. Semoga PD nim berbaik hati kepada second lead kita. Gak tega kalau dia harus karam sebelum berlayar. Haha... \n#StartUpEp3 https://t.co/lecRaW3ARV'
489,2020-10-25 03:21:13+00:00,b'nah iniii wkwkwkwk #StartUpEp3 https://t.co/Xc7fbJeEje'
490,2020-10-25 03:20:52+00:00,b'Aku ngeship mereka berdua aja \xf0\x9f\x98\x8d\n#StartUpEp3 https://t.co/ONH9YU3mbV'
491,2020-10-25 03:18:55+00:00,"b'Hiyaaaaa\xf0\x9f\xa4\xb8\xf0\x9f\x8f\xbb\xe2\x80\x8d\xe2\x99\x80\xef\xb8\x8f\xf0\x9f\xa4\xb8\xf0\x9f\x8f\xbb\xe2\x80\x8d\xe2\x99\x80\xef\xb8\x8f\xf0\x9f\xa4\xb8\xf0\x9f\x8f\xbb\xe2\x80\x8d\xe2\x99\x80\xef\xb8\x8f\n\nYakk lagi-lagi tida usah ditiru sobat, ini terdengar keren krn Nam Joo Hyuk yg ngomong kepada Bae Suzy. Mereka ini betul2 ledakan visual \xf0\x9f\x98\xad\xf0\x9f\x98\xad #StartUpEp3 https://t.co/3seEHoyZW9'"
492,2020-10-25 03:14:15+00:00,"b'made my day bangettt \xf0\x9f\x98\x82\xf0\x9f\x98\x82 ga berenti ngakak. Senyum2 mulu. Sejauh ini bucin sama krakter nam do san!!! Keren bgt joo hyuk meraninnya. Ga pernah kecewa. Dia sekeren itu, apalagi ditambah bumbu2 han jipyeong.\n\n#StartUp #StartUpEp3 https://t.co/qZXPA48Beu'"
493,2020-10-25 03:13:13+00:00,b'Scene acah borak guna lagu kebangsaan pun crack gakkk \xf0\x9f\xa4\xa3\xf0\x9f\xa4\xa3 #StartUpEp3'
494,2020-10-25 03:08:46+00:00,"b'#StartUp #StartUpEp3 #startupnetflix \nAda super-sayya di menit terakhir! Ngakak tumpah-tumpah oeyyy, Nam Dosan! ""Menangislah! Menangislah sepuasmu!"" Tapi tiba-tiba diluar negeri bilang, ""Mengagumkan!""\nCampuraduk NGAKAK-SEDIH, diblender jadi satu, Jus apa inikah??'"
495,2020-10-25 03:05:39+00:00,b'Sinong di matatawa sa ending ng episode 3 HAHAHAHAHAHAHHAHAHAHAHAH kala mo seryoso na tapos bigla gento yung ending HHAHAHAHAHHAHAHQHAHAHAH\n\n#StartUpEp3 \n#StartUp https://t.co/K0NMfMxuEy'
496,2020-10-25 03:04:16+00:00,"b'@sucii_14 @sisasisasi @drakorfess_ Blm dpt pencerahan hyung, yg pasti dia bakal terlibat sama kesuksesan Dosan di masa depan \xf0\x9f\x98\x84. Sama Stephani lee juga belum dimunculin. Jd #StartUpEp3  pasti makin seru nantih \xf0\x9f\x8e\x89\xf0\x9f\x8e\x89'"
497,2020-10-25 03:02:54+00:00,b'This is not Han Ji Pyeong this is Ko Ji Seok!! \xf0\x9f\x98\x82\xf0\x9f\x98\x82\n#StartUp #StartUpEp3 #\xec\x8a\xa4\xed\x83\x80\xed\x8a\xb8\xec\x97\x85 #CatchTheGhost #\xec\x9c\xa0\xeb\xa0\xb9\xec\x9d\x84\xec\x9e\xa1\xec\x95\x84\xeb\x9d\xbc #KimSeonHo #\xea\xb9\x80\xec\x84\xa0\xed\x98\xb8 https://t.co/h5tomylXSI'
498,2020-10-25 03:01:28+00:00,b'Ack Nam joohyuk so adorable here \xf0\x9f\x98\x82 #StartUp #StartUpEp3 https://t.co/FvIzRgQGHN'
499,2020-10-25 03:01:01+00:00,b'dosan tuh kelewat polos apa gimana sih???\xf0\x9f\x98\xad\xf0\x9f\x98\xad\xf0\x9f\x98\xad #StartUpEp3 https://t.co/4IZp1jIi7p'
500,2020-10-25 02:44:42+00:00,b'@sisasisasi @drakorfess_ Aku gabisa\xf0\x9f\xa4\xa7 kelepasan tengah malam kayak kuntilanak gr2 ending #StartUpEp3'
