,Date,Tweet
305,2020-10-25 08:43:47+00:00,b'so far masih tim han jipyeong gemes bgt ni org \xf0\x9f\xa5\xba\xf0\x9f\xa5\xba\xf0\x9f\xa5\xba #StartUpEp3 https://t.co/dACUETUnaM'
306,2020-10-25 08:43:43+00:00,b'start up ini cocok buat org kyk gue yg selera humornya jongkok \xf0\x9f\x98\xad\xf0\x9f\x98\xad\xf0\x9f\x98\xad\xf0\x9f\x91\x8c\xf0\x9f\x91\x8c\xf0\x9f\x91\x8c ending ep 3 akan menghantui gue bbrp hari ke depan #StartUpEp3'
307,2020-10-25 08:41:30+00:00,b'#StartUpEp3 lucu banget capek ketawa \xf0\x9f\xa4\xa3\xf0\x9f\xa4\xa3\xf0\x9f\xa4\xa3'
308,2020-10-25 08:37:02+00:00,b'apa yang kamu butuhkan?\nme:\n\n#StartUp #StartUpEp3 https://t.co/jWTY23KNym'
309,2020-10-25 08:36:44+00:00,b'Obat Nyamuk. #StartUpEp3 https://t.co/UCTYAJYGyn'
310,2020-10-25 08:32:02+00:00,b'semalem ngakakin ini 5 menit sampe ngpause dl biar konsen ngakak\xf0\x9f\x94\xa5\xf0\x9f\x98\x82\n#StartUp #StartUpEP3 \n\nhttps://t.co/fUUlbayJCw'
311,2020-10-25 08:29:29+00:00,"b'Se-ngakakk itu dong nonton #StartUpEp3 help, aku masih second lead team, gimana dong..\n#StartUp #HanJipyeong https://t.co/JsdI9GO7ET'"
312,2020-10-25 08:24:16+00:00,b'SAND BOX\n1. Seo dal mi as Bae Suzy \n2. Won in jae as Kang Han Na\n3. Nam do san as Nam Jo Hyuk\n4. Han ji pyeong as Kim Seon Ho\n#StartUpEp3 #StartUp https://t.co/62cXGAYhQV'
313,2020-10-25 08:22:31+00:00,b'Bayangin aja dulu\xf0\x9f\x91\x81\xf0\x9f\x91\x84\xf0\x9f\x91\x81\n\nCr tiktok : incheonpyo.\n#Kdrama #Tiktok #StartUp #StartUpEp3 #Suzy #BaeSuzy #NamJooHyuk https://t.co/IcXSESoaEF'
314,2020-10-25 08:21:06+00:00,"b'Setelah beresin video buat ngajar besok, akhirnya kesampean nonton #StartUpEp3 \xf0\x9f\x98\x8d dulu pas nonton wyws aku tuh kurang suka sama acting nangisnya suzy, kaya ngga berasa sedihnya. Tapi di sini Suzy actingnya keren, ikutan sedih rasanya pengen nangis juga \xf0\x9f\x98\xad https://t.co/SgUjtJVIBP'"
315,2020-10-25 08:20:30+00:00,b'Tim sekenlid yg manisnya ngalahin gula jawa #StartUpEp3\nhttps://t.co/bCU4RnDUxh https://t.co/G5VvSizhgw'
316,2020-10-25 08:20:08+00:00,b'han ji pyeong \xf0\x9f\xa4\xa7 #StartUpEp3 https://t.co/acnMvuxVt3'
317,2020-10-25 08:12:46+00:00,"b'#StartUpEp3\n\nDear bapak ji pyeong, inget yg kandas gara2 lampu merah juga kesempatan nya banyak, pak. Awas nanti nyesel wkwk. Bener kan bunda bunda. Kor! https://t.co/YLCXYw0Ojo'"
318,2020-10-25 08:05:30+00:00,b'Sungpah ni sepupunya Do-San kurang ajar \xf0\x9f\x98\xad\xf0\x9f\x98\xad\xf0\x9f\x98\xad\xf0\x9f\x98\xad #StartUpEp3 #StartUp https://t.co/5aqmk01mng'
319,2020-10-25 08:03:56+00:00,b'Duh aku ga bisa milih kapal yorobunsss mangapppp \xf0\x9f\x98\xad\xf0\x9f\x98\xad dua duanya nggemesin \n#StartUpEp3 #StartUp https://t.co/c71QZbzacY'
320,2020-10-25 07:58:48+00:00,"b'Pilihan yang sulit antara Nam Do San atau Han Ji Pyo. Tapi aku tim Han Ji Pyo dari awal sih, definisi cowok yang pengen buat orang yang disuka bahagia tanpa perlu si orang itu tau alias platonic love, apalagi karismanya damage banget \xf0\x9f\x98\x8d #secondleadsyndrome #StartUpEp3 https://t.co/S7MFEy8YfO'"
321,2020-10-25 07:58:25+00:00,"b'#StartUpEp3\nINILAH BUNDA PENTINGNYA UNTUK TIDAK DENIAL. \n\nDO SAN BISA LANGSUNG BUCIN GITU YA, YG ATU MASIH DENIAL MULU. https://t.co/JYpTSjSfPx'"
322,2020-10-25 07:55:18+00:00,"b'Han Ji pyeong dengan nam do san dah start suka Seo dal mi,,,,,\n\n#StartUpEp3 https://t.co/tt9mbsfWjl'"
323,2020-10-25 07:55:18+00:00,b'Joo Hyuk naman eh\xf0\x9f\x98\x82\xe2\x9d\xa4\n#StartUp #StartUpEp3 https://t.co/BiMqGAX6l9'
324,2020-10-25 07:55:09+00:00,b'PLIS GUE BENGEK BGT NONTON #StartUpEp3 \xf0\x9f\x98\xad\xf0\x9f\x98\xad\xf0\x9f\x98\xad'
325,2020-10-25 07:53:41+00:00,b'Baru beberapa minit start tgok sudah aku karau ketawa \xf0\x9f\xa4\xa3 #StartUpEp3'
326,2020-10-25 07:53:10+00:00,b'BENGEK SUKAWANGUR SIALAN\xf0\x9f\x98\xad\xf0\x9f\x98\xad\xf0\x9f\x98\xad\xf0\x9f\x98\xad #StartUp #StartUpEp3 https://t.co/SLE10nOyYF'
327,2020-10-25 07:48:45+00:00,"b'sumpah, gue masih ngetawain ini daritadi \xf0\x9f\xa4\xa3\xf0\x9f\xa4\xa3\xf0\x9f\xa4\xa3\xf0\x9f\xa4\xa3\n\n#StartUp #StartUpEp3\nhttps://t.co/aD5OJICM3P'"
328,2020-10-25 07:48:37+00:00,b'Chingu !\n\nMy next bromance teruwuhhhhh NO DEBAT !!!\n\n#StartUp\n#StartUpEp3 #NamJooHyuk #KimSeonHo https://t.co/6zpCExwBnk https://t.co/645GJgHJ1F'
329,2020-10-25 07:47:21+00:00,b'Gue nyampe ketawa nangis pas di scene ini\xf0\x9f\x98\xad\xf0\x9f\xa4\xa3  #StartUp #StartUpEp3 https://t.co/Dkt1kAMyPP'
330,2020-10-25 07:44:13+00:00,b'NAM DOSAN !!!!!!!!!!!!! #StartUpEp3'
331,2020-10-25 07:43:03+00:00,b'Jiga jamet \xf0\x9f\x98\xad\n#StartUp \n#StartUpEp3 \n#NamJooHyuk https://t.co/7bW461sk6k'
332,2020-10-25 07:41:06+00:00,b'Saranghae! \xf0\x9f\xa5\xba\xf0\x9f\x92\x9e #StartUp #StartUpEp3 https://t.co/xomx630b3H'
333,2020-10-25 07:38:51+00:00,b'Belum bisa memilih antara tim nam do san atau han ji pyo :( #StartUpEp3'
334,2020-10-25 07:38:07+00:00,b'#StartUpEp3 MAKIN SERUUUUUUUW'
335,2020-10-25 07:35:59+00:00,b'BANGSAT ENDINGNYA #StartUpEp3'
336,2020-10-25 07:35:45+00:00,b'Scene ni kelakar \xf0\x9f\xa4\xa3 #StartUpEp3\n https://t.co/Rn25CyEeTm'
337,2020-10-25 07:32:25+00:00,"b'#StartUpEp3\n#StartUp\nBobrok dua duanya, capek ketawa akuu\xf0\x9f\x98\xad\xf0\x9f\x98\xad\xf0\x9f\x98\xad\xf0\x9f\x98\xad https://t.co/BIjd69MbM3'"
338,2020-10-25 07:31:52+00:00,b'#StartUpEp3 bagus bgtttttt !! Lawak \xf0\x9f\x98\x86'
339,2020-10-25 07:29:44+00:00,"b'Ji Pyeong kalo sekedar balas budi, ngapain sampe mikirin takut Dal Mi kecewa, sedih. Udah jatuh cinta tapi masih ga sadar kayaknya \xf0\x9f\x98\xad\n\nSepupu Do San emang lucknut. Videonya dibuat gitu \xf0\x9f\xa4\xa3\xf0\x9f\xa4\xa3\xf0\x9f\xa4\xa3\n\n#StartUp \n#StartUpEp3 https://t.co/CuXN5IV52R'"
340,2020-10-25 07:26:44+00:00,b'Potangena Nam Joo-Hyuk!!! \xf0\x9f\x98\x82 #StartUpEp3'
341,2020-10-25 07:26:34+00:00,"b'aku nonton #StartUpEp3 jadi nambah mikir, bersyukur goblok matematika, tapi paham banget sama bahasa, jadi apa yg ditulis sama si Dal-mi bisa aku ngerti semuanyaa :)) duh Nam Do San kamu harus belajar biar mengerti Dal-mi walaupun aku pendukung kapal Dal-mi Ji pyeong https://t.co/5jRqQ1m6tR'"
342,2020-10-25 07:26:15+00:00,b'AKKKH BINGUNG UEUEUEUEUE TAPI AKU KESEMSEM SAMA KIRI SIAPA NAMA ASLINYA LUPA\xf0\x9f\x98\xad\xf0\x9f\x98\xad\xf0\x9f\x98\xad\xf0\x9f\x99\x8f\xf0\x9f\x8f\xbb #StartUpEp3 https://t.co/rMnDdUbVjR'
343,2020-10-25 07:25:54+00:00,b'Kelakuan Ji Pyeong sama Nam Do Do San ga ada obat. Lawak banget. Asem cape ketawa \xf0\x9f\x98\xad\xf0\x9f\xa4\xa3\xf0\x9f\xa4\xa3\xf0\x9f\xa4\xa3\n\n#StartUp \n#StartUpEp3 https://t.co/FEb4TKbwqt'
344,2020-10-25 07:19:55+00:00,b'#StartUpEp3 ini uwu banget'
345,2020-10-25 07:16:09+00:00,b'BAKET GANON YUNG LAST PART?! HAHAHAHAHAHA DI KO KINAYA \xf0\x9f\xa4\xa3\xf0\x9f\xa4\xa3\xf0\x9f\xa4\xa3 #StartUpEp3'
346,2020-10-25 07:12:51+00:00,b'HAN JI PYRONG GEMESIN JUGA AMA DALMI KEK CINTA TERBATAS SURAT GITU ANJRI TAPI SAMA NAM DO SAN COCOK JUGAA AAAKKK\xf0\x9f\x98\xad\xf0\x9f\x98\xad\xf0\x9f\x98\xad\xf0\x9f\x91\x8e\xf0\x9f\x8f\xbb\xf0\x9f\x91\x8e\xf0\x9f\x8f\xbb\xf0\x9f\x98\xa9 #StartUpEp3'
347,2020-10-25 07:12:31+00:00,b'Sinematografi nya keren!!!!\n#StartUp #StartUpEp3 https://t.co/1R05NtmXZ9'
348,2020-10-25 07:12:13+00:00,b'Masih ngakak \xf0\x9f\xa4\xa3 plis kenapa ga diperiksa dulu videonya yaallah nam dosan LoL udah mana pake baju Steve Job \xf0\x9f\xa4\xa3\xf0\x9f\xa4\xa3\xf0\x9f\xa4\xa3 #StartUpEp3 https://t.co/w6XRgACoj1'
349,2020-10-25 07:12:12+00:00,"b'Dalmi: ""makasih kamu udah nemenin aku party, semoga aku bisa bayar kebaikan kamu, sebut aja kamu kamu apa..""\n\nDosan: aku mau makan ayam, dan flashdisk 128GB \n\nYA ALLAH NGAKAK KENAPA POLOS BANGET SIH NI COWOK SJSJJSBXBX BENERAN MINTA FLASHDISK DONG \xf0\x9f\x98\xad\xf0\x9f\x98\xad\xf0\x9f\x98\xad \n\n#StartUpEp3 https://t.co/3JOgjVj0eT'"
350,2020-10-25 07:09:04+00:00,b'Ya ampun capek ketawa aku\xf0\x9f\x98\xad\xf0\x9f\xa4\xa3\xf0\x9f\xa4\xa3\xf0\x9f\xa4\xa3 #StartUpEp3 #StartUp https://t.co/7A0so79hOq'
351,2020-10-25 06:59:36+00:00,b'Mpos in jae #StartUpEp3'
352,2020-10-25 06:58:32+00:00,b'Asli gemesss bgtt part inii\xf0\x9f\x98\x82\xf0\x9f\x98\x82\n#StartUpEp3 https://t.co/EDvMmoCvk5'
353,2020-10-25 06:53:03+00:00,b'nasib dapat roommate layan kdrama so kitorang boleh berbincang dan have a same thought about hero and second lead #StartUp apa yg agak pelik part Do San terlalu awal untuk ttba suka kat Dal Mi. It can\xe2\x80\x99t happened even though cinta pandang pertama\xf0\x9f\x98\xad #StartUpEp3'
354,2020-10-25 06:52:11+00:00,b'Second lead male Syndrom untuk pertama kalinya \xf0\x9f\x98\xad\xf0\x9f\x92\xab\nJadi sad Boii dah habis ini bapak \n#StartUpEp3 #HanJipyeong \n#secondlead https://t.co/PxqH5U5IqX'
355,2020-10-25 06:50:59+00:00,b'Eps 3 Terbengekk\xf0\x9f\x98\xad\xf0\x9f\xa4\xa3\xf0\x9f\xa4\xa3\n#StartUpEp3 https://t.co/t13jdZ7gJD'
356,2020-10-25 06:50:48+00:00,"b'dahlah gue jam segini masih ngakak, masih di retwatch terus WKWK\xf0\x9f\xa4\xa3\xf0\x9f\xa4\xa3\n\n#StartUpEp3\n#StartUp https://t.co/JfjBBSrlkK'"
357,2020-10-25 06:41:54+00:00,"b'uri jipyeong kamu baik sekaliii, aku sayang kamu \xf0\x9f\x92\x95\xf0\x9f\x98\xad\n#StartUpEp3 #StartUp https://t.co/gmWqMDHQGU'"
358,2020-10-25 06:39:48+00:00,b'#StartUpEp3 Bengek bgttt gatau lagiii\xf0\x9f\xa4\xa3\xf0\x9f\xa4\xa3'
359,2020-10-25 06:39:11+00:00,b'Lebih tertarik ke second leadnya #StartUpEp3'
360,2020-10-25 06:37:14+00:00,b'awang awa na ako kay Ji-Pyeong HAHAHA #StartUpEp3'
361,2020-10-25 06:36:29+00:00,"b'Nonton #StartUpEp3 Capek ketawa \xf0\x9f\x98\xad apalagi pas yang ini, sepupunya gak ada akhlak \xf0\x9f\x98\xad\xf0\x9f\x98\xad\xf0\x9f\x98\xad\xf0\x9f\x91\x8d https://t.co/fHKrs3FDiZ'"
362,2020-10-25 06:29:47+00:00,"b""- dalmi\n- injae \n- dosan\n- jipyeong\n\nmerinding soalnya aku sbg pengangguran suka nulis kyk begini trs ditempel juga, hue relate bgt start up ini suka bgt makin seru \xf0\x9f\x98\xad\xf0\x9f\x98\xad\xf0\x9f\x91\x8d\xf0\x9f\x8f\xbb\n\n*mian video 360:'))\n#StartUp\n#StartUpEp3 https://t.co/X28zHz1gif"""
363,2020-10-25 06:29:43+00:00,b'Antara ngakak dan sedih cup cup cup\xf0\x9f\x98\xad\n#StartUp #StartUpEp3 https://t.co/mLuE9VTfI6'
364,2020-10-25 06:29:10+00:00,b'#StartUpEp3 HAHAHA PUAS DEH SIH DO SAN https://t.co/VCAEdHq6af'
365,2020-10-25 06:27:44+00:00,b'Konsep pria tampan yang pendiam -dosan\xf0\x9f\x98\xad bngst masih bngek aja sampe sekarang\xf0\x9f\x98\xad\n#StartUpEp3 #StartUp https://t.co/s6FpZP5dzW'
366,2020-10-25 06:23:32+00:00,b'@dahyun_sl Beli beli beli... Sambil nonton #StartUpEp3 wkwk'
367,2020-10-25 06:23:03+00:00,b'apaan anjir baru juga awal episode udah receh aja #StartUpEp3'
368,2020-10-25 06:16:37+00:00,b'Ngakak banget kalo liat ji pyeong sama do san \xf0\x9f\x98\xad\xf0\x9f\xa4\xa3\n\n#StartUpEp3 #StartUp #NamJooHyuk #KimSeonHo https://t.co/9G4jbHHn2i'
369,2020-10-25 06:12:47+00:00,b'Gamau editannya gblg bgt !!!\nNgakak njir #StartUpEp3 \xf0\x9f\xa4\xa3\xf0\x9f\xa4\xa3\xf0\x9f\xa4\xa3'
370,2020-10-25 06:12:22+00:00,b'Menanti episode selanjutnya untuk melihat interaksi Seo Dal Mi dan Han ji Pyeong. \xe2\x9c\x8a\xf0\x9f\x98\xa5 \n#StartUpEp3'
371,2020-10-25 06:12:21+00:00,"b'Terlepas dari perannya yang ""ngeselin"" tapi part ini tuh menggambarkan cewe bgt, cewe kalo udh stress apalagi kek baru pts dari pcrnya pasti deh pengen potong rambut untuk buang sial\xf0\x9f\x98\x82\xf0\x9f\x91\x8d #StartUp #StartUpEp3 https://t.co/I6FiA4psdE'"
372,2020-10-25 06:11:39+00:00,b'bengek #StartUp #StartUpEp3 https://t.co/0CF7aKry0h'
373,2020-10-25 06:10:16+00:00,"b'Bener bener dibikin ngakak sama adegan ini \xf0\x9f\x98\x82, speechless \n\n#StartUpEp3 https://t.co/sO7SAaXMcq'"
374,2020-10-25 06:07:49+00:00,b'Matayak talaga. HAHAHAHHAHAHAHAHHAHA #StartUpep3 https://t.co/1LyqOtv3cW'
375,2020-10-25 06:07:23+00:00,b'Begini kira kira obrolan CEO muda #StartUpEp3 https://t.co/vc3LtTOS0a'
376,2020-10-25 06:07:17+00:00,"b'Puas eh tgok part kakak dalmi yg acah kaya tu diperbodohkan ayah tiri. Igt senang ke ayah tiri nak bg business senang cenggitu ja kt dia, last2 anak kandung yg xguna jugak dia cari. \xf0\x9f\x98\x8c #StartUpEp3'"
377,2020-10-25 06:06:56+00:00,b'tiba-tiba teringat balik ada fan korea tweet smlm\n\njipyeong tulis impian dia nak main go-stop dgn family dalam surat tu dulu\n\n\xf0\x9f\x98\xad\xf0\x9f\x98\xad\xf0\x9f\x98\xad\n\nkan jipyeong takda keluarga \n\nepisode 4 malam ni main go stop \n\n#StartUp #\xec\x8a\xa4\xed\x83\x80\xed\x8a\xb8\xec\x97\x85 #StartUpEp3 #KimSeonho #\xea\xb9\x80\xec\x84\xa0\xed\x98\xb8'
378,2020-10-25 06:06:04+00:00,b'NAH DISINI AKU NGAKAK BAHAGIA\xe2\x98\xba\xe2\x9c\x8c\n namdosan menyukai seo dal mi\nhan ji pyeong tidak menyukai dalmi\nhmmm menurut gua ji pyeong pasti bakal suka ame seo dal mi\xe2\x98\xba\xf0\x9f\x99\x8f\nUDAH FIRASAT BANGET\xe2\x98\xba\xe2\x9c\x8b\xe2\x9c\x8c\xe2\x9d\xa4\xf0\x9f\x92\x9d #StartUpEp3 https://t.co/W6rADGIWGx'
379,2020-10-25 06:05:35+00:00,"b'Di saat orng pada ngetawain Do San, dia malah muji HAHAHA\nDia siapa sih sebenernya? sksksk\n#StartUpEp3 https://t.co/OaMlHnuYwU'"
380,2020-10-25 06:04:03+00:00,b'Bakit kaya hindi na Lang sya yung ireto mo kay Dal mi? Halmuni naman \xf0\x9f\xa4\xa6\xf0\x9f\x8f\xbb! Edi Tapos Ang problema mo #StartUpEp3 https://t.co/bvKfqVCFgK'
381,2020-10-25 06:03:24+00:00,"b'Cape ngetawain eps 3, kirain bakalan nangis\xc2\xb2 lagi, tau nya bengek bgt anjrot\xf0\x9f\x98\xad\xf0\x9f\x91\x8a\n#StartUpEp3'"
382,2020-10-25 06:03:11+00:00,b'AHHAHAHAHAHHAHA ang LT ng ep 3 sa huleeeee WHAHAHAHA\n\n#StartUpEp3'
383,2020-10-25 06:02:57+00:00,b'Nonton ulang #StartUpEp3 ah. Walaupun banyak yang masih banyak yang belum diabaikan dan belum ditonton tapi liat Kim Seon Ho &amp; Nam Joo Hyuk ini menghibur banget.'
384,2020-10-25 06:02:39+00:00,b'Yaampun untung nonton siang2. Aku ngakak bgt mana kenceng pula #StartUpEp3'
385,2020-10-25 06:02:28+00:00,b'sumpah gue ngakak maaf\xf0\x9f\x98\xa9\xe2\x9c\x8b KASIAN BETT mas jipyeong\xf0\x9f\x98\xa9\xe2\x9c\x8b\n#StartUpEp3 https://t.co/6RIZf4u4AA'
386,2020-10-25 06:02:25+00:00,b'apaantuh minta USB 128GB\xf0\x9f\x98\xad https://t.co/Pc5ZSazwfT #StartUpEp3'
387,2020-10-25 06:01:07+00:00,b'serasa gua yg d gtuin tolomk\xf0\x9f\xa4\x97\xf0\x9f\x92\x9d\xf0\x9f\x92\x9e\xe2\x98\xba\xf0\x9f\x98\x8d #StartUpEp3 #NamJooHyuk https://t.co/ARjyqS9OgQ'
388,2020-10-25 06:00:08+00:00,b'adu aduuu bapeurrr euyyyy\xe2\x98\xba\xf0\x9f\x94\xaa\xf0\x9f\xa4\x97\xe2\x9d\xa4\n#StartUpEp3 https://t.co/5d6elzuNAr'
389,2020-10-25 05:58:20+00:00,b'Bengek bgt Start Up eps 3\xf0\x9f\x98\xad apalagi klo udh scene Nam Do San sm Han jipyeong\xf0\x9f\x98\xad \n\n#StartUp #StartUpEp3 https://t.co/tqv6vP2NoL'
390,2020-10-25 05:56:55+00:00,b'Kata2 langsung jepp\n#StartUpEp3 https://t.co/rrjYSrqTZ1'
391,2020-10-25 05:56:20+00:00,b'Reaksi aku pas idol comeback\xf0\x9f\x99\x83 \n\n#StartUp #StartUpEp3 https://t.co/E1dQ7BUCpp'
392,2020-10-25 05:55:46+00:00,"b'ueg lega, yang tersiksa sama 2nd lead syndrome ini bukan ueg doang.. hahahahaha\nayo merana lagi untuk 13 episode mendatang\xf0\x9f\x94\xa5\xf0\x9f\x94\xa5\xf0\x9f\x94\xa5\n#StartUpEp3 #StartUp'"
393,2020-10-25 05:55:40+00:00,b'Apaan tuhhh \n#StartUpEp3 \n#StartUp https://t.co/u8jrGnfh9B'
394,2020-10-25 05:53:49+00:00,b'Suzy ja boleh buat bag Dior camtu\xf0\x9f\xa4\xa3\xf0\x9f\xa4\xa3\n#StartUpEp3'
395,2020-10-25 05:52:27+00:00,b'Bengekkk bgt scene ini \xf0\x9f\x98\xad\xf0\x9f\x98\xad\xf0\x9f\x98\xad\xf0\x9f\x98\xad\n#StartUpEp3 https://t.co/IBdHkAV02g'
396,2020-10-25 05:50:09+00:00,b'knp aku ga sempet2 nonton #StartUpEp3'
397,2020-10-25 05:44:08+00:00,"b'Laptrip talaga Yung video eh. Hahaha. Nakakahiya \xf0\x9f\x99\x88pero buti na lang, nagustuhan nung guy \xf0\x9f\x98\x85 #StartUpEp3 https://t.co/Vk3AeeI6km'"
398,2020-10-25 05:37:47+00:00,"b'Kalau mau jadi celeb jadilah seperti Suzy, Cantik, Berbakat, berprestasi, perkenalkan Suzy si Seleb wanita korea pertama dan satu-satunya peraih 4 rookie awards di 4 bidang sekaligus (singer,drama,movie,variety) #startup #StartUpEp3 https://t.co/02BbWdQPrA'"
399,2020-10-25 05:35:33+00:00,b'Mas why u malah nyumput ah. #StartUpEp3 #StartUp https://t.co/XQL6Yik8Tm'
400,2020-10-25 05:35:02+00:00,b'Ini nonton drama-drama berhubungan sama masa depan dan mimpi bikin mewek bawang bgt.\nMulai ditabrak dan ditonjok realita kayaknya gue \n#StartUpEp3 #StartUp'
401,2020-10-25 05:32:49+00:00,b'Do you like Seo dal mi?\nJi pyeong : No\ndo san : yes\nMe : NOOOOOOO JI PYEONG NO AAAAARRGH\n#StartUpEp3 #StartUp https://t.co/u6Tt1doGLs'
402,2020-10-25 05:31:29+00:00,b'epilog #StartUpEp3 jahat bgt bikin sakit perut ampe nangis \xf0\x9f\x98\xad'
403,2020-10-25 05:26:13+00:00,b'#StartUpEp3 sepertinya bakal gw lanjut wkwk'
404,2020-10-25 05:25:08+00:00,b'INI KOCAK BANGET #StartUpEp3 https://t.co/mXWzeCtpGX'
405,2020-12-13 17:00:01+00:00,b'Next year could be decisive for the world \xf0\x9f\x8c\x8f. 2020 has taught us that we need to work together for a stronger response and show that we can build back better.\n\nJoin in. Be the change.'
406,2020-10-25 05:24:38+00:00,"b'Semalam cukup menghibur,\nGak berhenti ketawa di episode ke 3 ini,,\nBanyak hikmahnya sihh di drama ini,makanya aku balik nonton drakor lagi.\n#StartUp\n#StartUpEp3 https://t.co/1QSjPbT548'"
407,2020-10-25 05:23:46+00:00,b'DEMI ALLAH GAJELAS\xf0\x9f\x98\xad\xf0\x9f\xa4\xa3 #StartUpEp3 https://t.co/gNjJ553VBT'
408,2020-10-25 05:18:10+00:00,"b'Nonton #StartUpEp3 w mirip punya kepribadian ganda,  ketawaa,  habis tu sedih,  habis tu kesal. \nDurasi 1 1/2 jam terasa bentar https://t.co/W5JnmGc1V1'"
409,2020-10-25 05:16:17+00:00,b'Disuruh mutusin malahan ngasi kata2 mimpi indah...ga sinkron nih Ji Pyoeng\n\n#StartUpEp3 https://t.co/AwAZLSCv6b'
410,2020-10-25 05:15:50+00:00,b'YA ALLAH disini kenapa nam joo hyuk BOBROK bngttt\xf0\x9f\x98\xad\xf0\x9f\x98\xad\xf0\x9f\x98\xad\nG bisa g ketawa woi\xf0\x9f\x98\xad\nKesian liat kim seon ho udh gedeg \xf0\x9f\x98\xad\nMood bngt nontonya\xf0\x9f\xa5\xb0\xf0\x9f\xa5\xb0\n#StartUpEp3 \n#StartUp https://t.co/U9HwhaIAPi'
411,2020-10-25 05:14:39+00:00,b'HAHAHA POTANGINA NUNG BATUHAN NG LYRICS NG NATIONAL ANTHEM HAHAHAHAHAHAH #StartUpEp3'
412,2020-10-25 05:14:08+00:00,b'Ya Allahh.. kirimkam cowo yang kaya Han Ji Pyeong kepadakuu \xf0\x9f\x98\x94 #StartUpEp3'
413,2020-10-25 05:12:22+00:00,"b'#StartUpEp3 \nSPEECH DO-SAN NGAKAK BANGET ASTAGA, SEPUPUNYA KURANG AJAR EMANG \xf0\x9f\x98\xad\xf0\x9f\x91\x8d\xf0\x9f\x8f\xbb'"
414,2020-10-25 05:09:28+00:00,b'Yawlah gue ngakak tengah malem liat ending begini #StartUpEp3 https://t.co/9TfeRyY4KX'
415,2020-10-25 05:08:52+00:00,"b""HAN JI PYEONG KNOWS DALMI'S PAIN!!!!! #StartUpEp3 #Suzy #NamJooHyuk #KimSeonHo #KangHanNa https://t.co/gRMHT7wWZV"""
416,2020-10-25 05:08:43+00:00,b'Ga nonton drama lain selain #StartUpEp3 #StartUp'
417,2020-10-25 05:07:12+00:00,b'Closing #StartUpEp3 memang terbaeeeeekkkk \xf0\x9f\xa4\xa3\xf0\x9f\xa4\xa3\xf0\x9f\xa4\xa3\xf0\x9f\xa4\xa3\n\nhttps://t.co/EyxqyBjORa'
418,2020-10-25 05:06:30+00:00,b'HAHAHHAHAHAHHA TAWANG TAWA AKO SA LAST PART\xf0\x9f\xa4\xa3\xf0\x9f\xa4\xa3 #StartUpEp3'
419,2020-10-25 05:05:30+00:00,b'#StartUpEp3 second lead syndoremnya masi strong \xf0\x9f\x99\x82\xf0\x9f\xa4\x9a\xf0\x9f\x8f\xbb https://t.co/xwvGU8xcBY'
420,2020-10-25 05:02:57+00:00,b'ajujujuju #StartUpEp3 https://t.co/njfNtH3Bwa'
421,2020-10-25 04:59:18+00:00,b'Ngakak\xf0\x9f\x98\xad\xf0\x9f\x98\xad polos bgt. \n#StartUpEp3\n#StartUp https://t.co/5x8XHueuOf'
422,2020-10-25 04:58:44+00:00,"b'"" apakah kau menyukai seo dalmi?""\nJin pyong + dosan  : \xf0\x9f\x98\xaf\xe2\x98\xba\n\nMeanwhile, seo dal mi : \xf0\x9f\x98\xb4\n\nAiguuu yaa \xf0\x9f\x98\x82\xf0\x9f\x98\x82\xf0\x9f\x98\x82\xf0\x9f\x98\x82\n#StartUpEp3 \n#Suzy \n#StartUp https://t.co/mM8emhqg4i'"
423,2020-10-25 04:58:17+00:00,b'naiisip ko parin yung ending ng #StartUpEp3 at tawang tawa parin ako \xf0\x9f\x98\xad\xf0\x9f\xa4\xa3'
424,2020-10-25 04:54:53+00:00,"b'Woooohh #StartUpEp3 masih trending ajaa, pasti efek video Do San \xf0\x9f\x98\x82'"
425,2020-10-25 04:54:20+00:00,b'haha kesian yongsil kena marah dengan jipyeong \xf0\x9f\xa4\xa3\xf0\x9f\xa4\xa3\n\n#StartUp #\xec\x8a\xa4\xed\x83\x80\xed\x8a\xb8\xec\x97\x85 #StartUpEp3 #KimSeonho #\xea\xb9\x80\xec\x84\xa0\xed\x98\xb8 https://t.co/sWAbAJEKyv'
426,2020-10-25 04:53:11+00:00,"b'Jin pyeong yg sabar yaa ngadepin dosan,  anak nya ganteng tapi agak lemot dosan tuhhh \xf0\x9f\x98\x82\xf0\x9f\x98\x8d\n#StartUpEp3 \n#StartUp https://t.co/tSnpWGQsEU'"
427,2020-10-25 04:51:00+00:00,"b'si bapak aktif yaaa, jadi bapak ny gu rara,  jd bapak2 pemelihara anak imoogi (?) , skrng jd bpk tiri ny in jae \xf0\x9f\x98\x82\xf0\x9f\x98\x85\n#DoDoSolSolLaLaSol \n#TaleOfNineTailed \n#StartUpEp3 #StartUp https://t.co/mRrSvI3Tgm'"
428,2020-10-25 04:49:11+00:00,b'ngakak banget sama kelakuan dosan \xf0\x9f\x98\x82\n#NamJooHyuk \n#StartUpEp3 \n#StartUp https://t.co/6CEA9e87QJ'
429,2020-10-25 04:47:07+00:00,b'habis nonton #StartUpEp3 lanjut story of kale bikin mood campur aduk'
430,2020-10-25 04:44:31+00:00,b'habis nonton #StartUpEp3 lanjut nonton #StoryofKale bikin mood campur aduk ga sih?'
431,2020-10-25 04:41:48+00:00,b'iii mantep bgt trending #StartUpEp3 emang seseru itu yaampun \xf0\x9f\x98\xa9\xf0\x9f\x91\x8d\xf0\x9f\x8f\xbb https://t.co/TH97Ghb4Br'
432,2020-10-25 04:40:02+00:00,b'#StartUpEp3 sebuah kiat kiat https://t.co/ES7ecSzbnB'
433,2020-10-25 04:36:56+00:00,b'Kalian tim mana nih gaisss #StartUpEp3 https://t.co/eRhFm6H6Zc'
434,2020-10-25 04:35:39+00:00,b'Nam Do-San adalah aku \xf0\x9f\x98\x86\n\n#StartUpEp3 https://t.co/FpqrpNpCvQ'
435,2020-10-25 04:34:27+00:00,b'Tunggu ini apa..bae Suzy sejak kapan kamu bisa main gitar\xf0\x9f\x98\xb1\xf0\x9f\x98\xb1\n\n#StartUpEp3 https://t.co/5OgKxLBixQ'
436,2020-10-25 04:34:26+00:00,b'Ep 3 ad sedih sama lawak ny #StartUpEp3'
437,2020-10-25 04:33:52+00:00,b'Part paling bengek\xf0\x9f\x98\x82 #StartUpEp3 https://t.co/pQPl1zHFkC'
438,2020-10-25 04:32:10+00:00,b'belom nonton #StartUpEp3 \xf0\x9f\x98\xa4\xf0\x9f\x98\xa4\xf0\x9f\x98\xa4'
439,2020-10-25 04:31:59+00:00,b'Waah \xf0\x9f\x98\xb3\n\n#StartUpEp3 https://t.co/jeRhSmybfj'
440,2020-10-25 04:31:54+00:00,"b'pagi pagi di buat senyum"" sendiri + di buat bengek gara gara nonton ep3\xf0\x9f\xa4\xa3\xf0\x9f\xa4\xa3\n\n#StartUpEp3 https://t.co/AHHcffLgON'"
441,2020-10-25 04:30:41+00:00,b'#StartUpEp3 #StartUp \nKeren banget'
442,2020-10-25 04:28:34+00:00,b'Sedetik sebelum kekacauan \xf0\x9f\x98\x82\xf0\x9f\x98\x82\xf0\x9f\x98\x82\xf0\x9f\x98\x82 anjrot ngakak sampe lempar hape dong gue reflek bangke bgt wkwk #StartUpEp3 #StartUp https://t.co/9xOJAMlIWe'
443,2020-10-25 04:26:26+00:00,"b'Emg kok\n""Aku masih kecil suka sama yang om om""\n\n#StartUpEp3 #StartUp https://t.co/mbKkRVp00b'"
444,2020-10-25 04:25:25+00:00,b'Hahahahahaha josssss. Do San ini sungguh hhhhhh \xf0\x9f\xa5\xb0\xf0\x9f\xa5\xb0 #StartUpEp3 https://t.co/xYckXQ6bMX'
445,2020-10-25 04:24:52+00:00,b'Ampun gak berenti ketawa liat ini \xf0\x9f\xa4\xa3\n\n#StartUpEp3\nhttps://t.co/1NwTnuaMRs'
446,2020-10-25 04:24:29+00:00,b'Bakit sya yung second lead? \xf0\x9f\x98\xad #StartUpEp3'
447,2020-10-25 04:20:30+00:00,b'Anjirr bengek banget #StartUpEp3 \nNgakak sampe sakit perut wkwk'
448,2020-10-25 04:18:35+00:00,b'MOOD BGT #StartUpEp3 \xf0\x9f\x98\xad\xf0\x9f\x98\xb3\xf0\x9f\x98\xb3\xf0\x9f\x98\xb3 https://t.co/QfPvixvSty'
449,2020-10-25 04:18:10+00:00,"b'[ #StartUpEp3 beneran bikin galau,  tim dosan apa tim jipyeong ini duh gemes banget !! ] https://t.co/ah3VA6e7bu'"
450,2020-10-25 04:17:50+00:00,b'Yampun ini #StartUpEp3 ngakaaaaak \xf0\x9f\xa4\xa3\xf0\x9f\xa4\xa3\xf0\x9f\xa4\xa3\xf0\x9f\xa4\xa3\xf0\x9f\xa4\xa3\n\nMayan ya tapi ntar si sepupu dapet saham 1% \xf0\x9f\xa4\xa3\xf0\x9f\xa4\xa3\xf0\x9f\xa4\xa3\xf0\x9f\xa4\xa3\xf0\x9f\xa4\xa3 https://t.co/DDHq95rfNs'
451,2020-10-25 04:17:25+00:00,"b'Aku kira aku bakalan ga suka karakter Injae tp dari #StartUpEp3 malah kebalikannya. Injae tipikal wanita berprinsip, independent yg keren. Dia udah kerja keras buat bangun perusahaan tp ayah dan kakak tirinya malah mau nendang dia. I support you, Injae! https://t.co/gFdUiGvyvH'"
452,2020-10-25 04:17:07+00:00,b'Semalem mau nntn tp keburu ngantuk \xf0\x9f\x8f\x83\xf0\x9f\x8f\xbd\xe2\x80\x8d\xe2\x99\x80\xef\xb8\x8f\xf0\x9f\x92\xa8 #StartUpEp3 https://t.co/qSY0Pr4DD9'
453,2020-10-25 04:12:04+00:00,b'#StartUp #StartUpEp3 omona ini kenapa Nam Joo-Hyuk gemay banget'
454,2020-10-25 04:10:44+00:00,"b'""Jawaban disini yg bikin beda kenapa satu jd lead dan 2nd lead""\n-uni ria- pengamat drakor\n#StartUpEp3\n\nIni mirip seperti alasan jungpal vs taek di #Reply1988 https://t.co/tGVZrA20mA'"
455,2020-10-25 04:06:54+00:00,b'Liat ini aja gue sedih #StartUpEp3 https://t.co/KVZvCGCwiw'
456,2020-10-25 04:05:47+00:00,b'#StartUpEp3 trus aku kudu naek kapal yang mana \xf0\x9f\x99\x83\xf0\x9f\x99\x83\xf0\x9f\x99\x83\xe2\x9b\xb5\xe2\x9b\xb5\xe2\x9b\xb5\n#NamDoSan or #HanJiPyeong https://t.co/uQgahluzo3'
457,2020-10-25 04:05:28+00:00,b'astagfirullah kalian berdosa banget bengekk woii liatnya ketewa mulu\xf0\x9f\xa4\xa3\xf0\x9f\xa4\xa3#StartUpEp3 https://t.co/pt1O8yA4aH'
458,2020-10-25 04:03:49+00:00,b'bengek bgt \xf0\x9f\x98\xad\xf0\x9f\x98\xad\xf0\x9f\x98\xad \n#StartUpEp3 https://t.co/6fl8OfjWXu'
459,2020-10-25 04:02:43+00:00,b'Kocak benget sih ngintipin orang pacaran\xf0\x9f\x98\xad\xf0\x9f\x98\xad\xf0\x9f\x98\xad  #StartUp #StartUpEp3 https://t.co/DSBmzOcvSB'
460,2020-10-25 04:00:10+00:00,"b'WKWKWKK MUKA NYA SI DAL MI, jawaban mereka pas ditanya apakah mereka suka dal mi ternyta si ji pyeong bilang \xe2\x80\x9cngga\xe2\x80\x9d dan dosan bilang \xe2\x80\x9ciya\xe2\x80\x9d hmmm\xf0\x9f\x98\x80 #StartUpEp3 https://t.co/jOu5n3P1bq'"
461,2020-10-25 03:59:13+00:00,b'yaallah capek ketawa\xf0\x9f\x98\xad\n#StartUpEp3\nhttps://t.co/hiFfmwo4vy'
462,2020-10-25 03:57:28+00:00,b'WKWK EYA\xf0\x9f\xa4\xa3\xf0\x9f\xa4\xa3 astagaa sumpah ga berenti ketawa liat nam do san oon polos gitu wkwkwkwkwkk #StartUpEp3 https://t.co/lLmCBGBmoR'
