,Date,Tweet
422,2020-11-02 03:46:09+00:00,"b'Jadi, siapatu yang di akhir eps bikin penasaran ajasih anjir\xf0\x9f\x98\xad\n\n#StartUpEp6'"
423,2020-11-02 03:43:12+00:00,"b'#StartUpEp6\nBanyak jg yg complain scene main leadnya kenapa dikit bgt, kenapa lemah bgt, kenapa lebih kuat ke second lead. \nSeperti judul episode ini yaitu ""key man"" di ep ini ditunjukkin siapa pemegang kunci sebenarnya disini, yakni dosan. dia kunci dari kebohongan halmeoni.'"
424,2020-11-02 03:43:07+00:00,b'Andai Dalmi tahu bahwa yang mengirim surat selama ini adalah Han.\n\n#StartUpEp6 #BaeSuzy https://t.co/Js2dF5y79t'
425,2020-11-02 03:41:45+00:00,b'@y GAPAI SEMUA JEMARIKU RANGKUL AKU DALAM BAHAGIAMU\nSMAN 1\n\xf0\x9f\x9a\x80\xf0\x9f\x8c\x8c https://t.co/dxX0qYdhFn \n#AniesManisCebongNangis\nReply 1988\n#StartUpEp6\n#TolakDemoPasukanNasbung\n#OmnibusBeriManfaatBaik\n#WeLoveYouTen\n#OleOut\n#BersatuDukungBPIP\n#KIMTAEHYUNG'
426,2020-11-02 03:41:44+00:00,b'Lagi pada demam kim seonho \xf0\x9f\x98\x82\nGaes cara meredakan second lead syndrome kudu minum apa ya? Help \n\n#StartUpEp6 https://t.co/pEI5E6GM6i'
427,2020-11-02 03:41:38+00:00,"b""ANAK STM KONDANGAN DI KOREA \n\nKira kira gini guys gambaran kalau anak STM kondangan, bener atau bener? \xf0\x9f\xa4\xa3\n\nSource : Drama Korea 'Start Up'\n\n#startup #startupep6 #startupep7 #jokes #entertainment #smkbisasmkhebat #smkindonesia #sekolahindonesia #sekolahkejurusan #dramakorea https://t.co/c5sOWDO6Ts"""
428,2020-11-02 03:39:13+00:00,b'Naging makata nung nainlove\xf0\x9f\x98\x82\xf0\x9f\x98\x8d\n\n#NamJooHyuk \n#StartUpEp6\n#StartUp https://t.co/THindCuM1w'
429,2020-11-02 03:39:04+00:00,b'Baby Dosan \xf0\x9f\x98\xa2\xf0\x9f\xa4\x97\n#StartUp #TeamDoDal #DoDal #Suzy #NamJooHyuk #\xec\x8a\xa4\xed\x83\x80\xed\x8a\xb8\xec\x97\x85 #\xeb\x8f\x84\xeb\x8b\xac #\xec\x88\x98\xec\xa7\x80 #\xeb\x82\xa8\xec\xa3\xbc\xed\x98\x81 #DALMI #StartUpEp6 https://t.co/RhwSxFaH25'
430,2020-11-02 03:34:52+00:00,"b'Plis ya itu yg terakhir cowok pake hoodie item siapeee woii jgn kayak IOTNBO \xf0\x9f\x98\xad\xf0\x9f\x98\xad\xf0\x9f\x98\xad #StartUpEp6\n.\nBiar gua tebak, cowok itu mungkin ada diantara trio san, mungkin~~~'"
431,2020-11-02 03:34:33+00:00,b'WKWKWKW\xe2\x9c\x8c\xf0\x9f\x98\xad\xe2\x9c\x8c #StartUpEp6 https://t.co/mwi4lXhOAZ'
432,2020-11-02 03:31:07+00:00,"b'Hah itu siapa yg sebenernya nulis ""balas dendam""?!? #StartUpEp6'"
433,2020-11-02 03:30:03+00:00,"b'bengek nonton ginian geh udah kaya naik roller coster tegang, ketawa, sedih \xf0\x9f\x98\xad\xf0\x9f\x98\xad\xf0\x9f\x98\xad #StartUpEp6 https://t.co/8LDqFv824l'"
434,2020-11-02 03:28:49+00:00,"b'Ingin jadi orang baik atau CEO? Jangan serakah. Pilih salah satu. Kau tidak mungkin menyenangkan hati semua pihak. Apapun pilihanmu, kau akan selalu diumpat.\nHan Ji Pyoeng\n#StartUpEp6'"
435,2020-11-02 03:25:09+00:00,b'Ayoo sapa nak balas dendam ni \xf0\x9f\xa5\xba #StartUpEp6'
436,2020-11-02 03:24:49+00:00,b'#StartUpEp6 dibawa ketawa ketawa sampai pertengahan episode gara-gara Dosan dan kawan kawan dibikin sedih sama halmeoni yang kemungkinan buta \xf0\x9f\x98\xad\xf0\x9f\x98\xad\xf0\x9f\x98\xad'
437,2020-11-02 03:24:36+00:00,"b'kmu ada di shopee ga, aku muk beli\n #StartUpEp6 https://t.co/bofMtUORXI'"
438,2020-11-02 03:22:10+00:00,b'Mau lah dimentorin sama pak Han #StartUpEp6'
439,2020-11-02 03:22:03+00:00,b'Aku bucinnya dosan - dalmi fix no debat \xf0\x9f\x98\x82 #StartUpEp6 https://t.co/bB1nTmuGZu'
440,2020-11-02 03:21:22+00:00,b'si injae ini ya ngeselin banget\xf0\x9f\x98\xa1 #StartUpEp6 https://t.co/qEUbASrx6u'
441,2020-11-02 03:17:47+00:00,b'https://t.co/yqQdRECHlk\n\nSMAN 1 SDN 1 Reply 1988 #OleOut Pogba Arsenal #StartUpEp6 Emyu'
442,2020-11-02 03:14:49+00:00,b'baru nonton startup tapi bakal seru keknya.. alternatif buat belajar nabung saham dll tp lewat cara yg seru yehhh.. #StartUpEp6'
443,2020-11-02 03:08:29+00:00,b'ini siapa spertinya gamtenk\n\n#StartUp \n #StartUpEp6 https://t.co/mFFXojZGGr'
444,2020-11-02 03:05:42+00:00,"b'Pengen cpt"" beres ujiannn biar lgsg cuss nonton #StartUpEp5 dan #StartUpEp6'"
445,2020-11-02 03:01:37+00:00,b'Ah di episode kali ini campur aduk ada seneng ada sedihnya jg!  Btw ga tega liat neneknya kalo sempe dia buta nanti \xf0\x9f\x98\xad\xf0\x9f\x98\xad#StartUpEp6 https://t.co/wIPcV5c2mR'
446,2020-11-02 03:00:04+00:00,b'Nenek jgn bikin nangis mulu tiap ep \xf0\x9f\x98\xad #StartUpEp6'
447,2020-11-02 02:57:18+00:00,b'#StartUpEp6 trending tapi kategorinya di business &amp; finance :('
448,2020-11-02 02:53:44+00:00,"b'Udah yah jangn bikin gua mikir yang macem2 ggra orang ini, nunggu episode selanjutnya lma bikin ga bisa tidur nyenyak woy\xf0\x9f\x98\x82 #StartUpEp6 https://t.co/rpE15HPgre'"
449,2020-11-02 02:53:28+00:00,"b'Ji-Pyeong potensinya banyak. Alternatif jika tak bersama In-Jae. Tapi aku lebih prefer Saha sih, satu frequent bokkk. \xf0\x9f\x98\x82\xf0\x9f\x98\x82\xf0\x9f\x98\x82\n#StartUp #StartUpEp6 https://t.co/5ZGyQkNfnF'"
450,2020-11-02 02:50:31+00:00,"b'Emang ada apa guys sama jurnalrisa dan keanu ama fadil, di youtube ko rame bener \xf0\x9f\x98\xac\nhttps://t.co/kczH0laDSY\n\nTrending :\nSMAN 1\n#AniesManisCebongNangis\n#TWICEdeservesRESPECT\nDOYOUNG ACTOR\nPogba\n#WeLoveYouTen\n#OleOut\nSECRET NUMBER GOT THAT BOOM\n#StartUpEp6\n#BIGBANG'"
451,2020-11-02 02:47:19+00:00,"b'Bismillah kalau iya, otw peningkatan aktingnya. \xe2\x98\xba\xef\xb8\x8f\xe2\x98\xba\xef\xb8\x8f\xe2\x98\xba\xef\xb8\x8f #StartUp #StartUpep6 https://t.co/fnAOljj0DU'"
452,2020-11-02 02:46:22+00:00,b'@y SELAMAT PAGI.\xf0\x9f\x92\xab\nSMAN 1\n\xf0\x9f\x9a\x80\xf0\x9f\x8c\x8c https://t.co/dxX0qYdhFn \n#AniesManisCebongNangis\nReply 1988\n#StartUpEp6\n#TolakDemoPasukanNasbung\n#OmnibusBeriManfaatBaik\n#WeLoveYouTen\n#OleOut\n#BersatuDukungBPIP\n#KIMTAEHYUNG'
453,2020-11-02 02:46:09+00:00,b'masih trending!! #StartUpEp6 https://t.co/72JXsiY8P8'
454,2020-11-02 02:44:41+00:00,b'Gw sebenernya penumpang kapal dosan-dalmi tp dari hati lubuk gw yg paling dalem menginginkan jipyeong sama dalmi\xf0\x9f\x98\xad. Gapapa mas jipyeong sama aku aja\n\n#StartUp\n#StartUpEp6 https://t.co/xH4dkMrhxy'
455,2020-11-02 02:44:33+00:00,b'Selamat Pagii...\xf0\x9f\x98\x87\nAwal pekan bulan November\n\nKamu pasti bisa...FIGHTING!!! \n\n#StartUp #StartUpEp5 #StartUpEp6 https://t.co/LlXBlXtPXb'
456,2020-11-02 02:44:12+00:00,"b'Won in jae ini pinter yang licik, ya. \n\n#StartUpEp6'"
457,2020-11-02 02:43:31+00:00,b'Hilangkan bengak nya kalian\nReply 1988\nSMAN 1\nPogba \n#StartUpEp6\n#seninwaktunyakerja\n#BarisanProKerja https://t.co/oIZlY8dOZH'
458,2020-11-02 02:43:28+00:00,b'otakku langsung drakor \xf0\x9f\xa4\xa3 Salam dariku yg mulai drakoran lagiiiii hahaha #StartUpEp6 https://t.co/q787s56NI0'
459,2020-11-02 02:42:20+00:00,"b'#StartUpEp6 #BersatuDukungBPIP #COYG Beli komik seri cabutan level comic m&amp;c dan elex media \nhttps://t.co/BG1d4cjht5 di toko 804d3nk Rp3.750 di Tokopedia dengan Bebas Ongkir, Sekarang!'"
460,2020-11-02 02:41:09+00:00,b'#StartUpEp6 WHY ALEX TAK JADI MENTOR KESIAN DIAAAAAAAA'
461,2020-11-02 02:39:50+00:00,b'Kocak sih mereka \xf0\x9f\x98\x85\n\n#StartUpEp6 https://t.co/tjSHwItkCu'
462,2020-11-02 02:38:47+00:00,b'\xf0\x9f\xa5\xba\xf0\x9f\xa4\xa7\nHAN JI PYEONG\nHAN JI PYEONG\nHAN JI PYEONG\n\n#StartUpEp6 #StartUp https://t.co/vZAAyEtzEW'
463,2020-11-02 02:38:44+00:00,"b'T t terus ini kaya settingan rumahnya jungpal gaksi di replay 1988, aigo kim sajang\xf0\x9f\x98\xad #StartUpEp6 https://t.co/tPm8uz44i6'"
464,2020-11-02 02:38:37+00:00,b'akhirnya ada scene duaan ya kak #StartUpEp6 https://t.co/vez8UDuADG'
465,2020-11-02 02:35:57+00:00,b'Hwaaaaaaa blm sanggup lanjutin #StartUpEp6 \nBlm siao pokoknya blm :(('
466,2020-11-02 02:35:13+00:00,b'Sabarrrr masi utsss\xf0\x9f\x98\xad #StartUpEp6'
467,2020-11-02 02:33:40+00:00,b'Dari dokter Indonesia\nKlaster demo akan picu lonjakan covid 19.  Reply 1988\n#StartUpEp6\nPogba #OleOut\n#seninwaktunyakerja\n#BarisanProKerja https://t.co/0wDWykXu9E'
468,2020-11-02 02:26:50+00:00,"b'Baru kali ini dah oleng ke second lead uuuh parah han ji pyong pesonanya, ini nih drama pemecah belah umat nih uda kaya perkara bubur #StartUpEp6 https://t.co/QMOoWPHiOB'"
469,2020-11-02 02:26:48+00:00,"b'UTS tidak menghalangi nonton #StartUpEp6 :"")) https://t.co/Pq9n69cDBy'"
470,2020-11-02 02:24:16+00:00,b'ini gue yang halu apa emang han ji pyeong mirip banget sama sehun sih dari samping? #StartUpEp6 #StartUp https://t.co/TMbFNb9Pby'
471,2020-11-02 02:23:54+00:00,b'KPAI temukan bocah yang di bayar 5000 untuk demo UU cipta kerja\nPasti suruhan Oposisi #StartUpEp6 #Reply1988 #Pogba\n\n#seninwaktunyakerja\n#barisanprokerja https://t.co/fr6XAH46T0'
472,2020-11-02 02:23:13+00:00,b'WOYYY ELAH INI SAPE LAGIIII \xf0\x9f\x98\xad\nJIPYEONG CEMBURUUUU\nDAL MI DIBELA DOSAN \nBISA GA SII LANGSUNG FULL EPS AJAAAHHH \n\n#StartUpEp6 https://t.co/PXXFGizTdH'
473,2020-11-02 02:23:10+00:00,b'Gapapa aku disuruh mikir\xf0\x9f\x99\x82#StartUpEp6'
474,2020-11-02 02:22:18+00:00,b'sanaol free HAHAHA\n\n#StartUp #StartUpEp6 https://t.co/DkxvCaLS6d'
475,2020-11-02 02:20:04+00:00,b'trendsforyou pagi ini #startupep6 sm #Reply1988 yokk mari yokk \xf0\x9f\x98\x84\xf0\x9f\x98\x84\xf0\x9f\x98\x84'
476,2020-11-02 02:20:04+00:00,b'Gua ga demen dah nih si halmoni nya sakit trs tau2 meninggal gua ga demen ya dibikin nangissss terusss woyyy \xf0\x9f\x98\xad\xf0\x9f\x98\xad\xf0\x9f\x98\xad #StartUpEp6'
477,2020-11-02 02:18:29+00:00,"b'#StartUpEp6 bener2 yaa bikin tarik napas, tahan napas, ngakak, nanguis, uwu, dah lahh gasabar hari Sabtu'"
478,2020-11-02 02:14:12+00:00,b'Ya Rabb... bikin gemesssss #StartUpEp6 https://t.co/Kj6PX0NN6O'
479,2020-11-02 02:12:16+00:00,b'Ga gampang memulai bisnis walau udh ada ikatan pertemanan yg erat terbukti hy karena pembagian saham mereka bisa ribut syukurlah ga lama pada sadar klo Dosan lah yg plg py andil atas berdirinya Samsan Tech dan mereka ttp bisa percaya semua keputusan Dosan\n#StartUpEp6 https://t.co/ydAS9WNGNG'
480,2020-11-02 02:11:51+00:00,b'SIAPA YG NULIS ANJIM GREGET #StartUpEp6 balas dendam'
481,2020-11-02 02:10:00+00:00,"b""Gimana #StartUpEp6 semalem? Masih berpegang erat dengan second lead kan, Han Ji-pyeong? :') \n\nTim Nam Do-san\natau\nTim Han Ji-pyeong nih?\n\nhttps://t.co/CVw8vupojH"""
482,2020-11-02 02:05:38+00:00,b'Aku tak suka lah kakak si dal mi ni \xf0\x9f\x98\x92\n#StartUpEp6'
483,2020-11-02 02:05:35+00:00,"b'Masih ngakak ingat adegan pas Nam Dosan dkk di RS \xf0\x9f\xa4\xa3 langsung ingat kelakuan 3 idiot lol. Kocak parah perkara susu smpe hampir buta, dokternya pake dicium juga sama Chul San \xf0\x9f\x98\x86 #StartUpEp6'"
484,2020-11-02 02:05:23+00:00,"b'entah kenapa aku terhibur dengan komentar knetz yg satu ini, akan menjadi keajaiban bila komentar ini terjadi \xf0\x9f\x99\x8f nenek dalmi mereka layak bahagia \xf0\x9f\x98\xa2#suzy #StartUp #StartUpEp6 https://t.co/ZDpvF4axZg'"
485,2020-11-02 02:03:57+00:00,b'Ewan ko kung ako lang pero ang qt ni alex HAHAHAHAH #StartUpEp6 https://t.co/hny6NbNfJa'
486,2020-11-02 02:03:19+00:00,"b'Masih penumpang kapal ini, tp aneh aj banyakan yg ribet sama hidup pak Han. Dri awal ngeh aja benang merah dosan asli emang dalmi, klo pak Han ya sama nenek, penasaran depyonimnya emang sengaja buat gelombang second lead, atau malah nggak nyangka Pak Han seviral it #StartUpEp6 https://t.co/90eUuespQZ'"
487,2020-11-02 02:02:34+00:00,"b'Nonton start up udah berasa kek nonton twom, penasaran banget tiap episode selanjutnya. Dan teori-teori for the next episodpun bermunculan \xf0\x9f\x98\xb9 #StartUpEp6'"
488,2020-11-02 02:02:34+00:00,b'apa cuma aku yg ga kena second lead syndrome karena seleranya emang sm programmer \xf0\x9f\xa4\xa3 #StartUpEp5 #StartUpEp6'
489,2020-11-02 02:00:22+00:00,b'Orang baik VS CEO\n#hanjipyeong\n#StartUp \n#StartUpEp6 \n#KimSeonHo https://t.co/5XKLxDLDWz'
490,2020-11-02 01:58:46+00:00,"b'Pake nanya lagi kenal sama ayahnya. IDIHH pake manggil ayah lagi , buat ngambil kesempatan . Selama ini gk pernah tuh manggil ayah , yg ada malah kamu ngejauhin  dan ngehina bpk lo. Rasanya pgen teriak "" ITU DALMI WOIII "" gedek bget ama kelakuannya in jae \xf0\x9f\x98\xa1\n#StartUpEp6 #StartUp https://t.co/FdKx4aBJHR'"
491,2020-11-02 01:58:13+00:00,"b'masih dijalur yang sama, team pak han\xf0\x9f\xa5\xb0\n#StartUpEp6 https://t.co/vVJquznzY9'"
492,2020-11-02 01:58:04+00:00,b'sa totoo lang gusto ko na lang din talagang maging halaman e \xf0\x9f\x98\x8c\n#StartUpEp6 #StartUp\n https://t.co/46whpwEEjg'
493,2020-11-02 01:57:06+00:00,b'Mari kita dukung injae \nMari kita dukung dosan\n\n#StartUpEp6 https://t.co/Ii4TBRrtQL'
494,2020-11-02 01:56:57+00:00,b'terucul \xf0\x9f\x98\x86\xf0\x9f\xa4\xa3 #StartUpEp6 #StartUp https://t.co/TBGHiEMCNa'
495,2020-11-02 01:55:04+00:00,b'Berharap pada second lead adalah patah hati yang disengaja\n\xf0\x9f\x99\x82\xf0\x9f\x98\xad\n#StartUpEp6 #\xec\x8a\xa4\xed\x83\x80\xed\x8a\xb8\xec\x97\x85\n#KimSeonHo \n#HanJipyeong https://t.co/U58tg4Eu8j'
496,2020-11-02 01:55:04+00:00,"b'Karena dari awal PHR pake metaphor di drama ini, tiati aja semua scene yang kita anggap ngga penting bakal masuk akal kalau nanti dramanya selesai, tinggal tunggu aja PHR drop the bomb huhu, siap siap yaa kita semua #StartUpEp6'"
497,2020-11-02 01:54:19+00:00,"b'Dahal dari #StartUpEp1 sampe #StartUpEp5 gue masih mencoba untuk mengerti Injae kenapa dia bisa bersikap seperti itu, tapi di #StartUpEp6 dia malah kek ular berbisa. Injae kenapa kamu harus berbuat terlalu jauh\xf0\x9f\x98\x8c'"
498,2020-11-02 01:53:42+00:00,b'Ngakak liat respon si om ini\xf0\x9f\xa4\xa3\n#StartUpEp6 \n#StartUp https://t.co/40iVjj2jZS'
499,2020-11-02 01:53:05+00:00,"b'Crte apa ni , asik buat aku nangis je #StartUpEp6'"
500,2020-11-02 01:53:01+00:00,b'VideoVIRAL 2020!.. Artis indo inisial AR mesum dgn pria medan di hotel. No sensor durasi 24 mnt \xf0\x9f\x94\xa5\xf0\x9f\x98\xb1\nLink&gt; https://t.co/hlbzPIMD8b\n\nViralUPDATE\n\n #MUNARS\n#StartUpEp6 \n#OleOut \n#OmnibusBeriManfaatBaik \n#TerapkanIslamUmmatTentram \n#AniesManisCebongNangis \n#dgitm \n#HBDTharnKirigun https://t.co/2T3c2Jje24'
