,Date,Tweet
274,2020-11-01 11:07:39+00:00,"b'#StartUpEp5 ini Alex lucu juga ya karakternya. Sejauh ini jadi angin segar buat samsan tech, tapi nanti ga tau... Abis ambigu kemarin kalau ada yg jadi badai juga'"
275,2020-11-01 11:06:00+00:00,b'Apalah daya sekenlid\xf0\x9f\x99\x82\xf0\x9f\x99\x82\n\n#StartUpEp5 https://t.co/afDbxBgnXs'
276,2020-11-01 11:05:19+00:00,"b'Mungkin kau takan pernah tau, betapa mudahnya kau untuk dikagumi~ dalmi ayo sadar....\n#StartUp #StartUpEp5 #StartUpEp6 #suzy #teamjiepyoeng https://t.co/2EQrHRPjcf'"
277,2020-11-01 11:05:18+00:00,b'#StartUpEp5 masih tim Nam Do San sejauh ini \xf0\x9f\xa4\xad\nHan Jipyeong emang baik... Tapi berasa klik aja Dalmi Dosan tuh'
278,2020-11-01 11:03:21+00:00,b'Habis tgk #StartUpEp5 i wanna cry \xf0\x9f\xa4\xa7\xf0\x9f\xa4\xa7'
279,2020-11-01 10:54:29+00:00,b'Nam Do San tiap episode makin kalah sama si Anak Baik dimata penonton. Hoki aja karena Dalmi bucin pake banget \xf0\x9f\xa4\xa3 #StartUpEp5 \n\nBtw designer Samsan tech cuma sampai eps 5 aja ni ? \xf0\x9f\x98\xad'
280,2020-11-01 10:54:14+00:00,"b'setelah akhirnya tugas dan deadline udh beres semua dan pengen refreshing, bukannya happy malah mengheningkan cipta \xf0\x9f\x98\xad\n#StartUpEp5 https://t.co/JoXpYF8XcZ'"
281,2020-11-01 10:50:42+00:00,b'padahal aku dsini nunggu km loh mas ji pyeonggg\n\n#StartUpEp5 https://t.co/CiMmMwhz87'
282,2020-11-01 10:44:56+00:00,b'Aku ketika ada camilan gratis\n\n#StartUpEp5 https://t.co/wSnHPkkJm7'
283,2020-11-01 10:44:13+00:00,b'#StartUpEp5 kalau tentang love line-nya? Ahahaha aku mau ngetwitt ini aja lah: yang gaspol tapi gak jujur sejak awal akan kalah dengan yang slow tapi dia jujur. \xf0\x9f\xa4\xad'
284,2020-11-01 10:41:51+00:00,b'So childish. Cuman masalah tim dosan sama ji pyeong aja diributin. Dalmi nya aja slow ae wkwk #StartUpEp5'
285,2020-11-01 10:38:29+00:00,b'#StartUpEp5 Han Ji Pyeong Cuts \n\nCr. Seonh0__kim https://t.co/Z7m7bSlXNp'
286,2020-11-01 10:31:42+00:00,b'Aarghh second lead syndrome detected \xf0\x9f\x98\xad \xf0\x9f\xa4\x8d gatau kenapa sayang bgt sama anak baik ini \xf0\x9f\x98\x8d Ji Pyeong manis bgt \xe2\x9d\xa4\xef\xb8\x8f apalagi lesung pipinyaa asjgkhstsjnsm #StartUp #StartUpEp5 https://t.co/ewqotgzBEe'
287,2020-11-01 10:28:32+00:00,b'Inilah tugas second lead membantu main lead bersatu \xf0\x9f\x98\xad anak baik yg sabar yahh \xe2\x9d\xa4\xef\xb8\x8f #StartUp #StartUpEp5 https://t.co/vHZ4dlOnt4'
288,2020-11-01 10:26:09+00:00,b'#StartUpEp5 deg deg an parah.. overall semua pemainnya mendukung kecuali team injae company wkwk'
289,2020-11-01 10:17:09+00:00,"b'mga litratong mapapasabi ka ng ""kelan kaya?""\nmapapa-sana all ka na lang talaga e.\n#StartUpEp5 #StartUp https://t.co/qe0QcMO6HK'"
290,2020-11-01 10:04:58+00:00,"b'Start up, drama dengan satu episodenya rasa nano2,\n#StartUpEp5 https://t.co/BuyR6px8pN'"
291,2020-11-01 10:00:41+00:00,b'Dahlah makin gx sabar liat #StartUpEp5 mau liat si Sa Ha gmn jadinya\xf0\x9f\x98\xad'
292,2020-11-01 09:57:03+00:00,b'Aq harap sgt start up mcm itaewon class.. start dri bwh then brjaya gilaaa!!! Bammm padann muka semua yg downgrade!!!! #StartUp #StartUpEp5 #ItaeWonClass #kdrama'
293,2020-11-01 09:52:42+00:00,"b'Scene yang membuat semangat menjadi membara \xf0\x9f\x92\xaa Coba modelan Sandbox ada di Indonesia ya :""\n\n#StartUp \n#StartUpEp5 \n#BaeSuzy #NamJooHyuk https://t.co/dN2FEIzdaW'"
294,2020-11-01 09:50:15+00:00,b'Selalu suka interaksi halmonie sama anak baik tapi akhirnya malah jadi sedih \xf0\x9f\x98\x85\n#StartUpEp5 https://t.co/MvRH7rmaoQ'
295,2020-11-01 09:43:49+00:00,"b'Tolong, aku tetap kapal lead male lead female, nggak secondlead\xc2\xb2 male\xf0\x9f\xa4\xa3\xf0\x9f\x98\xad\n\nMaaf mr. Han :"") wkwk\n#StartUp #StartUpEp5 \xf0\x9f\x90\xa7 https://t.co/o1I2ShSNi0'"
296,2020-11-01 09:34:02+00:00,b'#StartUpEp5 #StartUp cepet tamaaatt plisss aku gak sanggup nunggu seminggu sekali\xf0\x9f\x98\xad\xf0\x9f\x98\xad\xf0\x9f\x98\xad https://t.co/hcBwFl7XZS'
297,2020-11-01 09:33:04+00:00,b'Ganda ng #StartUpEp5'
298,2020-11-01 09:29:46+00:00,b'dia yg meremehkan belum tentu lebih baik dari orang yg ia remehkan\n\n#StartUpEp5 \n#StartUp https://t.co/r7lhkXvMwN'
299,2020-11-01 09:27:05+00:00,"b'[cont] kek gitu, temennya aja lbh pro dr dia) naah jadi aku kepo bgt ""istimewa"" nya dosan dmna:""(( tp seneng bgt sama karakter dosan yg klo udh ambisius tu bener2 berjuang:)\nada yg bisa memberikan pencerahan?\xf0\x9f\xa4\xa3\xf0\x9f\xa4\xa3\xf0\x9f\x98\xad\n#StartUp #StartUpEp5 \njan lupa nnti malem guys\xf0\x9f\xa5\xb3'"
300,2020-11-01 09:25:02+00:00,b'KIYOWOO!! Aku harus ngumpulin foto Suzy pake Hoodie ini mah!\xe2\x9d\xa3\xef\xb8\x8f\n#StartUpEp5 #StartUp #Suzy https://t.co/GNnTKeyCqO'
301,2020-11-01 09:21:51+00:00,b'writernim~ kenapa dosan sama dalmi harus berpelukan depan jipyeong \xf0\x9f\x92\x94 #StartUpEp5'
302,2020-11-01 09:20:51+00:00,"b'Jeongmal mianhe Han Timjang, tapi aku di kapal mereka \xf0\x9f\x92\x99\xf0\x9f\x92\x99\n#StartUp #StartUpEp5 https://t.co/Xmgwa4QSRg'"
303,2020-11-01 09:14:26+00:00,"b'Jipyeong itu beraninya cuma dari belakang aja, sementara dosan selalu di sampingnya, didepannya, dibelakangnya. \nSemakin kesini bomat ttg end game romancenya. Berharap samsan boy sama dalmi sukses dan Jipyeong find his own happiness\n#StartUpEp5 https://t.co/28HTULRxpw'"
304,2020-01-05 00:43:01+00:00,"b""Don't miss hotel deals like these! Our price discovery engine works 24/7 to bring you the best hotel deals. Get FREE alerts now. https://t.co/3TyQ0ci8FT https://t.co/sNe7kutrxI"""
305,2020-11-01 09:06:51+00:00,b'mikir banget #StartUpEp5 \xf0\x9f\x98\xad'
306,2020-11-01 09:04:55+00:00,b'Emang ya Bisnis tuh gak bakal jalan tanpa partner... \n\n#StartUpEp5'
307,2020-11-01 09:01:52+00:00,"b'fak eps 5 seru banget tapi gue masih penasaran si bapak"" itu siapa #StartUpEp5'"
308,2020-11-01 08:57:33+00:00,b'HAHHAHAA \xf0\x9f\x98\x82\xf0\x9f\x98\x85\n#startup #StartUpEp5 https://t.co/czTdEhNUa1'
309,2020-11-01 08:47:28+00:00,"b'#StartUpEp5 dimulai dengan aku mau nangis gara-gara haelmoni sama Han Ji-pyeong. dahla, kalau mereka berdua bareng tu rasa-rasanya emang harus kudu pake nangis deh (?).\n\nDal-mi &amp; Do-san yang semakin menggemaskan juga bikin senyum2 sendiriiikk.'"
310,2020-11-01 08:46:09+00:00,b'tttapi untung ad alex \n#StartUpEp5 https://t.co/1LNgiT3wVp'
311,2020-11-01 08:46:06+00:00,b'sebel bgt ni bapaknya napa si tibatiba jd juri \xf0\x9f\x98\xa1\n#StartUpEp5 https://t.co/qZ88CaJkrl'
312,2020-11-01 08:45:12+00:00,b'Jung sa-ha itu lawyer yang oleng pengen jadi UI/UX designer maksudnya ya? Penasaran bangetlah sama karakter dia #StartUpEp5 https://t.co/kRJy1dewPD'
313,2020-11-01 08:45:02+00:00,b'Ganda ni Jung Sa Ha \xe2\x98\xba #StartUpEp5'
314,2020-11-01 08:32:20+00:00,b'ini seodalmi jualan ga jls business modelnya apa deh \xf0\x9f\x99\x83\xf0\x9f\x99\x83\xf0\x9f\x99\x83\xf0\x9f\x99\x83\xf0\x9f\x99\x83 #StartUpEp5'
315,2020-11-01 08:31:36+00:00,b'Jadi mentor 3 hari 2 malem terus sakit 4 hari 3 malem pun dijabanin baut dalmi mah \xf0\x9f\x98\xad jipyeong best boy \n#StartUp #\xec\x8a\xa4\xed\x83\x80\xed\x8a\xb8\xec\x97\x85 #StartUpEp5 #suzy #dalmi'
316,2020-11-01 08:30:16+00:00,b'Walau Ji Pyeong manis bnget tpi Dalmi Dosan itu satu paket dan saling mengisi Dosan yg pintar tp gk py ambisi ketemu Dalmi yg gk py spect yg tinggi tp py keberanian dan semngat juang yg tinggi jadi mereka saling membutuhkan satu sma lain untuk maju \n#StartUpEp5 https://t.co/qd6lhxUfHy'
317,2020-11-01 08:27:58+00:00,"b'Untung Jipyeong bukan gue, karna kalo gue jipyeong, yg gue samperin sudah pasti bukan Neneknya Dalmi tapi Emaknya. \xf0\x9f\x98\x82\xf0\x9f\x98\x86\xf0\x9f\x99\x8f Ampun Bunda!!! \xf0\x9f\xa4\xa3\xf0\x9f\xa4\xa3 #StartUpEp5 #StartUp https://t.co/JF3Ei6qwoc'"
318,2020-11-01 08:27:43+00:00,b'Kim Seonho ganteng banget amjay ! Pengen nikah sama kim seonho aja #StartUpEp5'
319,2020-11-01 08:22:39+00:00,"b'Setelah liat #StartUpEp5 jadi antara galau dan goyah milih dosan apa pak han \xf0\x9f\xa4\xa3 dosan makin kesini nunjukkin keseriusan sama dal mi, dari awal ketemu sih aslinya \xf0\x9f\xa4\xad trus bener2 ngabangun semua sama dalmi dari 0. Karakter innocentnya bikin ikutan senyum2 \xf0\x9f\xa5\xb0 https://t.co/Vhz0Y41z6Q'"
320,2020-11-01 08:22:02+00:00,"b'#StartUpEP5 #StartUp aku kok tiba2 ada filing nanti neneknya dalmi meninggal... plis jangan deeehhh... aku gak sanggup liaknyaaa, semoga tidak terjadiii\xf0\x9f\x98\xad\xf0\x9f\x98\xad\xf0\x9f\x98\xad'"
321,2020-11-01 08:21:42+00:00,b'Belom selesei nonton #StartUpEp5 \nKenapa pakai Framework deep learning theano ya?'
322,2020-11-01 08:19:27+00:00,b'setelah nonton #StartUpEp5 makin gemes banget sama dosan hehe'
323,2020-11-01 08:19:12+00:00,"b""emang #StartUpEp5 tuhh sebaguuuus itu sihhhh :') https://t.co/ReIzkPMLGB"""
324,2020-11-01 08:17:55+00:00,b'han ji pyeong... mianhae... #StartUpEp5 https://t.co/AWU1QG6Om9'
325,2020-11-01 08:17:51+00:00,"b'Suka bgt sm drama ini, bnyk bgt pelajaran yg bisa diambil termasuk hal2 kecil.Seo dal-mi, Nam so dam, Han ji-pyeong semua karakter ini bagus bgt, menggambarkan bagaimana cara untuk meraih mimpi. #StartUp #StartUpEp5 https://t.co/DSz22D8Of9'"
326,2020-11-01 08:17:34+00:00,"b""You're my sunshine sunshine all the day~ nyanyi \nLagi nya nempel banget \nSiapa yg udah nonton #StartUpEp5?"""
327,2020-11-01 08:17:12+00:00,"b'#StartUpEp5 Aku seneng pas bagian presentasi. Dalmi sakses ngejelasin model bisnis samsan tech, dan malah gak teknis teknis banget dia ngejelasin.'"
328,2020-11-01 08:16:48+00:00,b'Perasaam campur aduk banget abis nonton #StartUpEp5 ini :( https://t.co/i7UTHXShkb'
329,2020-11-01 08:15:21+00:00,b'Wagelasih eps.5 #StartUpEp5'
330,2020-11-01 08:13:00+00:00,"b'#StartUpEp5 dengan formasi dalmi sebagai hustler, dosan sebagai hacker, dan si pengacara sapa namanya tu sebagai hipster. Terus lagi lagi kan han jipyong pakek nyamar lagi nyuruh pegawenya jadi mentor. Hiiiiih.'"
331,2020-11-01 08:07:09+00:00,b'Bapaknya: ayo cerita yg bagus2 ttg Dosan\nJatohnya malah ngakak\n#StartUpEp5 \n#StartUp https://t.co/VeObwbkFKl'
332,2020-11-01 08:00:43+00:00,"b'Balas dendam paling efektif, ya membuktikan bahwa mereka salah.\n\n#StartUpEp5 #KangHanna https://t.co/581L7zpF10'"
333,2020-11-01 08:00:22+00:00,b'MONMAP SUKA BANGET DALMI DOSAN DI #StartUpEp5 makin seru sih. Kita liat sih si alex ini bakal bener2 nolong dalmi dosan atau ngga \xf0\x9f\xa4\x94\xf0\x9f\xa4\x94\xf0\x9f\xa4\x94'
334,2020-11-01 07:57:28+00:00,b'Injae sayang.. semakin ke sini kamu makin mirip Mama kamu ya nak. Bunda daftarin Take Me Out mau gak?  #StartUpEp5 https://t.co/kb4lo2rKNo'
335,2020-11-01 07:56:04+00:00,"b'Woah... Mbak JUNG Soo-jung glowing amat ya, apalagi ditambah pake seragam gitu. Cakep bener.\n\n#Search #StartUpEp5 #StartUp #18Again #kdrama #KMovie #KrystalJung #jungsoojung https://t.co/Sey2D3fD2V'"
336,2020-11-01 07:54:41+00:00,b'DINGIN SEKALI!!!!! \xf0\x9f\xa5\xb6\xf0\x9f\xa5\xb6\xf0\x9f\xa5\xb6 #StartUpEp5 https://t.co/TZZJPlGIXR'
337,2020-11-01 07:54:17+00:00,b'Halmeoni lah yang dari awal mengajarkan kasih sayang pada Ji-pyeong \xf0\x9f\x98\xad\xf0\x9f\x98\xad\xf0\x9f\x98\xad\n\n#StartUpEp5 https://t.co/qqbu4TQLJr'
338,2020-11-01 07:53:19+00:00,"b'not a really good episode, aga kesel sm nam dosan but mungkin disitu bakal ada character development yaa. masi di team dalmi-jipyeong!! tp keliatan bgt sutradaranya bikin jipyeong sadboi #StartUpEp5 https://t.co/q9OLyN2tDK https://t.co/vnnHVdjpkG'"
339,2020-11-01 07:51:20+00:00,b'Makin seru ya\xf0\x9f\x98\xad\n#StartUpEp5 https://t.co/9lylsC95Dq'
340,2020-11-01 07:50:47+00:00,"b'tim nam do san, tapi ikut potek #StartUpEp5 https://t.co/RQhaUkIBM0'"
341,2020-11-01 07:50:29+00:00,b'2lead syndrome bgt\xf0\x9f\x98\xa9\n#StartUpEp5\nhttps://t.co/GB2mwQnxCA'
342,2020-11-01 07:48:06+00:00,b'Neneknya baik bangeett dari awaall..emang pantes Dal mi nya jadi anak baik juga..\n\xf0\x9f\x98\xad\xf0\x9f\x98\xad\n#StartUp #StartUpEp5 https://t.co/VPNulcahck'
343,2020-11-01 07:47:37+00:00,b'Team Han Ji Pyeong! \xf0\x9f\x98\x85\xf0\x9f\x98\x8d #StartUpEp5 https://t.co/bkO0ONcbXI'
344,2020-11-01 07:47:28+00:00,"b'#StartUpEp5 tambah yakin teamdosan. Jipyeong ciut duluan takut ketauan, ya emg ketauan jg kenapa? dalmi nerima gak ada protes sama sekali pas tau dosan gak sesukses itu. Dalmi juga spertiny bs terima kalau sbnrnya dia yg tulis surat bukan dosan.'"
345,2020-11-01 07:43:00+00:00,b'Perih mas \xf0\x9f\x98\xad\xf0\x9f\x98\xad\xf0\x9f\x98\xad\n#StartUpEp5 https://t.co/DIwidapPlr'
346,2020-11-01 07:40:39+00:00,b'Menolak keras Han Ji Pyeong menjadi sadboy seperti Kim Jung Hwan \xf0\x9f\x98\xa4\xf0\x9f\xa5\xba\n#StartUpEp5 https://t.co/1xIq9kzAMr'
347,2020-11-01 07:38:05+00:00,b'ang kyut \xf0\x9f\xa5\xba\xf0\x9f\x92\x97 #StartUpEp5 https://t.co/QI4tmswZRM'
348,2020-11-01 07:37:21+00:00,"b'Kalooy ba nimo uy, pesteng yw SLS \xf0\x9f\x98\xad #StartUpEp5 https://t.co/Kye6sRsEjd'"
349,2020-11-01 07:36:55+00:00,"b'Apakah Nam Dosan yang memeluk Dalmi duluan? Tidak. Dalmi yang melompat ke pelukan Dosan si Budha hidup yang canggung dan polos ini. Kenapa membuat kesan seolah Dosan jahat,hey betina sebelah\xf0\x9f\xa4\xac\xf0\x9f\xa4\xac #StartUpEp5 https://t.co/Jnujv0AoQe'"
350,2020-11-01 07:36:44+00:00,b'Kena SLS akutu...\n\nKayanya aku emang suka kalo pemainya uda mapan gt...\n\n#StartUpEp5'
351,2020-11-01 07:31:02+00:00,b'iyak tayo sa #StartUpEp5 hahahaha cutie ng show na \xe2\x80\x98to kainis haha'
352,2020-11-01 07:28:53+00:00,"b'bangg help me,,  gua potek mulu banggg\xf0\x9f\x98\xad\xe2\x9d\xa4\n#StartUpEp5 #HanJipyeong https://t.co/hGRU4E8pRX'"
353,2020-11-01 07:27:58+00:00,b'Gagi umurong yung lungkot ko HAHAHAHAHAHAHAHAHAHA\n\n#StartUpEp5 #StartUp https://t.co/X3UGVGRFHB'
354,2020-11-01 07:15:18+00:00,b'Sekenlid ini terlalu sempurna untuk jadi sekenlid \n#StartUpEp5 #StartUp https://t.co/PeNZVUiu8n'
355,2020-11-01 07:13:05+00:00,b'Bukan penggemar drakor tapi ku nge-ship Ji Pyeong sama Dalmi pokoknya. Soalnya suka kesel sama kebodohan Do San. Ngambil keputusan aja ga bisa dan suka insekyuran dia hahaha #StartupEp5'
356,2020-11-01 07:12:56+00:00,b'aku tidak pernah menyesali keputusanku\n#StartUpEp5 https://t.co/u7DzGsfsJ9'
357,2020-11-01 07:12:02+00:00,b'Yung ikaw lagi Ang gumagawa ng paraan para sa lagi syang masaya at okay. Tapos sa ibang Tao napupunta Yung credits. \xf0\x9f\x98\xad.  #StartUpEp5 https://t.co/2hhhlDmt4W'
358,2020-11-01 07:09:33+00:00,b'My Twins.. \xf0\x9f\x8c\x88\n\nAbis nonton drama #StartUpEp5 sumpah nangis dan bangga mulu ama pesan ceritanya. SALUTT !!! Pengen karakter kaya dalmi yang slalu positif ngadepin Hidup walo gak punya Apa2. Dan terus percaya sama semua keputusan yg kita ambil gak pernah salah. .. \xf0\x9f\x98\xad\xf0\x9f\x98\xad\xf0\x9f\x98\xad\xf0\x9f\x91\x8d https://t.co/YqnxlhrQPn'
359,2020-11-01 07:07:40+00:00,b'Masih jadi best part \xf0\x9f\x98\xad\n#StartUp \n#StartUpEp5 https://t.co/69QPvcMCB3'
360,2020-11-01 07:07:39+00:00,"b""Pengen aplod ini :') #StartUp #StartUpEp5 https://t.co/tZOoR6aJjp"""
361,2020-11-01 07:05:38+00:00,b'Gabisa liat ke-uwu-an dalmi-dosan. Tp gabisa juga mengabaikan ji pyeong gimana dong:( #StartUpEp5 https://t.co/56NyaiQBqU'
362,2020-11-01 07:04:12+00:00,b'Semoga cuman plot twist #StartUpEp5 https://t.co/8B0Wcn0hwF'
363,2020-11-01 07:03:15+00:00,b'drakor ini mengandung bawang\xf0\x9f\x98\x8d\xf0\x9f\x98\xa2\n#StartUpEp5 https://t.co/U2PF7332KE'
364,2020-11-01 06:59:08+00:00,b'Pelukan kebahagiaan \n#StartUpEp5 https://t.co/LGQ4NCJl7K'
365,2020-11-01 06:58:57+00:00,"b'Makanya, ya, Om Ji-Pyeong. JUJUR DONG SAOLOHHH HIHHHHHH. Kudu diingetin Do-San dulu baru tertampol. Ah kalian berdua sama aja rupanya. \xf0\x9f\x98\x82\xf0\x9f\x98\x82\xf0\x9f\x98\x82\xf0\x9f\x98\x82 \n#StartUpEp5 #StartUp https://t.co/rFp4sDhN77'"
366,2020-11-01 06:58:28+00:00,b'Kenapa gue bisa sebucin itu yaa sama han ji pyeong padahal sama seonhonya b aja haha\n\n#StartUpEp5 #StartUp https://t.co/yQHQ9P1OgJ'
367,2020-11-01 06:57:41+00:00,"b'Emang, ya, kalau sudah cinta tuh tahu banget cara jelasin dunianya ke gebetan dg bahasa mudah dipahami. Analoginya Tarzan-Jane banget. Iya tapi Jane yg ini sudah terlatih tentunya. \xf0\x9f\x98\x82\xf0\x9f\x98\x82 #StartUp #StartUpEp5 https://t.co/aiyw0DpH7e'"
368,2020-11-01 06:52:54+00:00,"b'Di #StartUpEp5 Ini udah mulai nih bisnis nya tentang teknologi tulisan tangan, berarti nanti dosan ketauan boong dong? Tp liat d previewnya keliatannya dosan mau jujur? Yoo dosan jujur aja yook biar ga manjang urusannya, km juga bener2 suka kan sama dalmi?'"
369,2020-11-01 06:52:15+00:00,"b'Kenapa sih gue mesti mewek pas bagian mereka \xf0\x9f\x98\xad\xf0\x9f\x98\xad\xf0\x9f\x98\xad\n\nAbang baik, udah jadi sama gue aja gausah sama dalmi \xf0\x9f\xa4\xa7\xf0\x9f\xa4\xa7\n\n#StartUp \n#StartUpEp5 \n#dramakorea https://t.co/cSOhQSimUG'"
370,2020-11-01 06:48:25+00:00,"b'dia yg presentasi, w yg deg-degan \xf0\x9f\x98\x82 makin seruuuw!\n#StartUpEp5 https://t.co/JtTIgLS9Aa'"
371,2020-11-01 06:46:21+00:00,b'Mati lampu tepat setelah selesai nonton #StartUpEp5 huhuhu pas bgt'
372,2020-11-01 06:45:36+00:00,b'@Cupcakes9916 Tim #DalmiDosan berlayar\xe2\x9d\xa4\xe2\x9d\xa4\n#StartUpEp5'
373,2020-11-01 06:44:25+00:00,b'Part ini lebih nyesek &amp; lebih bawang drpd part lain di eps 5 \xf0\x9f\x98\xad\n\n#StartUpEp5 https://t.co/U9g96wIAsz'
374,2020-11-01 06:42:24+00:00,b'HanJiPyeong sanggup melabur nk bg DalMi settle presentatio..dua ketul San ni mmg yihhh hahahah ..typical jantan suka look down kt perempuan cm DalMi #StartUpEp5 #teamHanJiPyeong #mamatPyeonJi'
375,2020-11-01 06:38:14+00:00,"b'JUJUR GUA POTEK, DAN GA TEGA BGT LIAT JI PYEONG DI POSISI SANA karna emg dia yg dr dl ngehibur dalmi\xf0\x9f\x98\xad\xf0\x9f\x92\x94\n#StartUpEp5 https://t.co/JKgHWtwXHa'"
376,2020-11-01 06:33:30+00:00,b'Terlalu baper ya allah.. #StartUpEp5 kuselalu terharu'
377,2020-11-01 06:31:44+00:00,b'sedih bgt im in spain but the s is silent #startupep5'
378,2020-11-01 06:27:56+00:00,b'#StartUpEp5 Han Ji Pyeong cuts https://t.co/jJazdOzRPc'
379,2020-11-01 06:27:51+00:00,"b'Ini kalo aku diposisi Dal Mi auto sholat istikharah, minta petunjuk biar nggak bingung memilih. \xf0\x9f\x98\x86\n#StartUpEp5'"
380,2020-11-01 06:25:31+00:00,b'Nonton #StartUpEp5'
381,2020-11-01 06:25:17+00:00,b'- akhirnya writternim di #StartUpEp5 udah mulai nunjukin character development dosan. Attention yg dia dapet di ep 5 meningkat drpd episode2 sebelumnya'
382,2020-11-01 06:23:25+00:00,"b""- minusnya jipyeong lagi tu dia selalu menghindari dalmi. Why? U hv to be brave good boy. \nJipyeong cuma bisa support dr belakang dalmi gaberani hadepin doi, sedang dosan selalu ada disamping, didepan, dan dibelakang dalmi.\n\nThat's why he couldn't get her heart\n#StartUpEp5"""
383,2020-11-01 06:21:17+00:00,b'Untuk pertama kalinya dalam hidup Nam Do San dia punya ambisi.\n.\n.\n.\n.\n\nMba Seo Dal Mi .\n#StartUp #StartUpEp5 https://t.co/JWogHhfqqz'
384,2020-11-01 06:20:31+00:00,b'SCREAMINGGGG SUZY &amp; JOOHYUK HUG \xf0\x9f\x98\xad \xf0\x9f\xa5\xba #StartUpEp5 https://t.co/cqjrbIUT3H'
385,2020-11-01 06:18:54+00:00,b'Seo Dal Mi \xf0\x9f\xa4\x9d Jung Sa Ha\n\n#StartUpEp5\n#StartUp\n#\xec\x8a\xa4\xed\x83\x80\xed\x8a\xb8\xec\x97\x85 https://t.co/tfDOnXBIbV'
386,2020-11-01 06:17:42+00:00,b'Mas Jipyeong Dosan berantem merebutkan\nTeh Dalmi \xe2\x9d\x8c\nCamilan gratis Sand Box \xe2\x9c\x85\nJipyeong Dosan till jannah\xf0\x9f\x98\x82\nWhahaha ni bedua juga kalau dah temu bobrokk bangettt\xf0\x9f\x98\xad\xe2\x9c\x8a\n#StartUp #StartUpEp5\n#\xec\x8a\xa4\xed\x83\x80\xed\x8a\xb8\xec\x97\x85 https://t.co/AK3JAQ5JAZ'
387,2020-11-01 06:15:27+00:00,"b'""... bagian tergawat dari nonton drakor adalah ia membuatku ingin jatuh cinta juga."" -@BapaknyaRico \n\nLah iya. Liat mereka pegangan tangan dan sampai pelukan gini. Jadi pengin jatuh cinta. Tapi sama siapa \xf0\x9f\x98\xad\xf0\x9f\xa4\xa3 #StartUpEp5 #StartUp https://t.co/hFr19wa0nm'"
388,2020-11-01 06:09:59+00:00,b'JiDal moment\xf0\x9f\x98\xad\xf0\x9f\x98\xad\xf0\x9f\x98\xad\n\n#StartUpEp5 https://t.co/F7UvuvqPvJ'
389,2020-11-01 06:09:36+00:00,"b'ngeship Han-Dal Mi akutu :"""""" #StartUpEp5'"
390,2020-11-01 06:07:50+00:00,b'Pengen banget masuk Sand Box\nLingkungannya seru\xe2\x9d\x8c\nMakan camilan gratis sepuasnya\xe2\x9c\x85\nsamsan kin hari bobrokkk bikin bengek muluuu\xf0\x9f\x98\xad\xf0\x9f\x98\xad\xe2\x9c\x8a\n#StartUp #StartUpEp5\n#\xec\x8a\xa4\xed\x83\x80\xed\x8a\xb8\xec\x97\x85 https://t.co/0pKxLjBipf'
391,2020-11-01 06:02:54+00:00,"b'Mati listrik. Hujan. Batre hp abis, belum nonton #StartUpEp5 \xf0\x9f\x99\x81'"
392,2020-11-01 05:59:55+00:00,"b'Setelah Dream High, gue mempan dari Second Lead Syndrome..\nMenurut gue gak ada yg seSadboi taecyeon #StartUpEp5 https://t.co/nBUekUYYi5'"
393,2020-11-01 05:59:54+00:00,b'lampu mati :( lagi ena-enanya liat nam do-san padahal #StartUpEp5'
394,2020-11-01 05:56:32+00:00,b'Menangkan Yamaha NMAX dan kumpulkan Air 2x lipat dari teman di Shopee Tanam https://t.co/HcK84hbbLT\n#RedVelvet #umudumuzvar #pasarmingguinfomalang #propaganda #StephaniePoetri #StartUpEp5 #StartUp #DayanSeda #GFVIP #ShopeeID #Shopeetanam #KeralaPiravi #ChanyeolMinimalWarm https://t.co/E9fxZgyX68'
395,2020-11-01 05:55:22+00:00,b'kayanya gw lagi pms karena gue udah tiga kali nangis #StartUpEp5'
396,2020-11-01 05:53:39+00:00,b'Part ini sih nangis bet \xf0\x9f\x98\xad\xf0\x9f\x98\xad\nHan Ji Pyeong best man \xf0\x9f\x98\xad\n\n#StartUpEp5 https://t.co/mhjjDDwPcH'
397,2020-11-01 05:51:59+00:00,b'Bengek bgt liat trio ini\xf0\x9f\x98\xad\xf0\x9f\x98\xad\n#StartUpEp5 https://t.co/sPHCc7LRU4'
398,2020-11-01 05:50:20+00:00,b'Huee baru selesai nonton\nAsli gemas bgt #StartUpEp5'
399,2020-11-01 05:50:11+00:00,b'Aku pas nonton #StartUpEp5 gak keroso nek ndang rampung. Syukaaaa.. Mbak Suzy yo \xf0\x9f\x91\x8d\xf0\x9f\x91\x8d'
400,2020-11-01 05:49:23+00:00,b'[Suzystagram] 201101 @Suzy (skuukzky)\n\nSamsan Tech \xf0\x9f\x98\x8d\n\n\xf0\x9f\x94\x97 https://t.co/D5cVACDZmj\n\n#StartUpEp5 #StartUp https://t.co/0XUXUQeiYk'
401,2020-11-01 05:46:30+00:00,b'Dua Anggotanya Jadi Tersangka Ini Kata Humas HOG SBC https://t.co/PWViYsv27v \n\n#salingkaluak #moge #bukittinggi #HarleyDavidson #sumbar #ranahminang #polisi #tni #StartUpEp5 #ranahminang'
402,2020-11-01 05:45:02+00:00,"b'Memang ya yang diawal terkadang terlupakan dengan yang di akhir..karena harus seimbang, ada di awal juga harus ada di akhir\n#StartUpEp5 https://t.co/KvlbtSRa2w'"
403,2020-11-01 05:43:14+00:00,"b'Padahal mau nonton #StartUpEp5 \n\nSoalnya aku nonton sama suami, jadi no drakor\n\nYang aku tonton: His House, Ghost Stories (Netflix Original), Nobody Sleeps In The Woods Tonight'"
404,2020-11-01 05:43:04+00:00,b'Tiba2 kepikiran entar gimana akhir dari mereka :((( takut bgt gue \xf0\x9f\xa5\xba msh ep 5 loh #StartUpEp5 https://t.co/zbgC5ON5Yg'
405,2020-12-13 17:00:01+00:00,b'Next year could be decisive for the world \xf0\x9f\x8c\x8f. 2020 has taught us that we need to work together for a stronger response and show that we can build back better.\n\nJoin in. Be the change.'
406,2020-11-01 05:42:49+00:00,b'maap aku bengek \xf0\x9f\x98\xad #StartUpEp5 #StartUp https://t.co/ueq3Z9WQoR'
407,2020-11-01 05:41:30+00:00,"b""Setelah trauma nonton reply98 krn shipping second lead. Di #StartUpEp5 i'm all the way for DOSAN! Cowo sederhana, ga neko2 padahal super duper smart punya high potential dan kind hearted \xf0\x9f\xa5\xb0\xe2\x9c\xa8\xf0\x9f\x98\x9a"""
408,2020-11-01 05:41:28+00:00,"b'Pak han adalah puja yg ngirim surat ke raj, tapi raj lebih milih tina \xf0\x9f\xa5\xba tapi ending film india lebih realistis sih #StartUpEp5 https://t.co/12LPAwDEGO'"
409,2020-11-01 05:38:45+00:00,b'bagian tergawat dari nonton drakor adalah ia membuatku ingin jatuh cinta juga. padahal ak tahu jatuh cinta itu masokis #StartUpEp5'
410,2020-11-01 05:36:28+00:00,b'Mungkin ga sih file yang dikasi Injae ke Dosan tu emang file tulisan tangan asli? dan AI nya Samsan Tech akurat mendeteksinya. Soalnya si kembar tu ga mau tos2 an ama temen se-tim \xf0\x9f\xa4\x94 #StartUpEp5'
411,2020-11-01 05:35:16+00:00,b'Bocah yg di ayunan itu Dalmi kan? Injae ngaku2 tuuhhhhhhhhhhhhhhhhhhhhh \n\n#StartUpEp5'
412,2020-11-01 05:33:07+00:00,"b'Nam Do-San for Soe Da-lmi\n.\nHan Ji-Pyeong ngalah aj, lagain ngapain bohong\xf0\x9f\x98\x82.\n.\n#StartUpEp5 #StartUp https://t.co/BtwjYmKHJz'"
413,2020-11-01 05:32:34+00:00,b'Udh nton 3* episode 5 \xf0\x9f\xa4\xad bucin maksimal aku ama dodal #StartUpEp5'
414,2020-11-01 05:32:18+00:00,"b'Pahinging talino do san ,kailangan ko nyan sa cs hahahahah\n#StartUpEp5 https://t.co/uugxhOTy0C'"
415,2020-11-01 05:26:35+00:00,b'suka bgt scene ini gemoi tpi ji pyeong kasian:(( #StartUpEp5 https://t.co/6RhEQfRPaX'
416,2020-11-01 05:23:52+00:00,b'pengen juga start up di dunia bisnis grgr ni drama \xf0\x9f\x98\xad\xf0\x9f\x91\x8d #StartUpEp5 https://t.co/y01CqMFV9m'
417,2020-11-01 05:15:42+00:00,"b'Kalo ibarat pemaen bola, Han Ji Pyong = Ibrahimovic. #StartUpEp5 https://t.co/kgB0UyYot7'"
418,2020-11-01 05:10:06+00:00,b'Ji Pyeong \xf0\x9f\x98\xad\xf0\x9f\x98\xad habis drama ini fiks harus jadi pemeran utama yaaak makin lancar luncur laris manis ngedrama #StartUpEp5 #KimSunHo https://t.co/c1lbGqAy8L'
419,2020-11-01 05:09:07+00:00,b'udah jan berisik mari kita mulai #StartUpEp5'
420,2020-11-01 05:07:55+00:00,"b'Udahlah Dalmi sama Dosan aja, biar Mr. Han sama aku \xf0\x9f\x98\x8c #StartUpEp5 https://t.co/fJkDjNmG11'"
421,2020-11-01 05:07:40+00:00,b'im soft to these team \xf0\x9f\xa5\xba\n\nuser skuukzky lang malakas huhu\n#StartUp #StartUpEp5 https://t.co/wyO7BL4UvJ'
422,2020-11-01 05:07:37+00:00,b'Duh sayang bgd sama kalean. Minus our mentor Mr. Han\n#StartUp #StartUpEp5 https://t.co/1bhGpkcVZN'
423,2020-11-01 05:07:29+00:00,b'Mewek episode ini \xf0\x9f\x98\xad\xf0\x9f\x98\xad\n#StartUpEp5 https://t.co/JHmi0s5NWR'
424,2020-11-01 05:06:43+00:00,"b'As always, selalu ada scene yg mengandung bawangnya \xf0\x9f\xa5\xba\n#startupEp5 https://t.co/zy7wYEcvC6'"
