,Date,Tweet
425,2020-11-01 05:06:18+00:00,"b'Adoiii mcm mana ni..\n\nDua2 aku suka utk Dalmi\n\nDosan ok, Jipyeong pun ok\n\nWriternim please make duplicate dalmi, so both of them can have Dalmi..hahaha\n\nBtw best sgt #StartUpEp5 \xf0\x9f\x91\x8d\xf0\x9f\x91\x8d\xf0\x9f\x91\x8d\nGentlemen Dosan bila bagi peluang Dalmi nak bg pendapat\n\n#StartUp'"
426,2020-11-01 05:04:12+00:00,"b'sebagai tim seken lit tapi juga first lit, disini ku sedih melihat ji pyeong tp ikut bahagia melihat do san bahagia\n#StartUpEp5 https://t.co/Le1MPaBvty'"
427,2020-11-01 05:00:56+00:00,b'Bisa2nya pelukan di depan mentor #StartUpEp5 https://t.co/obsaou6nt2'
428,2020-11-01 04:57:24+00:00,b'Saya sangat khawatir bun.\n\n#StartUpEp5 https://t.co/qKPvUJE92L'
429,2020-11-01 04:56:27+00:00,"b'@sanctuarih @jiemiardian Warga kdramaland emg udh kebiasaan kok ngeramein/ributin kopel drama. Tp percayalah, kita nikmati semua alurnya dg baik. Hy saja memang, yg bahas tim romance lebih vokal dan semangat ngtwit \xf0\x9f\xa4\xa3 #StartUpEp5'"
430,2020-11-01 04:56:11+00:00,b'Preview eps 6 start up in jae nya mau dibantu atas nama bpk kandungnya masa :( #StartUpEp5'
431,2020-11-01 04:55:24+00:00,"b'Omg Samsan tech squad!!! Ah cuteeee (Yongsan, Saha, Chulsan, Dosan, Dalmi) \n\nhttps://t.co/elEAVFtDc2\n\n #StartUpEp5 #StartUp https://t.co/cXZ53OvvwL'"
432,2020-11-01 04:54:58+00:00,"b'Kok gue kesel ya ,, ada yg sama ????  #StartUp\n#StartUpEp5 https://t.co/U5KAcPgesB'"
433,2020-11-01 04:53:38+00:00,"b'Suka Dalmi waktu sama Dosan, tapi Han Ji Pyeong harus bahagia ga harus sama Dalmi \xf0\x9f\x98\xad#StartUpEp5'"
434,2020-11-01 04:52:42+00:00,"b'Awwee, Samsan Tech, fighting!!! \xf0\x9f\x92\x96\n\n\xf0\x9f\x93\xb7 skuukzky ig\n\n#StartUpEp5 #StartUp #Suzy https://t.co/ZChxVvIFlU'"
435,2020-11-01 04:52:32+00:00,"b'Dari awal tau drakor sudah terbiasa dengan second lead syndrom, tpi klo yg ini kykny gakuat bgt \xf0\x9f\x98\xad\xf0\x9f\x98\xad\xf0\x9f\x98\xad\n\n#StartUpEp5'"
436,2020-11-01 04:51:28+00:00,b'*SPOILER ALERT* Momen Menangis(2) bukti PENYESALAN selalu datang TERLAMBAT #StartUpEp5 #StartUp https://t.co/T6S6dcNP7h'
437,2020-11-01 04:49:16+00:00,b'Dalmi diantara para tiang \xf0\x9f\x98\x82\n\n#StartUpEp5 https://t.co/yRuyvdwjAV'
438,2020-11-01 04:45:46+00:00,"b'Dal Mi yg presentasi ane yg deg""an.\n#StartUpEp5'"
439,2020-11-01 04:42:28+00:00,b'Nonton #StartUpEp5 . Dalam hati mikir agak2 kurang make sense bikin aplikasi spt itu dalam 2 hari.\n\nPas dosan test gagal baru deh masuk akal. Yakali ngoding 2 hari langsung sempurna tanpa bug \xf0\x9f\x98\x8b'
440,2020-11-01 04:40:57+00:00,"b'""Akulah orang yang kan selalu mengawasimu,\nMenikmati indahmu dari sisi gelapku""\n\n#nowplaying Sheila on 7 - Pemuja Rahasia. #StartUpEp5 https://t.co/cSfzPlrynE'"
441,2020-11-01 04:40:16+00:00,b'huweeee menengos \xf0\x9f\x98\xad\xf0\x9f\x98\xad\xf0\x9f\x98\xad\n#StartUpEp5 https://t.co/Rw6D1FPab5'
442,2020-11-01 04:39:53+00:00,"b'Dosan himself is adorable person, tptptp kalo msk ke jalan cerita percintaannya gw team jipyeong all the way tp kzl krn smua ini jg salah jipyeong yg cemen knp dia ga came out aja dr awal \xf0\x9f\x98\xad\xf0\x9f\x98\xa3 #StartUpEp5 :"") #meracau'"
443,2020-11-01 04:34:49+00:00,b'Scene yg ada blio ini doang yg bikin gua menangos \xf0\x9f\xa4\xa3 #StartUpEp5 https://t.co/d5Nf5BNQyu'
444,2020-11-01 04:34:38+00:00,"b'#StartUpEp5 Dal mi yg presentasi, gua yg degdegan, tapi semakin kesini semakin seru dan menarik buat ngelanjutin nonton ini drakor'"
445,2020-11-01 04:34:10+00:00,b'#StartUpEp5\npas mereka pelukan\xf0\x9f\xa5\xb0\xf0\x9f\x98\xad\xe2\x9d\xa4\xf0\x9f\xa5\xb3\nmelihat han jipyeong \xf0\x9f\x98\xad\xf0\x9f\x98\xad\xf0\x9f\xa4\xa7\xf0\x9f\x98\xad https://t.co/UwqUvNlsEI'
446,2020-11-01 04:33:38+00:00,b'aku kalo ketemu temen fake ku gini bgttt hahahah \n\n#StartUp #StartUpEp5 https://t.co/V7WB3DWden'
447,2020-11-01 04:33:00+00:00,b'Nakakalungkot din. \xf0\x9f\x98\xa3 Ikaw yung naging daan para magkakilala yung dalawang tao. - Mr. Han \xf0\x9f\x92\x94 \n#StartUpEp5'
448,2020-11-01 04:32:24+00:00,b'Aku abis nonton #StartUpEp5 .\n\nKasian Jipyeong aku tuh https://t.co/i5Py2JnnaY'
449,2020-11-01 04:30:19+00:00,b'suzy kalo main drama emang tdk mengecewakan gais #StartUpEp5'
450,2020-11-01 04:29:58+00:00,b'Inisih devinisi maju kenak mundur kenak mahh\xf0\x9f\x98\xad\xf0\x9f\x98\xad sayang banyak ke ji pyeong tapi gabisa anggurin do san\xf0\x9f\x98\xad lesung pipi Seon Ho dalem banget tapi aura Joo Hyuk berkarisma bangett\xf0\x9f\x98\xad\xf0\x9f\x98\xad astagaa inimah artis talent nya ga ngotak\xf0\x9f\x98\xad\xf0\x9f\x98\xad\n#StartUpEp5\n#StartUp https://t.co/ej1iRwBwbZ'
451,2020-11-01 04:29:50+00:00,b'Nam Dosan dkk pake bahasa apa si ini?\n#StartUpEp5 https://t.co/pqtwMENhP3'
452,2020-11-01 04:29:11+00:00,b'Gua berharap sih Jipyeong bakal seenggaknya confess sama Dalmi kalo sebenarnya Jipyeong emang suka sama dia. Gua paling kesel tipe-tipe 2nd lead yg cuma pasrah aja tanpa berjuang \xf0\x9f\x98\x82\xf0\x9f\x98\x82\n#StartUpEp5 #StartUp'
453,2020-11-01 04:28:42+00:00,"b'#StartUpEp5 part si nenek bilang, menyesal kenapa kita ga ketemu lebih awal. Biar bisa maen gostop, piknik bareng dll. Mewekkk \xf0\x9f\x98\xad'"
454,2020-11-01 04:26:05+00:00,b'habang patagal nang patagal mas lalong gumaganda yung storyyyyy \xf0\x9f\x98\xa2 #StartUpEp5'
455,2020-11-01 04:25:18+00:00,b'Gigl talaga ko sa kapatid ni Seo Dal mi #StartUpEp5'
456,2020-11-01 04:24:19+00:00,b'Kata Do San kalah itu menyenangkan #StartUpEp5'
457,2020-11-01 04:23:18+00:00,b'ok lang talaga ... \xf0\x9f\x98\xa2\xf0\x9f\x91\x8d #StartUpEp5'
458,2020-11-01 04:21:18+00:00,"b'Tegang bgt #StartUpEp5 \xf0\x9f\x98\xad tp serius makin dibuat gini makin seru, cerita Jipyeong sm Halmoni, Dalmi dan Injae and Samsan Troops, plis gausa di drag lebay love trianglenya \xf0\x9f\x98\xad'"
459,2020-11-01 04:18:14+00:00,b'*SPOILER ALERT* Momen menangis #StartUpEp5 \xf0\x9f\x98\xad https://t.co/cQipCccmxt'
460,2020-11-01 04:17:03+00:00,b'bisa gaksih jipyeong endingnya sm seo dal mi aja\xf0\x9f\x98\x8c aaa bener2 meresahkan nih #StartUpEp5'
461,2020-11-01 04:16:22+00:00,b'Pas part ini w ikut degdegan wkwkwk #StartUpEp5 https://t.co/q3J06ba42z'
462,2020-11-01 04:15:06+00:00,b'Jipyeong adalah aku ketika deket sm seseorang tapi dia lebih milih orang lain..\n\n#StartUpEp5 https://t.co/blGGmItNwn'
463,2020-11-01 04:09:53+00:00,b'Pokoknya aku team han ji pyeong\xf0\x9f\x98\xad \n#StartUp \n#StartUpEp5 \n#HanJipyeong \n#KimSeonHo https://t.co/C1bb9x3YZp'
464,2020-11-01 04:08:34+00:00,b'Ninuninuninu \xf0\x9f\x9a\x91\xf0\x9f\x9a\x91bahaya2 eps 6 nam do san kaosan doang #StartUpEp5 https://t.co/0UXx8vVzw7'
465,2020-11-01 04:07:06+00:00,"b'Makin seru nih drakor barunya mba Suzy, sangat recommended! \n\n#StartUpEp5'"
466,2020-11-01 04:07:02+00:00,b'berasa bngt sadboy nya kalau pake backsound ini\xf0\x9f\x98\x82 #StartUpEp5 https://t.co/BkcbUOQGmD'
467,2020-11-01 04:06:39+00:00,"b'ini gw buka jam 6 pagi, dan udah ada subtitle nya doooooong \xf0\x9f\xa4\xa4 emang beda kalo dramanya mbak suzy sama bang skawngur #StartUpEp5 https://t.co/Jbxoqn3qu3'"
468,2020-11-01 04:03:55+00:00,b'#StartUpEp5 ikut deg deg an bgt pas scene ini https://t.co/LzckRilIUZ'
469,2020-11-01 04:03:55+00:00,b'#StartUpEp5\n\nJatuh cinta sama tampang  \xe2\x9d\x8c\nJatuh cinta sama tangan      \xe2\x9c\x94 https://t.co/1jPqhYECl6'
470,2020-11-01 04:02:57+00:00,b'#StartUpEp5\njangan lupa senyum yah\n-Mba Ceo- https://t.co/5PQ2w7q76B'
471,2020-11-01 04:01:14+00:00,b'ngakak bgt scane ini hahahahahahahahah\nkaget\n#StartUpEp5 https://t.co/RZxto9YJXo'
472,2020-11-01 04:00:47+00:00,"b'\xf0\x9f\x8c\xb1Pull Up Crochet Knit Blouse\xf0\x9f\x8c\xb1\n(Choco \xe2\x9d\x8c)\n\nDetail \nBahan :\xc2\xa0Hollow Knit Import\nDetail : Bagian depan model tali serut bisa diatur ketinggian kerutannya &amp; diikat sendiri, Bahan stretch\nSize : LD 94-110 cm, P 50 cm\nBerat : 180 gram\n\nHarga: 94rb \xf0\x9f\x92\xb5\n#StartUpEp5\n#StartUp\n#KimSeonHo https://t.co/MAFdHGObNZ'"
473,2020-11-01 03:59:10+00:00,b'Mewek banget di part ini.\nScene nenek choi sama jipyeong selalu menyentuh \xf0\x9f\x98\xad\xf0\x9f\x98\xad. Nenek choi baik banget napa siiiii \n\nTerima kasih sudah mengulurkan tangan ke jipyeong saat dunia mengabaikan dia \xf0\x9f\x98\xad\xf0\x9f\x98\xad\n#StartUpEp5 https://t.co/5sQyG0BRii'
474,2020-11-01 03:58:14+00:00,"b'Mohon maaf, permisi, tapi dunia hanya milik dosan dalmi, yang lain ngontrak \xf0\x9f\x98\xab\xf0\x9f\xa4\xaf\n#StartUpEp5 https://t.co/qu43PaQkGT'"
475,2020-11-01 03:56:58+00:00,b'Gw baru ngeh ost StartUp ternyata Red Velvet?? Kira gw Suzy yg nyanyi wkwkw. #StartUpEp5'
476,2020-11-01 03:56:21+00:00,b'apa wrinternim tega jadiin pak han segemoy ini jadi sadboi pliss lahh jgn di jadiin sadboi\xf0\x9f\x98\xa9\n\n#StartUpEp5 https://t.co/CAl06sH58r'
477,2020-11-01 03:55:17+00:00,b'otak minimalis ini nasih dibuat penasaran gimana mereka build dan tantangannya apa dalam membngun bisnis mereka #StartUpEp5'
478,2020-11-01 03:52:41+00:00,"b'Mengheningkan cipta, mulai...\n#StartUpEp5 https://t.co/uPsZZVPLBf'"
479,2020-11-01 03:50:49+00:00,b'tolong pd-nim writer-nim jangan  buat han jipyeong jadi sad boy di drama ini. sebagai penonton ga tega aku tuh ngeliatnya\n\n#StartUpEp5 \n#SecondLeadSyndrome https://t.co/2Y8WuN1hrs'
480,2020-11-01 03:50:37+00:00,b'Alex ni keknya tertarik banget ye ma do san #StartUpEp5 https://t.co/slEJrQsfWO'
481,2020-11-01 03:47:02+00:00,b'Bener bener ni drama keren parah sih\n\n#StartUpEp5 https://t.co/sicm647K62'
482,2020-11-01 03:46:36+00:00,b'Gue suka kata-kata dia yg ini\xf0\x9f\xa4\xa9\n#StartUpEp5 \n#StartUp https://t.co/N2aTM9Ak2g'
483,2020-11-01 03:46:14+00:00,b'#StartUpEp5 trending ke 4\n#jipyeong trending ke 15 \xf0\x9f\x98\xad\xf0\x9f\x98\xad\n\nJaipong dirimu trending nakk https://t.co/0Rkvw6MYwK'
484,2020-11-01 03:45:58+00:00,b'Saya juga begitu. Bodoamat sama romancenya soale ketebak dari awal. Justru persaingan Dal-Mi dan In-Jae yg menurutku juga menarik. \n\xf0\x9f\x98\x8d\xf0\x9f\x98\x8d\xf0\x9f\x98\x8d #StartUp #StartUpEp5 https://t.co/MZejL3nucw'
485,2020-11-01 03:45:50+00:00,b'Sakit hati pasti km ji-pyeong\xf0\x9f\x98\xad\n#StartUpEp5 \n#StartUp https://t.co/0tfCD0Z163'
486,2020-11-01 03:44:22+00:00,b'Jipyeong ku yang malang\xf0\x9f\x98\x90\n#StartUpEp5 \n#StartUp https://t.co/0MO6s9WVC8'
487,2020-11-01 03:42:44+00:00,b'gaterima pak han jadi sadboi tapi juga suka sama kapal dalmi-dosan ini gimanasiiiii\xf0\x9f\x98\xad\n\n#StartUpEp5 https://t.co/2KchSdGMNX'
488,2020-11-01 03:42:14+00:00,"b'""Dengan tangan, otak manusia berkembang.. Bisa membuat alat memunculkan kebudayaan dan sejarah"" \xf0\x9f\x98\x87\n\n#StartUpEp5 https://t.co/iecxvW0YRq'"
489,2020-11-01 03:41:19+00:00,"b'#StartUpEp5 kali ini keren banget\xf0\x9f\x98\xad\xf0\x9f\x91\x8d\xf0\x9f\x8f\xbb, penasaran episode selanjutnya gimana huhu https://t.co/qLWICDXRrp'"
490,2020-11-01 03:37:49+00:00,b'Pernah kayak mba Dalmi presentasi produk apps yang dibuat tim sendiri..beda nya gua bukan CEO \xf0\x9f\xa5\xb4 #StartUpEp5 https://t.co/beCSfdkPNf'
491,2020-11-01 03:37:02+00:00,"b'Gw dlm hati blng itu kesempatan terakhir Ji pyeong buat ngaku dan bisa ngambil hati Dal mi karna kalau makin lama dari ini percuma ngaku, Dal mi nya udh terlanjur sama Do san :( Trus disini Ji pyeong mau ngaku tpi dipotong Do san \xf0\x9f\x98\xad\n#StartUp #StartUpEp5  https://t.co/kJzCPm36Ll'"
492,2020-11-01 03:36:14+00:00,b'HKI ITU PENTING UNTUK START UP\nhttps://t.co/HnLy7M4Cev\n#klikhukum #melekhukum #hki #StartUp #StartUpEp5 https://t.co/TgXAcumSWf'
493,2020-11-01 03:36:13+00:00,"b'Walaupun nanti terbongkar ku kira perasaan dalmi ke dosan murni untuk dosan bukan karena suratnya, dalmi akan terluka tentu saja..tp dia gadis tangguh dalmi akan memaafkan jp dan nenek juga dosan. Kebersamaan mengaburkan kebencian \xf0\x9f\x98\x81sok tau \xf0\x9f\x98\x85#StartUpEp5'"
494,2020-11-01 03:34:37+00:00,"b'Sebagai orang yang sama-sama berjuang di kecerdasan buatan, gue dukung Do San. Sebagai orang yang berjuang menjalani kehidupan, gue dukung Pak Han. Sulit.\n\nTapi cewe kayak Dal-Mi memang langka dan layak diperjuangkan. Paket lengkap.\n\n\xf0\x9f\x93\xb7 : nemu\n#StartUpEp5 https://t.co/hPHmYyguLw'"
495,2020-11-01 03:32:31+00:00,"b'gini nih resiko kena sekenlid sindrom, nangis bgt bye \xf0\x9f\x99\x82\n\n#StartUpEp5 https://t.co/9P4LT6aEI3'"
496,2020-11-01 03:31:21+00:00,b'sehat terus nek \xf0\x9f\x98\xad\n#StartUpEp5 https://t.co/0f252NDfPz'
497,2020-11-01 03:31:18+00:00,b'Mumpung trending ada yang mau ikut campaign saling support gak? Nih vt nya\nhttps://t.co/AIzNrju2CQ\n\n #StartUpEp5'
498,2020-11-01 03:30:45+00:00,b'tuhh kan jadi sadboi\xf0\x9f\x98\xad\xf0\x9f\x98\xadgaterima woiii pak han terlalu sempurna buat jadi sadboi\xf0\x9f\x99\x82\xf0\x9f\x94\xab\n\n#StartUpEp5 https://t.co/9DUvJkrriq'
499,2020-11-01 03:27:52+00:00,b'poor ji pyeong\xf0\x9f\x98\x94 gpp aku ttp sm km #StartUpEp5 #Han Ji Pyeong https://t.co/p2cGU30KIt'
500,2020-11-01 03:27:27+00:00,b'kok klean bisa sih team jipyeong-dalmi sedangkan dosan-dalmi segemes ini \xf0\x9f\xa5\xba\naseli aku baper liat mereka lucu banget \xf0\x9f\x98\xad #StartUp #StartUpEp5 https://t.co/TI3NnLa12u'
